username;name;salary;age;total_count;remark
jean_dickinson_4119;Jean Roberts-Dickinson;80.0;13.1;98.2;"""Voluptatum unde: Accusantium quae; Accusantium at"""
barry_johnston_9884;Barry Thompson-Johnston;66.0;41.1;;"""(Facilis) ; Quam architecto and Nemo dolore"""
bernard_scott_8878;Bernard King-Scott;37.0;99.1;79.2;"""Note: Cupiditate consequuntur tempore; then Voluptatem eaque et nisi"""
barbara_clarke_7349;Barbara Clarke;78.0;67.1;10.2;"""Aliquam earum minima; Excepturi ; Fugiat delectus ut perspiciatis"""
dr_pearson_0758;Dr Kenneth Pearson;84.0;44.1;26.2;"""(Velit) ; Fugiat and Nostrum facere aliquam delectus architecto"""
leanne_elliott_1417;Leanne Elliott;90.0;90.1;34.2;"""Distinctio eligendi temporibus ullam officiis numquam; Magni eius ratione nemo dignissimos Veritatis laborum"""
pauline_ward_6056;Pauline Ward;31.0;42.1;6.2;"""Note: Recusandae; then Quibusdam voluptatum"""
kirsty_davies_8198;Kirsty Davies;36.0;96.1;5.2;"""Note: Dolore quos odio magnam; then Nostrum quod"""
mrs_todd_9390;e;87.0;89.1;60.2;"""Fugiat perspiciatis distinctio iste quidem; Fugit aliquid Blanditiis asperiores"""
dr_lloyd_9325;Dr Teresa Lloyd;76.0;7.1;86.2;"""Accusamus tempore velit repellat iste; Tenetur aliquid placeat recusandae omnis Odit nihil"""
dr_hurst_4679;Dr Jessica Hurst;80.0;99.1;3.2;"""Cumque: Fugit nihil; Est saepe"""
shane_baker_4197;Shane Baker;97.0;57.1;43.2;"""(Reiciendis praesentium sapiente) ; Doloremque and Omnis fugit temporibus tempora quae assumenda"""
lawrence_lowe_4604;Lawrence Lowe;11.0;75.1;24.2;"""Nesciunt culpa; Eum consequuntur deleniti rerum repellendus assumenda ; Beatae"""
lee_jackson_3892;Lee Jackson;25.0;5.1;61.2;"""Aliquam sapiente: Minus omnis distinctio fuga; Illum sint unde vitae"""
mr_dawson_2933;Mr Callum Dawson;63.0;52.1;33.2;"""Ullam: Sint; Tenetur ad culpa enim ut"""
bernard_johnson_3320;Bernard Johnson;42.0;18.1;5.2;"""(Laborum hic eligendi rem) ; Sequi dolorum similique and Iste impedit consequatur laudantium illo"""
alexander_hayward_2974;Alexander Hayward;6.0;;74.2;"""Note: Nisi atque alias doloremque cumque; then Explicabo aspernatur fugit"""
william_pearson_9308;William Pearson;90.0;74.1;92.2;"""Impedit iusto vero commodi fugit; Explicabo ; Porro iusto quaerat omnis"""
terry_bradley_9693;Terry Bradley;64.0;79.1;62.2;"""(Aliquid) ; Doloremque sed and Accusantium soluta cupiditate ut"""
alice_jones_4959;Alice Jones;75.0;74.1;50.2;"""Quasi voluptatibus: Optio laborum dolore; Laborum deserunt"""
graham_mitchell_7001;Graham Mitchell;43.0;2.1;45.2;"""Optio non; Dolore perferendis cum autem ; Iusto soluta labore necessitatibus ad tempora"""
toby_connor_8019;Toby O'Connor;68.0;16.1;73.2;"""Fuga adipisci eveniet; Corporis architecto veritatis voluptas amet doloremque ; Aliquam dolorem ea"""
kelly_henderson_0258;Kelly Henderson;12.0;87.1;69.2;"""(Voluptatem nulla accusamus minima veniam) ; Quidem reiciendis asperiores and Amet voluptatibus accusantium asperiores"""
duncan_moore_8070;Duncan Moore;;50.1;58.2;"""Numquam est eaque ratione at minima; Sequi recusandae Soluta sed"""
carl_martin_0197;Carl Martin;13.0;70.1;39.2;"""Note: Error; then Nemo dolore"""
dr_dale_4859;Dr Dawn Dale;88.0;34.1;77.2;"""Hic; Suscipit quos rerum Voluptate odio sequi impedit dignissimos"""
ellie_riley_5104;Ellie Riley;85.0;39.1;40.2;"""Nesciunt rem voluptates quam rem; Quisquam ; Architecto error pariatur ea"""
jasmine_gibson_4258;Jasmine Gibson;97.0;23.1;24.2;"""Commodi; Blanditiis placeat Sunt fugit rem alias"""
heather_hodgson_7701;Heather Hodgson;86.0;8.1;7.2;"""Deleniti est voluptatem delectus; Mollitia rem molestiae corporis vitae ; Nam placeat"""
joe_lees_0375;Joe Lees;4.0;94.1;30.2;"""Ratione aperiam accusamus odit exercitationem nihil; Sapiente ex commodi ; Labore deleniti voluptatibus odit recusandae dolor"""
stephen_smith_9535;Stephen Green-Smith;3.0;68.1;71.2;"""Explicabo dolore quae; Aperiam cum deleniti aspernatur nemo Eveniet"""
stephanie_atkins_7360;Stephanie Atkins;61.0;2.1;39.2;"""Non harum assumenda; Perferendis ea ; Porro ad"""
