username;name;price;description;comment
emily_paul_5073;Emily Paul;70.0;'''(Mean also) ; So actually event pull tend and Attorney minute career''';'''Service others option; Enough experience His possible'''
mr_mcdaniel_2742;Mr. Anthony Mcdaniel;63.0;'''Cost opportunity very: Represent visit Democrat recent move; Fight election tell behind American development''';'''Indicate; Opportunity expect me ; Good simple memory theory'''
john_hernandez_3239;John Hernandez;38.0;'''So; Customer important Magazine number benefit''';'''Rest each billion stop whom; Their Name seem back form'''
diana_brown_3337;Diana Brown;97.0;'''City billion second; Draw system ; Physical computer''';'''Service foreign south appear your; Task soon foot same training Eight senior adult such entire'''
kayla_pena_1908;Kayla Pena;81.0;'''(So show) ; Wrong quality over price and Worry''';'''Open bit follow; Large later ; Law home'''
edward_solis_4180;Edward Solis;33.0;'''World film why trip; Story in than ; Nothing top''';'''Force appear: Really pattern once address pull; Type decade send that'''
julie_riley_9807;Julie Riley;;'''Note: Effect reduce into; then Federal argue affect''';'''Note: Sort bill true; then Data'''
max_edwards_7896;Max Edwards;68.0;'''Choice baby property: Collection behavior natural why piece; Space seat expert lead on''';'''Read page fish; Bank lot sing discover dark ; Truth meeting'''
jordan_lane_7960;Jordan Lane;72.0;'''Always daughter: Many them hotel; Skin win Mrs forget role somebody''';'''(Bank the) ; Age break let and Sing memory house'''
cheyenne_trevino_0350;Cheyenne Trevino;52.0;'''Hope work enter; Dog use ; Before civil indeed''';'''(His against) ; National pressure television listen and Base rest'''
michele_smith_9090;Michele Smith;30.0;'''Full; Me change back ; Rate drug''';'''(Station history) ; Sister finish lead ball and Leg law few case'''
kent_king_4766;Kent King;13.0;'''Century her; Sure certainly you Soldier new government''';'''Data; Ask sister discover medical ; Piece work all'''
heather_douglas_0165;Heather Douglas;43.0;'''Eye fine: Affect attention agency amount activity; National appear keep''';'''(Explain trouble technology our) ; Consumer officer else various anything and Do Republican'''
pamela_hall_7261;Pamela Hall;57.0;'''Material community parent box course away; Everybody sport ; Green score eye home''';'''Move direction analysis prevent; Tv ; Enter six sit series'''
kevin_green_4863;Kevin Green;80.0;'''Staff sit draw unit: Accept; Talk film''';'''Name tend pick; Line find move structure memory ; Evidence produce'''
katrina_price_6711;Katrina Price;16.0;'''(Include develop environment) ; Huge war sometimes tax program and Option''';'''Everything: Source say; Best room listen'''
margaret_lee_3715;Margaret Lee;61.0;'''Tax source prove; Resource cell civil Mrs Front use food''';'''(Control) ; Score little and Pay so'''
robin_merritt_0687;Robin Merritt;52.0;'''(Several) ; Lot talk son public and Purpose community''';'''Across reason; For six writer song Realize fly require describe hit theory'''
pamela_gonzalez_8457;Pamela Gonzalez;89.0;'''Full moment western; Away cover most Mrs ; Defense collection education''';'''(Grow might human traditional wind) ; Other change check and Plan view article'''
brian_wells_5422;Brian Wells;34.0;'''Task drop: Year close; Use by light claim scene major''';'''Technology from; Stop think ; Certain employee'''
timothy_keller_8567;Timothy Keller;32.0;'''Enter a; Bag second ; Official white take''';'''Note: Also; then Employee early similar'''
kelly_harris_7628;Kelly Harris;20.0;'''Campaign cause hand; Including continue ; Democratic street''';'''Until decide full; Hotel off amount ; Catch during determine activity down economy'''
thomas_gentry_2414;Thomas Gentry;42.0;'''(Early by better start although) ; End PM and Doctor news mother''';'''Game kind; Discuss score civil newspaper Get final'''
scott_chapman_8388;e;18.0;'''(Finish upon matter) ; Point dream and Early fill happy adult series''';'''(Camera authority most) ; Voice and Letter remain nice firm'''
lance_pugh_5980;Lance Pugh;49.0;'''Note: Own international though; then Town spend stay treat letter''';'''None again talk; Not her number ; Art successful everyone national read'''
casey_martinez_3940;Casey Martinez;1.0;'''Join control military resource; Contain ; Challenge fill''';'''(Outside effort) ; Difficult development and Relationship drop president'''
troy_stone_2912;Troy Stone;3.0;'''Note: Walk; then Remember goal''';'''Example trade road religious sense song; Outside young Agree'''
joshua_patton_5599;Joshua Patton;98.0;'''Arrive stage nature though population; Deep animal nor Exactly contain total always''';'''Economic probably produce increase happy: Security it bed; Over attorney good pay'''
rebecca_mendez_4618;Rebecca Mendez;94.0;'''Idea middle benefit; Environmental blue east Decade''';'''Degree best special: Indicate game; Skin push forward'''
brittany_huffman_9402;Brittany Huffman;36.0;'''Often; Conference between offer chance ; Improve fill sport left everybody''';'''Theory about once growth; Life second ; Scene value owner water include away'''
brenda_morgan_6401;Brenda Morgan;56.0;'''Bill fish; Star if Research college''';'''Lose; Upon morning Smile wife perform yeah your'''
krystal_smith_5428;Krystal Smith;10.0;'''Medical read; Call common ; Son side boy''';'''(Point cup) ; Chance view quite and Allow shoulder lose'''
thomas_austin_5975;Thomas Austin;91.0;'''Note: Bring; then Hospital''';'''(Value same) ; Sea region speak and Performance toward state bill'''
nathan_mcconnell_2701;Nathan Mcconnell;62.0;'''Hospital value; Throw subject fly New should throw''';'''Production painting us; Owner who material none Country off'''
sarah_byrd_7682;Sarah Byrd;28.0;'''Note: Against service rate short; then Today''';'''Of benefit value; Speech front international rich economy within Know south'''
manuel_sullivan_6081;Manuel Sullivan;24.0;'''Across during: Both; Loss century successful''';'''(Not) ; Nearly soon response and Suffer price analysis group'''
robin_zamora_5910;Robin Zamora;40.0;'''Former yeah; She traditional sure ; Grow rest direction or woman to''';'''Wide eye performance determine five; Charge fear either ; Small security'''
jessica_martinez_4328;Jessica Martinez;58.0;'''Physical head; Time responsibility ; Computer lead option about''';'''Key radio; Loss somebody ; Choice those cultural interview'''
kristin_figueroa_2265;Kristin Figueroa;38.0;'''Help girl; Beat quickly while High''';'''Action positive: Radio leave; Off place'''
justin_potter_6470;Justin Potter;50.0;'''Note: Among including the; then Age country''';'''People moment; Ready ; Force long trip hear'''
