username;score;salary;comment;note
joseph_rodgers_4750;25.0;5.1;'''Car; Parent see stock good manage thank Similar''';'''Figure theory real form play; Her plant ; Face ago Republican'''
martin_robinson_1948;43.0;31.1;'''Main this affect from who information; Across involve total Seven later''';'''Note: Magazine north; then Energy partner'''
cynthia_moore_3576;69.0;44.1;'''Another call; Value necessary recent during together ; Successful anyone those series evidence''';'''Note: Soon fly; then Policy long somebody'''
lucas_peterson_5747;39.0;78.1;'''Indeed nor house: None artist; Pull rule''';'''(Here entire) ; Student upon despite choose name check and Effect financial space truth'''
william_welch_6748;66.0;10.1;'''Property; Tree in trial where ; Term''';'''Recent class; Executive prevent Country media age large what'''
yvette_koch_6794;33.0;84.1;'''All some ten box; Shake never ; Again back near after address cause''';'''Him; Least able note ; Sign probably'''
marcia_martinez_7816;59.0;54.1;'''Life religious answer; Enough green clear method through trade ; Language remember off you''';'''Crime experience personal; Out serious ; Theory rate education player best weight'''
troy_wallace_3991;78.0;44.1;'''Require focus heavy; Nor choose population Again evidence''';'''Mrs federal notice: We tough light; Mr quickly inside'''
raymond_gonzalez_9655;50.0;14.1;'''Just miss opportunity about: Management either difference head; Run wear natural''';'''Along ball history; Once worry system ; Tend form'''
glenda_becker_1795;32.0;58.1;'''Note: Road day professional he; then Poor option''';'''Job several support; Reflect century hour area thousand low ; Our call'''
raymond_ray_1912;32.0;29.1;'''Remain administration; Stop ; Beyond''';'''Campaign relate energy; Add become this ; Major brother friend'''
matthew_wilson_7867;99.0;59.1;'''Church team already either: Able crime argue front lay; Listen young also only''';'''Defense recent miss check: Within least; Commercial him baby message'''
malik_stevenson_8362;49.0;57.1;'''Note: Either trouble; then Green green future''';'''Blood themselves: Pull air; Create model'''
ian_howell_3812;99.0;69.1;'''Note: Daughter change international; then Reach community pick half''';'''(Growth design stock everybody) ; Bar official Democrat ability and Part message likely'''
brandon_murphy_0890;8.0;80.1;'''Note: Never; then Role''';'''North deal: Fire push let; Item eye'''
david_gomez_4002;27.0;35.1;'''Note: Without leader never back; then Example idea whose''';'''(Age poor above hotel early join) ; Local couple and Seven step'''
denise_johnson_0842;88.0;33.1;'''Executive; Theory challenge ; Explain other''';'''Contain on conference chance; Each book can ; Threat door say stock'''
lisa_graham_3769;98.0;74.1;'''Key body realize art: Product share; Film sister play measure''';'''(Summer line) ; Many about and Feeling ahead'''
david_santana_7155;43.0;67.1;'''Base want; Different court Exactly enough brother seven else account''';'''(Doctor else) ; Degree interview treatment and Thus air'''
sandra_bailey_4527;42.0;79.1;'''Note: Represent let group year respond; then Whatever price''';'''Name tough; Case cover ; Always part image common'''
holly_herman_5077;19.0;18.1;'''Note: Friend; then Fly easy up ever list''';'''(Stand top maybe behavior) ; Your expect and Must single policy'''
nicole_richardson_0709;77.0;;'''Its government contain drive view; Congress ; Challenge store''';'''Program focus there follow: Public pressure remain story; Face'''
joshua_baker_6418;65.0;90.1;'''Call a thank together: Responsibility; Perhaps human day staff program top''';'''Plan firm; Season get single increase culture ; Foot war see give'''
amber_hobbs_4432;94.0;71.1;'''Treatment real reduce whatever; Event final fill ; Wide write morning''';'''Something two: Speak operation; Send'''
jennifer_dean_2191;7.0;18.1;'''Note: Without but blood affect; then Life animal''';'''(Indicate power agency opportunity piece former) ; Enter southern and Pull'''
edward_ray_0426;24.0;9.1;'''Amount offer; Bring keep ; By''';'''Note: Road hour; then Through choice he space'''
james_wright_8328;32.0;94.1;'''Box; Before let Challenge position mother record billion''';'''Year fine white ever; Read experience A'''
sydney_hicks_5424;18.0;64.1;'''Note: Boy reveal out hundred; then Raise recognize''';'''Sing material create; Threat remain Cell short city short suggest'''
erica_hernandez_3148;29.0;3.1;'''Show character beat; Our large ; Time challenge former''';'''Citizen; Quality nature best Data trial'''
sherry_gibson_4987;49.0;48.1;'''(Ability although) ; Describe despite indicate hear and Soon''';'''Mother because newspaper: Very street doctor specific simple; Himself financial room'''
nicholas_dixon_7345;63.0;84.1;'''International mind before; Fly side ; Become try loss how''';'''Remember; Window help goal Despite before line artist room college'''
charles_may_9369;38.0;40.1;'''Raise item them; Stuff policy program staff Born''';'''Product need trouble wait want; Agent fact Job then garden town answer'''
steven_kim_7443;23.0;13.1;'''Note: Away present up current; then Charge position quite memory''';'''Note: International often; then Which'''
kristen_hall_5938;68.0;59.1;'''Accept plan half: Crime keep thing practice ok; Family mother ago itself computer''';'''(Cause network) ; At subject out top our and Second street'''
heather_horn_9619;32.0;16.1;'''President product although; Effort live chance lose unit type Bank reality food activity including''';'''(Your store) ; There evidence and School amount management firm'''
eric_harrison_6130;12.0;77.1;'''Idea suffer: Some analysis; Office use still several least''';'''Land special father; Like page air message ; Something girl side'''
lori_reyes_5981;;23.1;'''Already serious boy Congress: Some; Game hair''';'''By everything party build; At bed store ; Popular feel'''
maria_miller_2712;93.0;64.1;'''Thought begin sure: Interview war girl; Direction product sit''';'''Note: Wall remember night; then Team family north'''
felicia_shannon_2211;29.0;46.1;'''Far through particularly style: Blue hour job; Give picture hand cup''';'''Office would whose gas; Computer present add whom ; Conference discover beat say know'''
laura_rogers_9804;48.0;11.1;'''(Market majority indicate) ; War recently when and Whom information gun''';'''Try one hair; Available six us attention ; Suddenly drop film use'''
emily_brown_8999;79.0;5.1;'''(Former) ; Investment and Official color prepare''';'''Recognize many; Positive draw hair foot professional ; Southern teach'''
debra_nunez_4044;25.0;60.1;'''Note: Boy already senior treatment entire; then Must officer participant group''';'''Concern money leg where: Face bill nearly; Operation mother see'''
leah_harris_6302;83.0;70.1;'''Religious phone peace quite become serve: Situation what; Concern around''';'''Note: Light increase consumer account somebody; then Party popular'''
laura_ramirez_7936;74.0;99.1;'''(Suddenly discuss) ; Late and End which interview member''';'''Pay we even thus: Dream explain; Example national return research'''
jennifer_levy_7182;45.0;38.1;'''Strategy star guy; Feeling Congress field understand ; Price''';'''Off against friend major; Myself police eat detail ; Training who'''
samantha_johnson_3110;20.0;32.1;'''Movement force: Research thus operation gun thought; Run west''';'''We sign; Sometimes boy Over fine pattern'''
