name	price	age	rating	review	remark
Mrs Dorothy Graham	3.0	62.1	35.2	"""Maxime rem; Expedita tempora 	 Beatae consequuntur"""	"""Eum dolore	 Id molestiae recusandae Vero ut soluta"""
Mr Derek Singh	43.0	49.1	99.2	"""Note: Placeat est	 then Nisi soluta sed"""	"""Aspernatur illo temporibus; Id unde sapiente 	 Quam velit necessitatibus asperiores fugiat doloribus"""
Mrs Rita Fletcher	42.0	32.1	21.2	"""(Sapiente laboriosam ab debitis esse) 	 Quasi and Laborum voluptatum doloremque"""	"""Note: Ipsa unde omnis	 then Odio quas"""
Mrs Katie Smith	9.0	88.1	52.2	"""Note: Quae corporis ullam aperiam labore	 then Asperiores provident alias accusantium saepe"""	"""Similique ipsa: Maiores repellat quasi dolor	 Aperiam culpa corrupti alias"""
Hilary Jones-Thomas	48.0	29.1	64.2	"""Error: Amet quis	 At hic"""	"""(Porro sint) 	 Tempore and Quae eos saepe quae distinctio nulla"""
Robin Thompson	85.0	18.1	23.2	"""Officia sit; Modi 	 Nulla"""	"""Veritatis tempore; Ullam natus quibusdam 	 Ex expedita"""
Dr Alison Cooke	86.0	71.1	47.2	"""(Neque minus porro) 	 Debitis voluptatem veniam dolorum maiores and Atque expedita"""	"""Note: Nulla atque itaque sint	 then Molestias illo"""
Mandy Johnston	5.0	51.1	1.2	"""(Aperiam) 	 Minus et quas and Veritatis tempore"""	"""Note: Labore soluta officiis consequuntur cum vitae	 then Quis"""
Mr Tom Owen	94.0	88.1	88.2	"""(Eum consequuntur) 	 Sed and Hic provident"""	"""Note: Incidunt molestias	 then Sunt eligendi laudantium quam distinctio"""
Dr Aimee Thomas	97.0	52.1	7.2	"""(Unde quos sapiente reiciendis asperiores) 	 Odit culpa and Sunt voluptate"""	"""(Amet molestiae hic ullam) 	 Iusto incidunt quam praesentium nemo delectus and Rem ut molestiae delectus"""
Sam Carter	19.0	91.1	77.2	"""Dolorem libero voluptate: Voluptatum dolores dolores esse	 Quam possimus qui reprehenderit"""	"""Eligendi; Laborum iure 	 Placeat cum"""
Alison Burke	23.0	38.1	53.2	"""(Animi) 	 Quasi accusamus vero commodi iusto and Vitae iure aliquam eos nihil"""	"""Excepturi esse: Saepe fugit autem delectus	 Consequuntur quia est"""
Lucy Butler	100.0	93.1	94.2	"""A mollitia; Fuga temporibus assumenda in exercitationem eveniet 	 Aspernatur excepturi"""	"""(Dolores cum quisquam) 	 Molestias consectetur eius and Porro"""
Joseph Hawkins-Ford	89.0	56.1	32.2	"""Laboriosam distinctio omnis eveniet: Natus repellendus cupiditate	 Autem culpa sed dolorem mollitia"""	"""Quis quisquam eius	 Eveniet praesentium architecto tempora Assumenda quasi"""
Karen Ford-Butler	42.0	50.1	54.2	"""Note: Consequatur	 then Quo"""	"""Note: Itaque delectus ullam repellendus	 then Magni quae"""
Mrs Paige Thompson		19.1	70.2	"""Quod alias	 Commodi similique Quasi repudiandae consequuntur harum"""	"""Officia; Blanditiis 	 Nostrum laborum"""
Mrs Jessica Hammond	68.0	5.1	83.2	"""Nulla quos	 Labore laboriosam Accusantium facere"""	"""Culpa	 Perspiciatis vitae unde Debitis voluptates"""
Mr Allan Ford	41.0	99.1	54.2	"""Accusantium ex: Corporis accusantium atque	 Ut eveniet"""	"""Note: Perspiciatis quia	 then Rerum nam doloribus"""
Mohamed Harris	11.0	70.1		"""Note: Doloribus provident	 then Nam ipsum illo"""	"""Inventore reiciendis amet: Nobis	 Reprehenderit"""
Martin Rice-Butcher	42.0	96.1	27.2	"""(Blanditiis perferendis quasi blanditiis) 	 Tempore veritatis nobis and Sequi ipsa"""	"""Nobis laudantium vitae	 Qui velit Dolorum architecto"""
Dylan Marshall	83.0	99.1	2.2	"""Quibusdam cupiditate; Harum voluptates eum repellendus aliquid 	 Placeat eaque est recusandae iste"""	"""Note: Et quasi	 then Dignissimos excepturi"""
Shirley Barrett	17.0	56.1	20.2	"""Reiciendis sed repellat quam: Quae	 Cupiditate illum ducimus"""	"""Fugit autem magnam quod: Eveniet veritatis	 Rerum culpa minima"""
Brandon Martin	25.0	100.1	36.2	"""Illo; Id ea 	 Labore numquam iusto ad"""	"""Velit nobis cumque corrupti sint molestias; Recusandae inventore iste ipsam eius 	 Modi nobis reiciendis impedit"""
Mathew Poole	79.0	56.1	82.2	"""Note: Eum delectus	 then Perspiciatis"""	"""Commodi excepturi: Voluptates	 Vitae facilis natus reprehenderit"""
x	94.0		9.2	"""Laboriosam ratione aliquid aspernatur molestias	 Reprehenderit inventore quidem recusandae labore Dignissimos"""	"""Provident sapiente voluptate quia; Nostrum 	 Fugiat unde omnis"""
