name	username	price	age	score	message
Bethany Brown-May	bethany_may_3189	21.0	74.1	38.2	'''Quibusdam aut recusandae molestias	 Rem corporis Libero delectus in amet dolores'''
Donald Parsons	donald_parsons_1624	62.0	47.1	31.2	'''(Eius sed quae) 	 Maxime qui and Eveniet corrupti velit'''
Gareth Barker	gareth_barker_5191	41.0	38.1	52.2	'''Note: Quia	 then Explicabo nihil eum'''
Damien Dawson	damien_dawson_2663	33.0	74.1	38.2	'''Officiis in recusandae eius; Dolor quia 	 Enim quae'''
Alice Thompson	alice_thompson_6574		20.1	66.2	'''Facilis; Debitis delectus 	 Maxime aspernatur asperiores'''
Dr Abdul Stewart	dr_stewart_8603	79.0	82.1	90.2	'''Note: A soluta alias	 then Cumque quidem aliquid rerum necessitatibus'''
Irene Young	irene_young_8345	76.0	2.1	77.2	'''(Officiis) 	 Aperiam iusto enim nobis libero sint and Possimus beatae possimus unde distinctio similique'''
Jodie Robinson	jodie_robinson_9829	9.0	81.1	70.2	'''Molestiae similique veniam quod consequatur corporis	 Praesentium asperiores laudantium et eum Ipsa qui qui'''
Albert Fleming	albert_fleming_6460	85.0	4.1	49.2	'''(Ipsam ab dignissimos) 	 Qui exercitationem laboriosam and Ut'''
Raymond Palmer	raymond_palmer_5324	48.0	91.1	31.2	'''Corrupti tempora maxime blanditiis totam	 Molestiae cum ut in Assumenda blanditiis'''
Ms Jill Nixon	ms_nixon_1816	15.0	69.1	56.2	'''Ullam; Debitis dolore quod fugiat 	 Quae ullam libero'''
Janice Hyde	janice_hyde_5462	12.0	56.1	74.2	'''Note: Praesentium perferendis repellendus	 then Eveniet molestias ex ipsa'''
Terence Allan-White	terence_white_4244	3.0	25.1	40.2	'''Animi voluptatum: At maiores qui tempore	 Esse dicta'''
Eleanor Schofield	eleanor_schofield_9668	72.0	14.1	84.2	'''Note: Possimus quasi voluptatem debitis	 then Facilis'''
Miss Jill Brown	miss_brown_3676	54.0	21.1	82.2	'''Fugiat nihil architecto: Temporibus eaque	 Placeat assumenda fugit esse'''
Alice Smith	alice_smith_2819	83.0	26.1	64.2	'''(Quia dolores) 	 Sapiente and Ipsam quos sequi odio neque'''
Annette Sullivan	annette_sullivan_4327	29.0	5.1	57.2	'''Alias dolor: Natus itaque dolorem recusandae delectus	 Dolor cumque voluptas veniam numquam'''
Miss Jennifer Young	miss_young_8642	86.0		90.2	'''Minima: Libero repellendus	 Aut'''
Thomas White	thomas_white_7169	50.0	49.1		'''(Illo) 	 Qui minus ducimus and Laboriosam quos'''
Aaron Reeves	aaron_reeves_9151	49.0	95.1	5.2	'''Note: Voluptatem ratione beatae ullam mollitia	 then Vero sint veritatis voluptates'''
Mr Terry Brown	mr_brown_6016	54.0	88.1	59.2	'''Note: Sit suscipit animi	 then Sint qui nisi'''
Shane Davis	shane_davis_4991	66.0	86.1	90.2	'''Consectetur odio corrupti	 Facere dignissimos Vitae'''
D	dr_jones_2312	17.0	44.1	50.2	'''(Mollitia libero eos) 	 Odio dolorem sunt minus at and Sapiente animi'''
Jayne Payne	jayne_payne_9513	14.0	18.1	12.2	'''(Tempore corporis beatae) 	 Cupiditate explicabo aut amet assumenda and Magnam dolorem ipsa'''
Mr Roy Todd	mr_todd_1781	69.0	74.1	93.2	'''Et dolorem sequi nihil	 Mollitia Id ex quibusdam adipisci possimus dolore'''
Mr Declan Pritchard	mr_pritchard_2877	25.0	66.1	24.2	'''Iusto sint; Dignissimos veritatis nobis 	 Enim totam'''
Alan Shaw-Anderson	alan_anderson_9931	55.0	8.1	91.2	'''Note: Beatae quaerat deserunt ipsa	 then Eaque praesentium'''
Terence Jones	terence_jones_0623	91.0	1.1	95.2	'''(Perferendis) 	 Eius beatae and Nam nostrum cum consequatur'''
Hazel Campbell	hazel_campbell_4712	27.0	73.1	8.2	'''(Aut quidem ipsam) 	 A nisi minima and Praesentium deserunt esse'''
Lewis Hussain-Walker	lewis_walker_9739	50.0	95.1	5.2	'''Dicta omnis; Itaque et quis 	 At totam'''
Ms Lauren Lloyd	ms_lloyd_5071	11.0	37.1	100.2	'''Laboriosam	 Aliquam optio Accusamus nulla qui'''
Bernard Holmes	bernard_holmes_0034	73.0	22.1	96.2	'''Facilis unde: Cum impedit	 Soluta dignissimos atque'''
Joe Spencer-Riley	joe_riley_6939	85.0	52.1	27.2	'''Aliquam illum aliquam; Ad officia 	 Aliquid'''
Scott Smith	scott_smith_3686	98.0	9.1	39.2	'''Numquam ipsum: Consequuntur magnam quia reprehenderit	 Quisquam ea impedit quas aliquam'''
Iain Curtis	iain_curtis_9999	67.0	7.1	41.2	'''Note: Praesentium	 then Dolores et'''
Charlotte Shepherd	charlotte_shepherd_4074	68.0	17.1	6.2	'''(Nihil omnis reiciendis) 	 Reprehenderit suscipit molestias illo and Voluptatibus dicta'''
Callum Brooks	callum_brooks_1948	53.0	87.1	3.2	'''Id asperiores dignissimos sapiente eaque in: Doloremque	 Voluptas veritatis'''
Mr Ashley Johnson	mr_johnson_8106	33.0	98.1	7.2	'''Voluptas nostrum quia assumenda	 Dignissimos Doloribus nihil'''
Dawn Higgins	dawn_higgins_8153	65.0	48.1	79.2	'''Fugit; Eius 	 Dolore doloribus quas tenetur'''
Dr Adam Gardner	dr_gardner_5369	20.0	52.1	89.2	'''Earum exercitationem: Voluptatem excepturi	 Occaecati placeat'''
