username,name,total_count,review
jessica_allen_9180,Jessica Allen,15.0,'''Voluptates architecto omnis, Vitae inventore fuga eligendi fugit Iusto consequuntur autem blanditiis dicta'''
conor_wilkinson_0922,Conor Wilkinson,51.0,'''Officia nisi nihil saepe aperiam: Perspiciatis, Dolorem'''
grace_smith_0245,Grace Smith,36.0,'''Dicta illum; Voluptates neque , Consequuntur autem'''
lee_singh_7505,Lee Singh,96.0,'''Commodi maxime; Occaecati assumenda , Recusandae iusto consequatur corporis dolorem'''
dr_mellor_8508,Dr Kayleigh Mellor,9.0,'''Quae exercitationem dolorem commodi: Earum officiis nesciunt aperiam, Laborum quas eveniet laudantium'''
caroline_hamilton_6107,Caroline Hamilton,18.0,'''(Nisi tenetur quis) , Iusto consectetur corporis and Doloribus ab cumque ducimus perspiciatis libero'''
victoria_baxter_2510,Victoria Baxter,42.0,'''Ad voluptatem, Consequatur illum Ipsum cum illum labore exercitationem'''
ms_ryan_2793,Ms Hazel Ryan,93.0,'''A minima optio pariatur illum; Molestiae ea ab , Eligendi provident facere ullam'''
ms_lane_7314,Ms Rachael Lane,75.0,'''Saepe quia itaque: Iusto nisi, A numquam quasi distinctio'''
nicola_khan_4525,Nicola Khan,44.0,'''Note: Sequi molestiae, then Veniam deleniti pariatur officiis'''
kenneth_johnson_2879,Kenneth Johnson,54.0,'''Rerum: Sunt consequuntur incidunt, Numquam est dicta nihil'''
kim_bradley_6471,Kim Bradley,46.0,'''Note: Necessitatibus laudantium, then Voluptate fuga nulla'''
bruce_lewis_6961,Bruce Lewis,96.0,'''Ea: Sapiente consequatur praesentium, Harum minima blanditiis'''
sally_taylor_4640,Sally Taylor,72.0,'''Blanditiis eum eaque, Facere iure repudiandae in Vitae mollitia odio'''
jemma_chambers_9933,Jemma Chambers,75.0,'''Beatae neque possimus veniam doloremque, Sunt architecto Ipsum illo placeat soluta nemo nam'''
mrs_atkins_4232,Mrs Kimberley Atkins,47.0,'''Optio libero ullam similique quisquam eaque, Qui dolor ad Incidunt rem doloremque sunt illo'''
dr_harding_7202,Dr Kieran Harding,53.0,'''(Dolorem ullam) , Rerum porro nam and Labore fugit dignissimos fugiat harum'''
stewart_richards_0834,Stewart Richards,79.0,'''Note: Quia asperiores et accusantium, then Voluptatem'''
kayleigh_preston_8991,Kayleigh Preston,87.0,'''(Tempora) , Eius velit incidunt aspernatur and Repellendus'''
dr_harper_6775,Dr Stewart Harper,24.0,'''Note: Dicta porro, then Vero sint possimus quidem'''
mr_stevenson_9843,Mr Mitchell Stevenson,63.0,'''Culpa provident minima beatae: Sunt rerum autem impedit rerum quidem, Dicta assumenda in sapiente'''
dr_fitzgerald_6812,Dr Iain Fitzgerald,,'''Ad aperiam a: Culpa, Quam'''
mr_wallace_8224,Mr Andrew Wallace,71.0,'''(Nam fugiat illo cum) , Deleniti esse nam atque ab voluptatibus and Quisquam'''
leah_taylor_1340,Leah Taylor,49.0,'''Dolorem: Harum debitis qui, Ducimus fugit fuga ut'''
julie_marshall_2217,Julie Marshall,37.0,'''Assumenda; Sint possimus eaque corporis similique quibusdam , Delectus numquam eligendi dolorum id'''
jason_wright_2806,Jason Wright,84.0,'''(Laboriosam magni nostrum corporis dicta earum) , Tempore blanditiis perferendis and Cupiditate deleniti atque'''
rhys_carroll_2886,Rhys Carroll,23.0,'''Blanditiis quasi, Dolores tempore quibusdam sed Facere nemo'''
judith_holland_8985,Judith Holland,22.0,'''Note: Fugiat occaecati, then Eum'''
miss_ward_2107,Miss Beth Ward,61.0,'''Note: Dolorem, then Tempora eum dolorum'''
kim_graham_0522,Kim Cole-Graham,88.0,'''Note: Porro ea, then Quo illo dicta'''
miss_faulkner_1371,Miss Brenda Faulkner,86.0,'''Provident dignissimos quae, Amet consequatur sequi iste Ab unde perspiciatis fugit neque'''
bradley_jackson_8858,o,5.0,'''Sunt dolorem sint a sint; Neque excepturi adipisci modi , Itaque placeat omnis veritatis possimus'''
janet_hill_1069,Janet Hill,98.0,'''Blanditiis; Sed , Officia quas'''
duncan_thornton_7801,Duncan Thornton,12.0,'''(Rerum veniam quam) , Sunt and Eius quisquam magnam'''
mr_burke_1216,Mr Arthur Burke,65.0,'''Provident mollitia ducimus blanditiis: Explicabo quasi labore officiis ab, Mollitia corrupti laboriosam officiis'''
sarah_jones_9132,Sarah Jones,66.0,'''(Veniam) , Ullam eligendi asperiores and Fugit praesentium'''
dr_woods_9645,Dr Karen Woods,94.0,'''(Veniam itaque dolore mollitia) , Quibusdam esse repudiandae totam quidem and Nihil possimus rem'''
ashley_pritchard_1820,Ashley Pritchard,68.0,'''Note: Voluptatem libero amet unde blanditiis quaerat, then Provident eum'''
ms_marshall_6402,Ms Stacey Marshall,51.0,'''Ad saepe optio: Adipisci odit, Error maiores assumenda'''
dominic_hill_6115,Dominic Hill,92.0,'''Vel dolorum laudantium consequatur facilis consequuntur; Deserunt accusantium id molestias sequi natus , Aliquid sunt nulla necessitatibus neque'''
paul_short_1566,Paul Parry-Short,11.0,'''Minus; Nam totam suscipit iure , Earum doloribus sed'''
leslie_brooks_6759,Leslie Brooks,33.0,'''Sunt unde, Explicabo quam consectetur cupiditate Ex'''
philip_roberts_7424,Philip Naylor-Roberts,40.0,'''(Dolorum placeat voluptatem ea eaque) , Velit molestiae est tempore quasi and Eum nostrum vel error quos'''
josh_hall_9604,Josh Hall,16.0,'''Note: Accusamus eaque cumque provident ab, then Doloribus sed'''
mr_turner_1793,Mr Glenn Turner,62.0,'''Dolore nostrum cumque, Magnam Consectetur nobis doloribus'''
stanley_holmes_3557,Stanley Holmes,43.0,'''Consequuntur expedita similique; Nam qui , Id quaerat atque veniam enim reiciendis'''
frank_clarke_8437,Frank Murphy-Clarke,48.0,'''Dolorem saepe tempore est atque neque, Dolore aperiam ratione nemo est Eum corporis accusantium officiis ullam'''
stephen_banks_9975,Stephen Dobson-Banks,42.0,'''Numquam sit: Ipsum voluptatem, Vero consequuntur aut cumque'''
geraldine_murphy_0388,Geraldine Murphy,35.0,'''Eum: Accusantium doloribus eveniet reiciendis, Similique aut'''
