username	name	price	salary	rating	remark
joshua_jimenez_2271	Joshua Jimenez	67.0	67.1	100.2	"""Wife thank: Hand	 Large Mr her"""
samantha_cochran_7470	Samantha Cochran	59.0	90.1	71.2	"""Ask try event	 Total fight environment Set choose"""
robert_french_6338	Robert French	24.0	44.1	58.2	"""Note: Really	 then Environmental whole be"""
adrian_sanchez_5414	Adrian Sanchez	74.0	20.1	8.2	"""Note: Prevent push	 then Factor sort"""
brandy_nunez_2180	Brandy Nunez	89.0	31.1	37.2	"""Note: Yeah	 then Assume wish hot"""
kelly_mclaughlin_7623	Kelly Mclaughlin	91.0	44.1	37.2	"""Note: Show enter movement really	 then Least success kid claim inside"""
april_oconnor_4351	April Oconnor	89.0	59.1	100.2	"""Because final couple deep; Why fall peace everyone 	 Lawyer another most"""
jacqueline_cole_3758	Jacqueline Cole	6.0	50.1	18.2	"""(Certainly around) 	 Call mention and Society wrong"""
jon_dvm_4729	Jon Burns DVM	78.0	85.1	43.2	"""Federal food there toward: Lot board people light	 Once page analysis"""
brian_mccarty_8659	Brian Mccarty	99.0	45.1	7.2	"""Daughter environment understand; At a quickly discussion fall 	 Yes man"""
amy_kim_1955	Amy Kim	69.0	79.1	63.2	"""(Medical leg produce describe exist west) 	 Look suffer and Bed painting"""
christopher_jackson_7511	Christopher Jackson	11.0	45.1	51.2	"""Note: Agreement method	 then Participant clear a"""
alexandra_hutchinson_3171	Alexandra Hutchinson	42.0	97.1		"""Pattern material	 Research federal clearly color score Lead how significant"""
jessica_gonzalez_8349	Jessica Gonzalez	7.0	10.1	65.2	"""Move lot senior issue during	 She Congress Also room him"""
angel_wright_2166	Angel Wright	12.0	6.1	1.2	"""Teacher long yeah; Move part 	 Even eight"""
paula_mcclure_1368	Paula Mcclure	75.0	97.1	89.2	"""Full system good institution red: Brother animal	 Week"""
lisa_crosby_1438	Lisa Crosby	7.0	12.1	73.2	"""Quality economy sometimes bag: Order some say seven	 Pretty"""
jessica_summers_2905	Jessica Summers	51.0	14.1	72.2	"""Note: Save hear seek story	 then Might thank eye"""
richard_davis_6712	l	72.0	92.1	98.2	"""Fact each lay almost	 Shoulder from Room production"""
katherine_garcia_6200	Katherine Garcia	81.0	9.1	12.2	"""Moment behavior reveal onto individual prevent; Research position example image any 	 Start pick"""
michael_roman_8146	Michael Roman	75.0		3.2	"""According way party: Bad	 Top environment factor three"""
donna_lewis_9888	Donna Lewis	11.0	32.1	88.2	"""Decade nor: Manage medical claim	 A another must"""
samantha_rice_5174	Samantha Rice	66.0	89.1	15.2	"""Many capital; Sometimes deal together 	 Despite economic national"""
john_saunders_2721	John Saunders	9.0	90.1	9.2	"""(Political common surface lose moment short) 	 Along call great and Bag peace"""
frank_wong_5705	Frank Wong	43.0	29.1	50.2	"""Note: Site agent place	 then Age movement bill travel"""
david_johnson_5267	David Johnson	22.0	2.1	52.2	"""Teach security	 Eat thus write Create its current above"""
yolanda_clark_4166	Yolanda Clark	57.0	84.1	75.2	"""Teach throw surface: Middle big myself try dog	 Spend cold officer"""
laura_rivas_2436	Laura Rivas	8.0	31.1	87.2	"""Serious military opportunity: Toward	 Six trip could"""
daniel_wright_9568	Daniel Wright	17.0	93.1	49.2	"""Surface TV and: Spring air magazine person type letter	 Necessary assume put"""
janet_glenn_7745	Janet Glenn	3.0	98.1	84.2	"""Have look; Think participant tonight challenge 	 Money civil soon"""
charles_rivera_2080	Charles Rivera	71.0	77.1	35.2	"""Note: Nearly	 then Once two"""
emily_johns_2049	Emily Johns	99.0	60.1	33.2	"""Note: Staff tree	 then Region person check sense"""
nathan_larson_1963	Nathan Larson	69.0	19.1	84.2	"""Threat it significant rule	 Power Game gas either early nice"""
connor_kaufman_6066	Connor Kaufman	71.0	6.1	14.2	"""Past show hand; Light happen economy exactly its trade 	 Worker hard"""
william_anderson_4005	William Anderson		63.1	50.2	"""Note: Watch force	 then Shoulder fund middle"""
annette_kelly_9108	Annette Kelly	51.0	53.1	67.2	"""Good fear; Light specific 	 Sometimes everything"""
teresa_steele_5344	Teresa Steele	71.0	58.1	3.2	"""Note: Foot walk	 then Anyone network between up cause"""
cynthia_brown_6897	Cynthia Brown	30.0	75.1	4.2	"""Author bit direction; Dream move 	 Campaign development"""
brent_valdez_1711	Brent Valdez	29.0	8.1	55.2	"""Note: Suggest any official sit drive	 then Seem become hear food"""
