username	name	age	salary	rating	remark
ms_williams_6821	Ms Vanessa Williams	49.0	12.1	97.2	'''Saepe: Delectus nisi	 Incidunt'''
miss_ford_9371	o	99.0			'''Error; Odio temporibus velit 	 Error quaerat hic tempore'''
mrs_wright_0661	Mrs Leah Wright	65.0	50.1	81.2	'''Explicabo at ad placeat: Laudantium quia	 Nobis nulla amet'''
stewart_taylor_6070	Stewart Taylor	53.0	91.1	72.2	'''Voluptates ea aperiam	 Ullam sit nulla omnis fuga impedit Repellat reiciendis cumque'''
mr_jones_4913	Mr Liam Jones	78.0	2.1	40.2	'''(Exercitationem beatae occaecati mollitia ab) 	 Expedita aperiam maxime neque temporibus and Reiciendis eius itaque quam cupiditate'''
sheila_burrows_4309	Sheila Hussain-Burrows	96.0	94.1	83.2	'''Note: Perferendis facere facilis sapiente exercitationem quasi	 then Fugiat quia consequuntur'''
dr_byrne_8222	Dr Barry Byrne	26.0	53.1	54.2	'''Non; Vitae doloremque veniam et 	 Quisquam architecto'''
clare_whitehead_6664	Clare Parker-Whitehead	6.0	81.1	95.2	'''Note: Reprehenderit ab eius pariatur	 then Laboriosam quasi'''
gary_hudson_1197	Gary Hudson	35.0	81.1	100.2	'''(Suscipit mollitia minus porro sed) 	 Voluptatem optio and Odio autem occaecati doloremque quis'''
sharon_cox_9971	Sharon Cox	17.0	51.1	26.2	'''(Quibusdam architecto) 	 Eveniet sint and Fugiat ex commodi repellendus'''
ms_wong_2490	Ms Molly Wong	52.0	41.1	89.2	'''Aperiam laborum eligendi ipsam	 Reprehenderit odio Fugiat recusandae'''
miss_fox_1537	Miss Rachel Fox	41.0	98.1	78.2	'''Culpa: Similique doloremque corrupti	 Asperiores eligendi beatae rem placeat quam'''
mr_dobson_9459	Mr Wayne Dobson	61.0	14.1	42.2	'''Note: Praesentium cumque	 then Eum occaecati odit'''
claire_weston_9951	Claire Weston	48.0	81.1	23.2	'''Aspernatur; Sequi 	 Deserunt provident corrupti accusantium'''
julie_jones_5909	Julie Jones		3.1	31.2	'''Accusamus ipsam; Illum impedit quam vero 	 Quisquam dolorem veritatis'''
martin_smith_0037	Martin Smith	43.0	88.1	43.2	'''(Laboriosam ipsum harum ipsa) 	 Ab veritatis aspernatur modi and Cumque doloribus aperiam'''
jacob_stewart_9877	Jacob Stewart	62.0	83.1	93.2	'''(Perferendis officiis) 	 Quisquam architecto and Facere nesciunt eligendi animi tempora'''
mr_nicholls_5058	Mr Jonathan Nicholls	38.0	2.1	43.2	'''(Natus accusantium officia eligendi) 	 Tenetur sunt and Quisquam vitae nemo'''
kirsty_griffiths_4908	Kirsty Griffiths	45.0	94.1	25.2	'''Ullam earum praesentium; Maiores minus 	 Ea ipsum voluptate'''
david_bruce_4691	David Bruce	93.0	59.1	54.2	'''(Facilis nobis quam) 	 Harum repellendus minus and Perspiciatis atque'''
dylan_roberts_7471	Dylan Roberts	47.0	43.1	69.2	'''(Libero) 	 Quaerat quidem quos velit and Fugiat quaerat'''
guy_wright_9156	Guy Wright	83.0	95.1	65.2	'''Note: Illo cum at pariatur omnis	 then Dolorem labore'''
gillian_hardy_6422	Gillian Hardy	73.0	53.1	40.2	'''Voluptas: Ducimus dignissimos tenetur porro nisi necessitatibus	 Unde rerum iste'''
dr_barton_7969	Dr Kathryn Barton	15.0	5.1	84.2	'''Reiciendis ad laudantium culpa: Minus laborum sint repellendus aliquam	 Exercitationem possimus'''
emma_smith_2172	Emma Smith	22.0	67.1	97.2	'''(Ab eius officiis) 	 Corrupti corporis porro culpa labore minus sequi and Id possimus eligendi'''
abbie_parkinson_5307	Abbie Howarth-Parkinson	9.0	23.1	6.2	'''Modi minus; Assumenda molestiae 	 Sint optio sequi'''
