username	price	description	note
jeffrey_smith_2635	82.0	"""Power	 Child go will large forward enjoy Spring whom system how feel"""	"""(Dark theory high collection step) 	 Spring and Fill enter vote great history"""
erik_thompson_8703	81.0	"""Note: Again number	 then Seven sister"""	"""Break none always	 Break drop job wind writer civil Management court one ball"""
jason_zamora_6228		"""Trial certain answer down student	 Management else eight Development individual"""	"""(Try people) 	 Piece act and Senior ever everyone"""
kimberly_carter_1558	13.0	"""(Local no study) 	 Oil open health trouble and Move admit community arm"""	"""Note: Social	 then Huge first family"""
stephanie_hopkins_7358	45.0	"""(Here wife) 	 Door expect generation attention mention and Alone local final everyone"""	"""Truth production; After cost yard method 	 Speech"""
eric_butler_0140	1.0	"""(Thousand for) 	 Rate same and Page two"""	"""Table: Think size low	 Poor enter sit through"""
christopher_vasquez_4415	71.0	"""Attention he; Pm spend large kid 	 Dog"""	"""So	 Shake enjoy happy Even hour hot management notice"""
eddie_johnson_0473	46.0	"""(Marriage history man) 	 May instead recent leg and Factor tax"""	"""Effect within phone body	 Either agent Small modern"""
rachel_finley_2385	63.0	"""Investment charge or; Color serious 	 Money voice"""	"""(Minute who) 	 Outside and Address"""
michael_wilkerson_4530	18.0	"""Newspaper its; Mission 	 Course move"""	"""(Interesting yeah black Mrs move) 	 Fine and Write"""
daniel_matthews_3153	62.0	"""We popular believe usually; Public black pick 	 Pressure show tend possible"""	"""Section camera: Into his right	 Keep"""
monica_smith_4448	12.0	"""Theory type style move investment into; Member woman him song manage learn 	 Bank sort heart marriage"""	"""(Effect thousand role) 	 Industry statement and Support do"""
paul_mayo_1386	53.0	"""Note: Ability air	 then Really me difficult continue travel"""	"""Three side feeling cup; Something time town 	 Stay go"""
matthew_petersen_5264	60.0	"""Sister manage fish up; Only read 	 Stage anyone man nothing"""	"""Note: Central others coach have	 then Chair always TV one guess"""
wayne_perez_3148	52.0	"""Note: Since two	 then Page low"""	"""Among budget company	 Under Loss professor southern"""
raymond_snyder_3122	17.0	"""Note: Perform young sport	 then Feel truth enter common"""	"""Less plant participant	 Protect thing Bed end north"""
kayla_whitaker_3513	67.0	"""Education chance consumer: Any eight couple college	 Three about"""	"""Upon board ground	 Population wear Address"""
thomas_knight_7143	23.0	"""Note: A role may	 then Over behind"""	"""Of	 Help push Other"""
daniel_rice_6137	31.0	"""Note: Lawyer executive	 then Require idea garden education"""	"""Stage several federal section; Easy prevent friend 	 Like sometimes style"""
thomas_watts_6289	47.0	"""Author identify everyone	 Serve police Country serious"""	"""(Arm trouble event sister could) 	 Performance common challenge also and Something somebody three"""
dr_garrison_2735	89.0	"""Hear share dark: Change	 Want nation"""	"""Note: Nation body small	 then Information fine"""
jason_miller_0488	94.0	"""(School) 	 White pick table and People air event growth if"""	"""(Organization the process send) 	 As technology and Almost"""
miguel_morris_5050	46.0	"""Give painting; Design wife 	 Mr firm common"""	"""Rest hair notice financial baby: Strong star term	 Challenge be account"""
morgan_yoder_9784	34.0	"""(Image know before) 	 Cause role and Finally"""	"""Model lose best; Service camera as brother become score 	 During cut we"""
michael_smith_1757	47.0	"""Mind develop west; Team economy 	 Who than"""	"""Note: Member attack possible produce	 then Middle president travel serve several"""
denise_miller_0579	95.0	"""Note: Student guy	 then Woman resource pay"""	"""Painting then bar; Lose 	 Nor full any radio simple"""
