username	salary	rating	age	message	remark
matthew_cox_2078	49.0	95.1	61.2	'''Cultural yes game	 Floor others Simply shake measure likely'''	'''Remain human man; Involve never level others 	 Agency police'''
shannon_adams_8618	69.0	78.1	49.2	'''Worker compare: Play there article	 Job top society'''	'''Pretty shoulder; Others us 	 Ball present'''
joshua_arellano_0537	79.0	72.1	25.2	'''(Point leader) 	 Letter past possible research smile and Increase short'''	'''Stage benefit industry month everybody pass; Be yeah fire 	 Song'''
lisa_davis_9616	50.0	16.1	4.2	'''(Reveal force Democrat social use) 	 Sister and Carry make have away'''	'''Vote near process stock shoulder go; Agreement person join moment 	 Father hospital team day we'''
jasmine_rodriguez_0808	12.0	61.1	74.2	'''Note: Reach model	 then Sometimes'''	'''Effort; Remember 	 Modern bank information'''
anthony_barajas_1893	4.0	16.1	90.2	'''(Letter occur method majority very) 	 Her consider and Threat turn less debate discover life'''	'''Among	 Job Clear somebody should'''
regina_morris_5536	62.0	86.1	76.2	'''Usually dinner professor benefit agreement; Stage page herself part 	 Simply really'''	'''Note: Speech case common lay	 then Simply'''
jonathan_anderson_5010	32.0	100.1	51.2	'''Training; Information 	 Born dinner'''	'''Want answer part true; Ask case realize middle 	 Fish'''
laura_moore_4447	45.0	44.1	20.2	'''Ask still father manager: Everyone	 Source they'''	'''Note: Billion hand management country	 then Citizen security force'''
amber_yates_4557	22.0	8.1	86.2	'''Hold shake eat	 Protect Everybody'''	'''Onto during issue stuff sport	 Sister entire season system Special improve human'''
stephen_robles_6103	66.0	13.1	65.2	'''(Finish go) 	 Environment truth floor boy and After worry question'''	'''Town tough school	 Talk like top spring compare Effect probably challenge beautiful'''
richard_sanchez_2535	21.0		28.2	'''Note: Idea	 then Forward'''	'''Finally middle thank: Leader strategy	 Democratic current'''
eric_estrada_5287	76.0	4.1	81.2	'''Full together	 Sort responsibility drive whatever accept Maybe light'''	'''Themselves teacher particularly; Force 	 Simply her agreement my'''
cody_torres_1075	52.0	85.1	36.2	'''Action government for	 Start need hold shake including Character'''	'''View eye	 Behavior point ahead blood who Beat finish position'''
kelly_wallace_3056	77.0	29.1	41.2	'''Himself mouth area return: Apply light	 Lead gun central for child'''	'''Happen edge each; Great 	 Time'''
jonathan_russell_0562	100.0	5.1	82.2	'''(Later) 	 Current and Trouble more onto'''	'''Do toward: Finally shoulder	 Both director also wonder'''
samuel_barnett_5570	67.0	31.1	3.2	'''Note: Good training important outside lot	 then Defense resource'''	'''(His set theory) 	 Large them force ready itself and View piece evidence ball'''
emily_hubbard_6597	72.0	21.1	27.2	'''Work she: Certainly own around	 Hair office detail again'''	'''Piece soldier sign: Manager well	 Energy'''
donald_davila_9397	14.0	73.1	98.2	'''Usually somebody: Security effect age network	 Decide vote feel'''	'''Teacher tree great believe name; Can take 	 System'''
matthew_murphy_2970	33.0	12.1	95.2	'''(Country his smile) 	 Blue rock cultural page read and Party'''	'''Note: Mind box	 then Determine difference set'''
annette_andrews_5437	6.0	51.1	68.2	'''Natural available movement: Television again	 Certainly low nature our'''	'''Note: Treat career few leave scientist	 then Structure'''
jonathan_lester_5843	86.0	22.1	68.2	'''Window us: Go nothing individual	 Stand into'''	'''Note: Important	 then Turn fish'''
bradley_lopez_7032	30.0	65.1	85.2	'''(Figure single wide kind relationship) 	 Win and Recently difficult everyone'''	'''Note: End tend daughter fall	 then Reflect'''
jamie_mcfarland_7976	86.0	52.1	70.2	'''Miss: Movement court strong	 Enough indicate'''	'''Note: At people	 then Both ten account not clear'''
kimberly_duncan_5658	81.0	81.1	26.2	'''As hour our with; Raise because 	 Past either feeling common notice cell'''	'''Note: Structure your	 then Region always'''
michael_boyer_2966	85.0	26.1	21.2	'''Consider might: Still create	 Policy sort discuss'''	'''Staff ground want table; Before attorney 	 Picture condition'''
william_thomas_1747		76.1	71.2	'''Spend cup season	 Player name family stand teacher write Receive'''	'''Box skill: Good from role wide nothing	 Environment thousand medical'''
gabriela_md_1555	7.0	48.1	48.2	'''Whether seek	 Use drive Join bed entire'''	'''(Kind media) 	 Past and Fight consider seven much nothing'''
kyle_daniel_1835	71.0	21.1	8.2	'''Will mean: Whether seven newspaper develop	 Late subject edge'''	'''Few; Drive field behavior you factor 	 In national'''
megan_morgan_3535	27.0	22.1	16.2	'''Machine parent city	 Area fish fear Six last'''	'''Charge wait; Officer 	 Job issue wall'''
lauren_little_8140	9.0	58.1	52.2	'''Mrs agree	 Million large Fill management'''	'''(Right home source) 	 Material ago and Agreement'''
wendy_md_6890	40.0	41.1	83.2	'''Brother down; Imagine thank still send successful kind 	 Leader although'''	'''Note: Talk cultural gas	 then Different'''
mary_james_8547	91.0	46.1	40.2	'''Subject entire of; Three use 	 Any area another'''	'''Operation arm forward heart program; Hand be drive 	 Herself some school clear'''
justin_franco_2783	42.0	87.1	21.2	'''Trip institution	 College crime offer green my Throughout her middle laugh happen'''	'''Keep recent point	 Toward step person Work country'''
christian_ramos_3725	97.0	66.1	88.2	'''Letter drop game	 Purpose soldier Opportunity church'''	'''Nice discover office blood what: Group physical	 Around top'''
catherine_cherry_1403	45.0	35.1	33.2	'''On even learn: Ago believe	 Past'''	'''Push usually: Sister former just	 Simple every environment'''
monica_green_9420	89.0	6.1	60.2	'''(Picture decision sea high left) 	 Seem find deal director couple sea and Key speech'''	'''(Eight democratic) 	 Thought social and Computer'''
mark_howard_9656	39.0	81.1	21.2	'''Each front miss fight field miss	 Eye half State this'''	'''(Four young step parent day teacher) 	 West almost seem and Father eye'''
brianna_mitchell_6470	63.0	91.1		'''Note: Require rich stay	 then List animal here'''	'''Note: Expect poor boy	 then Benefit our'''
briana_watts_4306	55.0	56.1	3.2	'''Manager	 Somebody up American it alone PM continue'''	'''If statement girl: Foreign specific	 Remain bring common'''
terry_miller_9927	32.0	19.1	8.2	'''Successful nor above PM board must; Stay with wife 	 Child knowledge peace turn'''	'''(Tonight his young trial sing) 	 Medical collection collection of and Part size big'''
eric_dixon_3850	58.0	34.1	74.2	'''(Player and maybe) 	 Discussion particularly husband early easy full and Coach structure'''	'''Up hair message result; Nature make just 	 Common'''
