username;name;rating;description;message
kyle_jackson_8724;Kyle Jackson;100.0;"""Note: Unit; then Away collection serious""";"""Put let decide; Dinner local cell good ; Republican understand country enter"""
brandon_gonzalez_8700;Brandon Gonzalez;12.0;"""Forward tree about: Such loss dark effect score just; Through yeah middle""";"""Bar within: Shake research very take; When meeting"""
april_black_2169;April Black;72.0;"""Enough activity use; White once ; Then""";"""Candidate rise role believe fight accept; Ask speak score while ; Last challenge student"""
caleb_hurley_8294;Caleb Hurley;11.0;"""Fire: Read; Program analysis""";"""Note: Left; then Word force population word news sense"""
bob_riley_9726;Bob Riley;39.0;"""Floor training: Right large; Impact pick""";"""(In head) ; Win save and Analysis above"""
kathleen_porter_6399;Kathleen Porter;40.0;"""Single within: Identify leader; Series budget until""";"""Cultural this music peace partner; Stay too approach Line Mr"""
alexander_webb_9776;Alexander Webb;43.0;"""(Doctor stage away meeting) ; Research reflect and Interesting middle""";"""Right do; Somebody might often include International build"""
linda_ford_6045;Linda Ford;49.0;"""Movie theory; That shoulder ; Occur tough perhaps""";"""Idea better mention; Particular Best even here mean may produce"""
thomas_austin_0462;Thomas Austin;3.0;"""(Car get bank) ; Local a and Item every""";"""Note: Down morning color; then Money part"""
laura_miller_6571;l;91.0;"""Most: Organization; Forget office scientist""";"""Determine father before; Behind Law"""
crystal_collins_3522;Crystal Collins;38.0;"""(Foot huge window) ; Yeah time form degree and Voice fire away""";"""(Successful word popular trial born) ; Around and Laugh wrong"""
sheila_dunlap_3790;Sheila Dunlap;63.0;"""(Bag natural) ; Here newspaper and Black author""";"""Hospital carry: Test simple song see difference; Forget threat"""
kristin_rhodes_3837;Kristin Rhodes;35.0;"""(Take decade price own happy anything) ; Dog Mr call and Itself""";"""Store heavy health page sort relate: Brother near; Key doctor technology"""
joseph_owens_1607;Joseph Owens;36.0;"""Note: Cut piece; then Usually foot""";"""Service: Mean his would; Station movement quickly"""
matthew_gonzales_2154;Matthew Gonzales;65.0;"""Follow sound maintain fly; Wife skill alone where all commercial ; Structure very establish""";"""(Sometimes voice land) ; Front job increase strategy analysis and Scientist Republican to"""
christie_black_0852;Christie Black;;"""(Decade artist policy staff) ; Account visit and Model country scientist design""";"""Increase set; Lot house cost crime Surface"""
kimberly_johnson_1085;Kimberly Johnson;52.0;"""Note: Like; then Argue guy foreign good institution some""";"""Wind also government; Whatever less defense Mother soon official culture"""
pamela_burnett_7130;Pamela Burnett;27.0;"""(Institution) ; Middle herself and Kind analysis positive PM may society""";"""Career; Authority rate yes save ; Understand alone business choose"""
katelyn_perez_6929;Katelyn Perez;71.0;"""Read tend view: Soon too; Each class design hot""";"""Tree culture: Pay effort; Easy size arrive least home"""
joseph_reyes_3000;Joseph Reyes;46.0;"""Part citizen gas usually; Whether character Over play""";"""Think understand; Son people including Light develop town"""
isaac_white_5512;Isaac White;31.0;"""Speak let area writer; Before focus catch Blood or happy admit trade""";"""(Tough subject know inside happen pass) ; Safe skin and Money now just"""
morgan_goodman_4339;Morgan Goodman;54.0;"""Difference room: Full mention factor; Clearly kind share avoid art""";"""Return court finish figure create top; Realize stuff figure Art"""
theodore_williams_2528;Theodore Williams;81.0;"""Note: Growth international something behavior simply; then Country""";"""Gun article lose benefit material; Away allow ; Congress police either"""
joshua_jimenez_2663;Joshua Jimenez;39.0;"""(Believe power there) ; Without and So north defense card serious""";"""Clear; Fish yes Visit middle foreign"""
john_garcia_2901;John Garcia;67.0;"""Product: Light community reality imagine; Item""";"""Capital serve offer; Day particular ; Though keep"""
mitchell_reeves_8136;Mitchell Reeves;9.0;"""Note: Entire know forget; then Begin common hot series""";"""See street area go provide; Son none campaign Mr Than on line"""
jasmine_webb_4675;Jasmine Webb;99.0;"""(President draw fear single our change whatever) ; Themselves improve and Minute natural join they""";"""(Friend small soon meet perform) ; Party book break exist and Ball"""
kendra_cardenas_7113;Kendra Cardenas;60.0;"""Throw Republican game; Since song total response bed ; Hope surface""";"""Early customer program apply story: Figure during kind much; Key"""
ryan_allen_4983;Ryan Allen;22.0;"""Fill; Meet top remain ; Modern before""";"""Past indicate national field; Series during institution Ball"""
chad_griffith_4459;Chad Griffith;19.0;"""American right; Open alone Medical something""";"""Note: Activity; then Player spend meeting kind"""
