username;age;summary
spencer_bryant_7007;56.0;"""Safe step here friend foot; Quickly player ; Score physical fund conference several"""
april_butler_7351;44.0;"""Its; Deal color forget there understand Individual positive pattern sort feel member"""
philip_young_4306;41.0;"""Let discuss force break actually; Reduce trip view chance exist ; Poor because"""
leslie_khan_0208;;"""Note: Year too; then Growth much"""
paige_rios_8827;94.0;"""Visit short local; Member concern travel term treatment ; While forget put"""
william_hayes_0079;70.0;"""Note: Not; then Face line past ok we"""
heather_jackson_5526;20.0;"""Final that finally character it; Feeling Bar land yeah"""
tony_davis_3841;69.0;"""Religious difference: Various task success he; Beat foot upon think wide long"""
samantha_hardin_7994;26.0;"""Note: Describe statement about nature what; then Number it Mrs"""
donald_schultz_5474;12.0;"""(Traditional laugh society bill then) ; Night stage floor pressure next and Fire"""
amber_andersen_0622;55.0;"""Majority: Direction including media; Describe thing take"""
kimberly_wright_9428;2.0;"""(Point technology) ; Employee and Give leader strategy wrong"""
michael_baker_0940;2.0;"""Forget; Others child School too"""
henry_lewis_7754;90.0;"""(Standard many view group) ; Physical culture stock my you and Research church total poor decade fish"""
emily_thomas_0403;3.0;"""Material method; Discover article Generation wrong middle"""
russell_barnes_5085;29.0;"""Will form talk: It business; Fall expert form poor Congress"""
casey_hernandez_4465;92.0;"""Share individual; Forward through Race never"""
jordan_chambers_2041;34.0;"""Join: Side there; May reality student benefit accept"""
charles_elliott_2729;85.0;"""(Plant system) ; Left wonder and Case"""
linda_davila_8692;10.0;"""(Month decade) ; Difference wide force and Economy"""
robert_smith_7282;16.0;"""Note: Face always; then A condition crime"""
terry_hoffman_6191;99.0;"""National week five seven choose onto; Pretty Various skill property their attack"""
