username;name;rating;review
diane_morrison_7638;Diane Morrison;52.0;"""(Aspernatur aliquid eos occaecati rerum) ; Molestias sunt and Nemo"""
miss_clarke_7896;Miss Beverley Clarke;11.0;"""(Sunt labore perspiciatis explicabo nihil) ; Atque deserunt minima recusandae and Debitis eius laboriosam atque"""
miss_watts_1661;Miss Aimee Watts;90.0;"""Note: Fuga; then Eveniet tempora"""
dr_porter_5960;Dr Jeremy Porter;98.0;"""(Nesciunt ut minus) ; Ullam dolorum mollitia and Natus sunt"""
glen_perkins_9038;Glen Perkins;43.0;"""Dignissimos natus quos perspiciatis eaque: Quae sint necessitatibus aspernatur; Adipisci perspiciatis distinctio"""
richard_stanley_4622;Richard Stanley;52.0;"""(Veniam sit saepe) ; Ullam rem dicta and Adipisci corrupti voluptas praesentium optio sed"""
leanne_wright_7558;Leanne Wright;40.0;"""Voluptates corporis molestias; Nulla soluta perferendis recusandae sequi Est nam distinctio"""
june_donnelly_8861;l;42.0;"""(Repellat nemo esse) ; Quibusdam voluptas ad and Harum fugit commodi velit assumenda"""
terry_smith_8904;Terry Smith;59.0;"""(Aliquid) ; Perferendis sit and Architecto rerum"""
stacey_parsons_8250;Stacey Parsons;76.0;"""Quod magni; Quia praesentium ; At magni"""
rita_stevens_7103;Rita Stevens;87.0;"""Quia; Facilis ad sequi ; Numquam"""
mohammed_sutton_7035;Mohammed Sutton;;"""(Amet beatae) ; Cum facilis voluptatum reiciendis and Enim dolorem"""
louise_cameron_6047;Louise Cameron;74.0;"""(A est) ; Quibusdam commodi commodi molestias and Tempore pariatur aspernatur"""
jason_khan_9539;Jason Khan;7.0;"""Note: Harum occaecati; then Optio reiciendis nihil dignissimos"""
mr_wilson_3568;Mr Kieran Wilson;43.0;"""(In ipsum) ; Dolorem reiciendis perferendis optio nihil and Beatae repellendus"""
miss_martin_4287;Miss Margaret Martin;42.0;"""Quia doloribus fugit dolor: Tenetur sequi; Voluptas et odio"""
ms_holland_1251;Ms Molly Holland;94.0;"""Note: Sapiente tempora nihil fugiat iure; then Doloribus velit ad nemo similique voluptatem"""
victoria_dixon_9219;Victoria Dixon;68.0;"""Note: Minima sint iusto magnam veniam; then Reiciendis commodi"""
rosemary_jones_0912;Rosemary Jones;9.0;"""Note: Placeat minima deleniti tempore; then Praesentium neque occaecati quaerat tenetur"""
dr_hughes_6116;Dr Maureen Hughes;31.0;"""Explicabo minima veniam; Beatae est Culpa quas magnam voluptas iusto"""
ross_hamilton_5325;Ross Turner-Hamilton;84.0;"""Omnis debitis; Voluptatem similique corporis Blanditiis magni harum quibusdam"""
dr_little_4569;Dr Tina Little;17.0;"""Odit nihil: Natus nobis quibusdam non consequatur dolore; Tempore corrupti nostrum"""
mr_taylor_9255;Mr Joel Taylor;21.0;"""Consequuntur; Dignissimos quos facere ; Consequatur quaerat"""
ms_robinson_9138;Ms Paige Robinson;3.0;"""Voluptates veniam dolor hic; Nisi quibusdam sunt quisquam molestias minus Cupiditate magni"""
joanne_ali_7257;Joanne Lawson-Ali;83.0;"""Numquam molestiae: Facilis ullam labore; Aliquam"""
miss_moore_8877;Miss Sharon Moore;89.0;"""(Nostrum cupiditate) ; Architecto ratione voluptatibus itaque aspernatur suscipit and Recusandae eius"""
gregory_curtis_8976;Gregory Curtis;77.0;"""Architecto omnis quaerat hic voluptate dolores: Ut repudiandae; Molestiae consequatur tenetur labore"""
charlotte_grant_6472;Charlotte Grant;56.0;"""(Nostrum vitae sapiente) ; Corrupti similique and Adipisci ex nemo unde"""
mr_wood_1494;Mr Stephen Wood;48.0;"""Laudantium iure exercitationem accusamus: Assumenda sunt occaecati; Porro est"""
leah_robinson_7222;Leah Robinson;60.0;"""Assumenda aperiam; Sed repellendus quam recusandae ; Temporibus optio illum eaque consequuntur"""
jack_rhodes_5491;Jack Rhodes;99.0;"""Ipsa ullam sed; Non blanditiis ; Quam et veniam saepe"""
dr_taylor_3091;Dr Albert Taylor;26.0;"""Mollitia ad reprehenderit incidunt molestiae; Hic quos sit Error sapiente animi iste laboriosam nam"""
catherine_williamson_6220;Catherine Williamson;88.0;"""Impedit maiores labore; Reprehenderit excepturi iusto fugit sequi pariatur ; Voluptatibus vel ipsam"""
kimberley_pickering_9195;Kimberley Pickering;33.0;"""(Magni dicta quia) ; Officiis ab and Animi eaque"""
lawrence_khan_7634;Lawrence Khan;49.0;"""Sunt illo: Commodi a nisi; Recusandae veritatis earum culpa ipsam ducimus"""
ms_hayes_5346;Ms Megan Hayes;24.0;"""Amet quos ex nobis libero: Magni sit inventore omnis quaerat; Modi dicta consectetur illo"""
donald_watson_2346;Donald Watson;11.0;"""Note: Quam dolores et; then Placeat dicta esse accusamus iusto"""
kelly_owen_6395;Kelly Owen;42.0;"""(Soluta distinctio) ; Esse omnis and Cupiditate a non doloremque accusamus"""
terry_fraser_4061;Terry Owen-Fraser;12.0;"""(Omnis et modi) ; Illum mollitia and Tenetur ratione fugiat quia"""
pauline_anderson_2328;Pauline Anderson;76.0;"""Note: Accusamus voluptas deserunt; then Officiis consectetur molestias"""
