username	price	note
crystal_house_1161	6.0	'''(Approach front) 	 Finally film cost and Ground watch side'''
christopher_williams_4861	19.0	'''Rule smile: Pay respond so	 Mention'''
timothy_holder_7831	34.0	'''Note: Film condition	 then American machine soon'''
matthew_thomas_2721	17.0	'''Contain answer land lead	 Soldier Interesting'''
debra_howe_8915	89.0	'''Note: Interest when moment	 then Many particular'''
rachel_houston_3886	58.0	'''Activity want exactly	 Join just step ever Management do nature'''
abigail_moore_8603	38.0	'''Note: Activity street example tough save	 then Space sister want'''
taylor_hamilton_3499	53.0	'''Realize	 Level ground hour These specific there life last'''
whitney_lewis_0121	17.0	'''None person	 Forget like consumer smile effect Ability note among future who sport'''
robert_weaver_6549	24.0	'''Likely note soldier	 Traditional effect exist floor Onto speech especially have'''
shannon_davis_8197	29.0	'''(Performance) 	 Woman business fact forward significant agency and Type just'''
henry_rivera_5033		'''Note: People	 then Happy teach'''
charles_morales_3919	22.0	'''(Democratic say they born) 	 Quite ever laugh onto and These against cultural'''
rebekah_rowe_6921	63.0	'''Anything agency six determine: Ahead fund whatever	 Fire model'''
amy_wilson_3085	62.0	'''Note: Make feel myself	 then Expert'''
sherri_king_0781	37.0	'''(Debate subject west yourself) 	 Significant arrive direction western and Probably cell'''
veronica_marshall_6046	70.0	'''(Expect science) 	 Sense for safe and This operation control'''
derek_le_4713	77.0	'''Ball short help season; All top 	 During yeah issue head hour'''
jean_valdez_2024	83.0	'''Exist television man; Vote inside who magazine 	 Subject likely professional project'''
claire_kelley_8399	78.0	'''(Military himself deep) 	 Trial sure reveal and Describe contain structure'''
maria_ross_3345	1.0	'''Maybe scene; Best assume store no 	 Soldier'''
robert_clark_9537	37.0	'''Senior finish world many knowledge	 Impact option cause Bit agreement'''
debra_stone_8347	1.0	'''Father ever become water; Report 	 Speech candidate before chance'''
amanda_vazquez_7401	10.0	'''(Hair environment respond citizen) 	 Begin should upon wife should and Always raise'''
michael_bailey_6428	76.0	'''(Enter agent food) 	 Though task and Quickly blood morning else'''
chloe_frey_4526	8.0	'''Indeed bag seven set though; Analysis Congress owner 	 Study drug young specific'''
