username	age	message
paula_smith_9546	33.0	'''Note: Consequatur voluptatum	 then Expedita dolore illo architecto'''
aimee_hutchinson_9520	7.0	'''Voluptatem iure fugiat	 Accusamus Dicta consectetur distinctio natus impedit'''
tom_jenkins_9354	14.0	'''Minima optio ut aliquam: Modi velit quam ipsam odio	 Molestiae veniam'''
benjamin_clark_2352	23.0	'''Delectus: Aspernatur exercitationem quibusdam	 Similique ut eligendi at laboriosam'''
mrs_walton_6252	79.0	'''Magnam asperiores inventore	 Ipsam est Cum dolores'''
peter_short_0075	14.0	'''Atque occaecati: Et ullam doloribus consequuntur quam a	 Expedita nesciunt nisi hic'''
marcus_reid_5361	16.0	'''(Ipsa tenetur) 	 Ut officiis dolorem fugiat accusantium ex and Veniam ipsum ducimus'''
dr_ellis_8173	74.0	'''Sequi: Quod soluta minus	 Minus ut hic'''
mr_ball_4098	87.0	'''Nulla totam	 Exercitationem ipsam minima Iusto a ducimus animi'''
ms_preston_1319	12.0	'''Dolores sint animi voluptatum: Impedit iure	 Saepe iure veniam temporibus'''
yvonne_gibbs_2565	30.0	'''Autem eveniet aperiam molestias	 Vero similique voluptatibus nulla Illo sapiente'''
mr_godfrey_3107	82.0	'''(Voluptatem commodi) 	 Quisquam cum magni tempore and Molestiae perspiciatis culpa enim'''
raymond_thomas_3538	25.0	'''Eum accusantium incidunt; Non laboriosam deleniti tempore 	 Ipsam'''
paula_poole_4759	62.0	'''(Odio beatae vitae tenetur voluptatum) 	 Blanditiis iusto neque atque quis voluptates and Laboriosam veniam'''
carly_smith_4586	80.0	'''Commodi fugit iste accusamus sit	 Maiores labore Esse eveniet'''
christopher_hall_1467	35.0	'''Consectetur unde eligendi omnis; Sequi natus voluptatum 	 Quam ducimus quasi porro sit'''
mr_hamilton_8484	99.0	'''Note: Quis	 then Id ut'''
barbara_hyde_8815	79.0	'''Reiciendis	 Dolorum unde Possimus quisquam sapiente'''
mr_johnson_0298	78.0	'''Perspiciatis ullam: Repudiandae est	 Ad provident impedit'''
jayne_jones_1248	66.0	'''(Sed fugiat incidunt accusantium voluptates aperiam) 	 Rerum laboriosam and Reiciendis praesentium sequi vero et'''
frederick_roberts_9990	73.0	'''Nihil quod cumque: Voluptatibus labore magni vitae	 Beatae qui rem aut'''
lindsey_baker_6384	92.0	'''Consequatur accusamus; Maxime 	 Quidem eveniet dolores'''
jemma_bailey_5603	48.0	'''Note: Ex accusamus	 then Sit sit veritatis'''
martyn_green_8855	91.0	'''Natus voluptatibus odit: Aliquam harum	 Natus'''
dr_pollard_4866	91.0	'''Sint; Illo 	 Adipisci iure occaecati'''
helen_gill_2251	35.0	'''Suscipit modi atque quae officiis	 Quis iure odio autem Ab labore pariatur libero vitae dicta'''
dorothy_haynes_2982	11.0	'''Dolorem	 Fuga Illo unde'''
marilyn_harrison_9463	77.0	'''Magnam commodi neque	 Dolorem cumque quo doloremque eum Cupiditate quidem voluptatum'''
miss_morris_4023	27.0	'''Note: Aliquam	 then Laboriosam molestias facere'''
victoria_cooper_1846	2.0	'''Nobis facilis quasi non libero nulla	 Eaque architecto Corporis commodi'''
dr_pugh_3591	59.0	'''Quam cum: Nulla animi magnam dicta adipisci asperiores	 Dolor libero provident vero rem'''
scott_wilson_1684	10.0	'''Note: Quos quod	 then Quis velit'''
joanna_mason_5602	58.0	'''Note: In amet culpa	 then Deleniti blanditiis'''
mohammad_jackson_7240	13.0	'''Consectetur adipisci rem saepe; Dolorem autem odit a 	 Dolorem architecto eveniet'''
jean_price_4005		'''Note: Mollitia repellendus vero	 then Cum doloribus fuga'''
john_barker_8624	79.0	'''(Aliquam) 	 Quae nam voluptate and Ex quae quas'''
mrs_brien_1314	77.0	'''Note: Voluptatum dolorem unde perspiciatis	 then Illum accusamus'''
amelia_buckley_6475	15.0	'''(Pariatur expedita) 	 Voluptatibus molestiae and Officia voluptate'''
julia_bray_9847	83.0	'''Note: Tenetur	 then Tenetur dolorem nulla asperiores'''
