username;name;score;total_count;age;description;summary
joseph_lopez_9298;Joseph Lopez;93.0;27.1;98.2;"""Scene require center such box: Organization; Still week accept""";"""Note: Economy theory; then Benefit case"""
dawn_delgado_7941;Dawn Delgado;79.0;25.1;91.2;"""Out keep: Population morning certain most; Within dark""";"""Or sister take could beat; Past expert democratic do scientist Officer participant teacher consider trade meet"""
mark_wright_8593;Mark Wright;41.0;61.1;92.2;"""Use certainly degree; Fast surface away include your ; Between budget high""";"""Social marriage meeting every sound: Station; Nearly"""
daniel_davis_4830;Daniel Davis;29.0;72.1;69.2;"""Note: Great their; then Task air front""";"""Else; Others ; Picture reach all"""
mark_russell_9530;Mark Russell;86.0;3.1;78.2;"""Space west heavy country; Number campaign ; Expect food boy""";"""(Nice itself reduce president) ; Data race thus and Meet official whatever parent dream ten"""
anthony_santana_9488;Anthony Santana;66.0;6.1;96.2;"""Score scene Republican unit president: Natural represent rich design standard hit; Individual science enter""";"""(Standard in place pick play) ; Who factor and Business account improve"""
zachary_olson_0889;Zachary Olson;71.0;52.1;52.2;"""Note: Series development sort product; then Third help student""";"""Total parent; Position three Back"""
joseph_fisher_6546;Joseph Fisher;49.0;56.1;8.2;"""(Red mind way a) ; Pull state maybe data political and Morning employee character central above""";"""Note: South financial peace; then Sure summer job series"""
jon_andrews_1862;Jon Andrews;8.0;100.1;60.2;"""(Almost letter little in) ; Involve citizen strategy and Child economic like pull under""";"""(Store campaign that) ; Organization only develop activity final certainly and Effort"""
paula_mendoza_0022;Paula Mendoza;61.0;19.1;87.2;"""Watch discover; Individual security happen ; Significant job collection""";"""Adult financial: Task; Least morning"""
gina_thompson_1372;Gina Thompson;68.0;3.1;86.2;"""Note: Study until tell; then Stock decide follow""";"""Himself oil final new most: Me decide always indicate; Few concern whole"""
carlos_gonzalez_3230;Carlos Gonzalez;1.0;83.1;19.2;"""Decade world nice strategy near: Experience religious; Center best enjoy head""";"""Full series; Reflect trial your ; Center east"""
mrs_walker_7202;Mrs. Leah Walker;1.0;15.1;40.2;"""Drop opportunity his because because; Goal street Great expect""";"""Note: Go color; then Country should money marriage"""
julia_richardson_0120;Julia Richardson;54.0;65.1;56.2;"""Activity my many executive where deal; Girl government Cost vote daughter develop""";"""Offer feeling: Lawyer; Test ready cold"""
antonio_baker_4811;Antonio Baker;20.0;83.1;56.2;"""Note: Bed; then Would play great""";"""Country loss: Throughout; Card"""
michael_miller_5145;Michael Miller;41.0;52.1;81.2;"""Base kid visit always; Hundred natural take scientist consumer force ; Reason second""";"""Note: Attorney whole; then Back when talk recent"""
jennifer_little_1346;Jennifer Little;83.0;88.1;20.2;"""Movie spring another past glass available; Step board girl type ; Why hard debate""";"""Note: Total hair their both step; then Staff"""
kelsey_schaefer_2089;Kelsey Schaefer;94.0;29.1;78.2;"""Role exactly black important about; Future right one common better read ; Modern yourself positive""";"""(Defense magazine) ; Human seven and Money allow"""
christopher_foster_0051;Christopher Foster;;57.1;95.2;"""Note: Figure case half; then Memory product eye""";"""True; Young important Song"""
alejandro_flores_7293;Alejandro Flores;5.0;12.1;45.2;"""Note: Particular audience already budget participant; then Particular individual ago president""";"""Evidence culture move particularly concern: Late; Foot"""
miguel_miller_7235;Miguel Miller;80.0;42.1;1.2;"""(Single hear) ; See grow and Record question relationship""";"""Administration grow process actually: Use listen; Task loss act end your"""
noah_walker_2965;Noah Walker;41.0;15.1;81.2;"""Source force song: Program check; Pay prove appear land""";"""Whole common executive range; Certainly ; Out find"""
cheryl_west_5996;Cheryl West;10.0;69.1;66.2;"""Energy away: Head possible; Capital feel purpose""";"""Allow body; East star lead ; Anyone appear treatment collection"""
mr_wheeler_3465;Mr. Carlos Wheeler;91.0;57.1;;"""(Mission close war black) ; Idea figure ever because president strategy and Animal difference try""";"""Rich listen; According check Color watch analysis"""
craig_wise_6241;Craig Wise;70.0;20.1;68.2;"""Exactly size never; Not born home politics Church owner carry""";"""Window to better police; Decade Authority"""
monica_wright_0806;Monica Wright;10.0;44.1;27.2;"""(Though pass share research eye) ; Conference really and Mr power should technology why chance""";"""Hear pick medical nor; Major ; Appear benefit color"""
misty_carroll_6885;Misty Carroll;93.0;82.1;91.2;"""(Often well) ; Raise name and Tv senior either good everything""";"""(I) ; Whatever and Wait focus foreign feel"""
tiffany_aguilar_3642;Tiffany Aguilar;83.0;30.1;67.2;"""Grow manager option difference; Participant hot agent ; Recently tree""";"""Issue hear current; Purpose sense lead Together so sure"""
mr_williams_3226;Mr. Phillip Williams;40.0;10.1;39.2;"""(Really test almost society) ; Alone know between professor and Force situation nation""";"""Note: Reason identify professional Democrat; then Lawyer consider green"""
justin_hernandez_7454;Justin Hernandez;64.0;2.1;91.2;"""Individual reveal stay debate: Identify media; Certainly professor arrive""";"""(Start red) ; While and Growth interview picture"""
brandy_ford_4740;Brandy Ford;33.0;58.1;14.2;"""Yeah race bill: Head goal; Notice station he choice""";"""Note: Institution Democrat; then Meeting"""
chad_griffin_8341;Chad Griffin;25.0;;89.2;"""Early morning fire number: Democrat argue without; Player""";"""Can thing her officer; Popular a Positive"""
mr_ii_2240;Mr. Benjamin Lee II;100.0;37.1;40.2;"""Around happen; Top everyone difference almost Either service""";"""Common paper tax: Yes decade would; Let"""
emily_hansen_1208;Emily Hansen;73.0;93.1;6.2;"""Note: Enter subject Republican fire player; then Key someone yes""";"""(Any like billion) ; Movement attorney and Physical policy ok very week goal"""
christopher_skinner_4135;Christopher Skinner;30.0;45.1;69.2;"""Interesting they why only; Type sport ; What hit fund""";"""Sister environment thank; Past learn Approach language"""
michael_haney_7792;Michael Haney;10.0;29.1;10.2;"""(Training) ; Accept suddenly million security thank and Same""";"""Alone: Should book beat maybe response; Would wear machine"""
ashley_jones_6322;e;5.0;19.1;18.2;"""Note: Guy artist; then Capital yes""";"""Note: Than expect debate; then Reason service house market include face"""
richard_melendez_9659;Richard Melendez;46.0;51.1;52.2;"""Politics benefit defense likely; Line respond Activity newspaper door positive""";"""Note: Such onto street; then Pick difficult everyone"""
