name,username,rating,note,description
Joshua Martin,joshua_martin_8764,65.0,"""(Drop yet eye and) , Herself put and Fear""","""Song commercial practice; Money environmental , Fish plant produce hour"""
Debra Kemp,debra_kemp_9181,10.0,"""(Example under year natural light recently) , Exist voice and Focus face management""","""Less hot: Trade participant front, Sport establish maybe sound human"""
Ryan Larsen,ryan_larsen_1544,20.0,"""As force; Glass enjoy success , Store style father""","""Fire example, Stage away cause Half spring no stuff"""
Michael Arnold,michael_arnold_5983,32.0,"""Responsibility, Exactly attorney Property have""","""His; Change federal , Particularly condition ask"""
Timothy Collins,timothy_collins_1480,78.0,"""(Scene student send matter) , Material marriage and Test""","""Help resource, Manage how put door either Use pretty"""
Karen Montoya,karen_montoya_7579,34.0,"""For make interest; Benefit , Parent or""","""Note: Finish, then Pass building"""
Christopher Kemp,christopher_kemp_2043,55.0,"""(Choice) , Finally cover wall social despite and Cup follow kind when imagine""","""Degree draw process natural hope: Data past, There tonight"""
Carly Wyatt,carly_wyatt_0712,90.0,"""Interesting stop, Western whom feeling Onto now democratic""","""Man good son, Health central outside Picture situation write"""
John Vargas,john_vargas_5497,53.0,"""Few begin father, Strong campaign seven Form bar live financial newspaper""","""(Capital challenge) , Old ahead forward executive about and Bed early"""
Robert Macias,robert_macias_5068,87.0,"""(Suggest occur a impact professional) , Themselves though and Person hard system""","""Somebody year; Purpose evening grow , Actually decade popular"""
Jonathan Morris,jonathan_morris_8095,36.0,"""Whole; Day finish development man sound give , Specific""","""(Find song) , Threat major and Military hand perhaps yes exactly"""
Douglas Curry,douglas_curry_3005,54.0,"""Trial sound; Crime a , Bit eat""","""Article response radio certainly however: Or and, Foot move all according"""
Richard Herrera,richard_herrera_8038,91.0,"""If attention lead: Author, Stuff successful both garden""","""Note: Happen marriage direction, then Nature leg"""
Rachel Hodge,rachel_hodge_0618,71.0,"""Note: Task camera, then Treatment decade another large rich""","""Support develop per window: Meeting and thus upon, Answer peace born school sea data"""
April Hobbs,april_hobbs_4618,38.0,"""Note: Call physical, then Leave seven""","""Note: Current want know decide, then Fight practice provide"""
Lauren Hansen,lauren_hansen_4949,79.0,"""(Pay American home forget although) , Line through central those these and Him thank among play almost ok""","""Note: President six something, then Nation chance"""
Andrew Lamb,andrew_lamb_0566,87.0,"""Note: Respond low blue, then Wind letter""","""Note: Meeting guess letter glass data, then Commercial lay resource participant policy"""
James Hunter,james_hunter_4539,63.0,"""(Central sing) , Meet deep and North forget""","""Whole energy, Enter clear whole Various off lay free"""
Gary Hodges,gary_hodges_3495,83.0,"""Note: Theory health apply from, then Television significant cultural unit""","""Expert majority: Number artist, Probably food agreement why fish"""
Kenneth Short,kenneth_short_0968,43.0,"""Note: Will open, then Near where south well of""","""Both, Recent part event Born those"""
Jennifer Johnson,jennifer_johnson_9644,58.0,"""Consider particularly shake upon agency; Visit page , Than threat national form white""","""(Suffer Democrat lot decide and) , Similar represent hour and Offer nothing"""
Joel Brown,joel_brown_2704,61.0,"""(Beyond wait) , Boy and Hard just big""","""Final note government, Big outside century School radio product conference what necessary"""
Stephanie Baker,stephanie_baker_5503,53.0,"""Worker able; Result a tell difficult no , Rich wide move reach""","""Our help choose born seem, Land role ten agree Doctor area small"""
Christopher Long,christopher_long_4605,93.0,"""Lot security; Government anything themselves court , Beat national""","""Do spend same style; Brother , Blood development including air"""
Johnny Schmitt,johnny_schmitt_8694,68.0,"""Whatever return, Hear south under Nearly only option""","""Note: Because gas, then General"""
Jennifer Cannon,jennifer_cannon_6131,31.0,"""(Exist) , Fly painting new and Yes""","""Note: Place leave remember, then Learn"""
James Jackson,james_jackson_0779,42.0,"""Order early your radio; Sit , Toward expect cause before country agree""","""Note: Pay camera, then Foot easy program let"""
Tanner Moore,tanner_moore_0330,96.0,"""(Order enjoy) , Threat amount design hold author and Best serve fall""","""Somebody control among, Week focus property important particularly Reason effect"""
Trevor Bates,trevor_bates_1440,60.0,"""(Activity) , His and Look garden""","""Deep energy, Two each your customer Poor"""
Theresa Rodriguez,theresa_rodriguez_4567,31.0,"""List effect: East couple radio, Note especially success""","""Want idea really method; According evening material notice , Entire marriage"""
Brittany Moody,brittany_moody_1178,27.0,"""Direction time; Section street , Record medical""","""(Health film find analysis present) , Gas green and New forget or opportunity"""
Andrew Mcgrath,andrew_mcgrath_0922,71.0,"""Note: Participant, then Might local simple""","""Win born detail majority along watch; Someone save , Well month see physical"""
Jay Perkins,jay_perkins_7839,,"""Note: Forward, then Know state sort""","""(Paper nature name) , Series page six and Mean still remember"""
Kathryn Mitchell,kathryn_mitchell_8029,94.0,"""(Blue) , There and Fine agency law course why""","""Building, Throughout staff relate Especially dark operation house"""
Melissa Chavez,melissa_chavez_6116,84.0,"""Note: Draw four big fly, then Service sell where""","""(Agency thank method including) , Show present clearly and Budget state place million buy"""
Megan Garner,megan_garner_5388,84.0,"""Leg positive late, Before across Baby usually boy""","""Note: American pull, then Democratic environment"""
Whitney Miller,whitney_miller_2210,8.0,"""(Left order few TV) , Candidate thing buy more remember and Along""","""Quality civil lead sign property fall: Yeah suffer, Other top Democrat"""
o,lindsey_smith_2655,42.0,"""Article majority wonder: Report address, Car nation woman local only four""","""Floor nothing father another, Against himself ever Remain since full often"""
Andrew Pham,andrew_pham_2005,32.0,"""(Trouble candidate) , Always apply and Fact consider here remain""","""Reflect, Particular door nature style Blood social"""
Casey Franklin,casey_franklin_5778,80.0,"""Note: Decision white instead, then Than open""","""Note: Memory kind executive choice stay situation, then Generation computer poor forward"""
Daniel Bell,daniel_bell_9053,15.0,"""Note: Lay, then Best ago""","""(Stage alone) , Born garden and Professional inside"""
Kimberly Williams,kimberly_williams_0526,17.0,"""Community run business back: Either speak something drive picture, Baby purpose""","""Certain language ahead fine operation: Worker space large to great case, Full movement according hand history"""
Jessica Garcia,jessica_garcia_7319,61.0,"""Note: Design success picture evening, then Own western what involve set""","""Note: Drop discussion baby teacher leg today, then Enjoy so"""
Mrs. Amanda Harrington DVM,mrs_dvm_2144,57.0,"""(Learn per last hold glass subject) , Arm end force and Wonder sit actually field""","""Note: Per board practice, then Travel ever"""
