username,name,age,price,comment,message
howard_morgan_5698,Howard Khan-Morgan,47.0,86.1,"""(Dolorem nihil) , Eos and Porro""","""Vitae; Perspiciatis reprehenderit corporis quis , Ex consequuntur voluptas laudantium hic"""
shane_green_6957,Shane Green,41.0,28.1,"""Hic quidem accusamus nam; Animi fugit culpa , Temporibus reprehenderit distinctio eum architecto commodi""","""Odio; Voluptatibus inventore rerum neque doloremque , Quo dolorum possimus"""
adam_shaw_3131,Adam Shaw,56.0,,"""Veritatis magni delectus earum adipisci vel, Et hic Alias adipisci nulla rerum facere""","""(Dolor cupiditate asperiores distinctio magnam itaque) , Minus laudantium and Possimus asperiores"""
gary_morrison_9654,Gary Morrison,43.0,99.1,"""Veritatis vitae nulla, Quia nesciunt Unde quod itaque""","""Note: Reprehenderit molestiae magni, then Modi numquam"""
deborah_holland_0905,D,18.0,8.1,"""Note: Voluptatem consequatur deserunt, then Rerum atque minima a""","""Exercitationem; Asperiores assumenda aliquid , Fugiat voluptate"""
mrs_matthews_6695,Mrs Emma Matthews,40.0,91.1,"""(Doloribus hic debitis dolor praesentium harum) , Voluptas eaque consequuntur maxime and Consectetur labore itaque""","""(Neque) , Sequi modi soluta and Dicta reprehenderit dignissimos mollitia"""
dr_stephens_9950,Dr John Stephens,87.0,86.1,"""Note: Quibusdam, then Ea quo""","""Facere non: Enim odit, Perferendis ipsam"""
mrs_neill_0306,Mrs Kimberley O'Neill,98.0,88.1,"""(Maxime minima ab eveniet quasi sunt) , Quibusdam voluptatem and Aut velit""","""Note: Molestiae tenetur aut enim sapiente, then Error nam"""
geoffrey_sharpe_0561,Geoffrey Campbell-Sharpe,100.0,30.1,"""Temporibus; Asperiores neque maxime , Eius incidunt quaerat""","""Note: Dolore nobis possimus totam, then Nemo eveniet"""
mandy_cox_7605,Mandy Cox,98.0,11.1,"""Delectus rerum: Ratione ipsa, Dolor voluptas eligendi quos""","""Itaque illo, Illo fugiat quam occaecati provident veniam Facere porro ex minus quaerat"""
derek_holmes_6263,Derek Holmes,20.0,23.1,"""Totam; Quod cumque excepturi , Natus incidunt eius""","""Et hic minus cumque culpa, Eaque corrupti sequi tempore rerum Omnis doloribus"""
dr_khan_8510,Dr Toby Khan,21.0,60.1,"""(Saepe) , Ducimus temporibus incidunt and Accusamus""","""At ipsum corporis: Sit sunt quisquam praesentium laborum dicta, Distinctio rem quam neque reprehenderit"""
miss_palmer_1662,Miss Kirsty Palmer,,44.1,"""Note: Veritatis ea reiciendis dolore, then Repudiandae impedit voluptas""","""Iure odio, Vitae corporis Excepturi ut"""
kevin_gill_3228,Kevin Gill,46.0,82.1,"""Dicta repellendus voluptatibus: Voluptatem minus, Beatae maxime quam""","""Note: Ratione doloremque voluptate laudantium, then Quod dignissimos"""
dr_ryan_2239,Dr Jenna Ryan,25.0,18.1,"""Deleniti autem unde: Quis enim aut, A""","""Similique dignissimos deleniti; Totam omnis , Sed quaerat dolorum aliquid"""
mr_lane_4112,Mr Simon Lane,75.0,60.1,"""Veritatis totam magni saepe; Iusto tempora nesciunt quibusdam , Dolor commodi illo quaerat voluptates architecto""","""Architecto voluptate et; Laudantium praesentium vel perspiciatis , Quisquam autem"""
dr_davies_7099,Dr Darren Davies,80.0,99.1,"""Accusantium; Libero ea , Corporis laborum a""","""Eos dolore quia perspiciatis voluptatum; Voluptas hic reprehenderit , Dignissimos odit iste"""
miss_butler_8263,Miss Holly Butler,88.0,60.1,"""(Vitae nam non delectus soluta) , Sint alias quasi veniam placeat and Maxime cumque maiores molestias ipsum""","""Note: Laudantium in doloremque, then Explicabo pariatur aspernatur dolores"""
dr_morris_7569,Dr Maria Morris,92.0,39.1,"""Illum dolorem explicabo, Amet omnis omnis numquam temporibus Magni sint""","""Quas, Blanditiis facere reiciendis Recusandae officiis delectus quisquam molestiae dicta"""
jean_ali_2841,Jean Ali,69.0,94.1,"""Id repudiandae molestiae quaerat libero: Repellat doloribus itaque, Inventore fuga atque""","""(Temporibus consequatur eaque) , Ipsum architecto and Quos"""
mrs_may_9068,Mrs Deborah May,73.0,56.1,"""Ut necessitatibus, Quam eveniet quos inventore Reprehenderit accusantium iure""","""(Autem cum commodi officia) , Praesentium consequuntur et and Ut eos quam"""
ms_simpson_4469,Ms Olivia Simpson,1.0,99.1,"""Note: Eum cumque voluptatibus dolorum, then Officia consectetur porro""","""Eos beatae et sed; Est magni , Necessitatibus beatae"""
miss_singh_4094,Miss Emma Singh,94.0,25.1,"""Note: Atque libero suscipit exercitationem, then Necessitatibus blanditiis ipsa vitae""","""Note: Excepturi maxime suscipit neque, then Sint occaecati"""
glenn_phillips_1160,Glenn Phillips,62.0,10.1,"""Note: Ipsum error ad voluptatem, then Sunt""","""Pariatur alias earum atque tenetur tempore: Inventore est dolor, Quas harum quibusdam possimus"""
elliott_smith_5727,Elliott Smith,66.0,73.1,"""Note: Unde nemo, then Cumque minima voluptate""","""Est tenetur voluptates, Maxime eum officia debitis Commodi temporibus"""
miss_walker_4060,Miss Joan Walker,55.0,85.1,"""Hic nesciunt, Voluptates repellat minima nesciunt Ut vero""","""Debitis perferendis pariatur: Sit harum, Eveniet"""
