username,name,rating,total_count,score,description
justin_hart_4597,Justin Cooper-Hart,81.0,68.1,22.2,'''Quasi quasi explicabo distinctio: Nisi consectetur, Magnam itaque quas'''
declan_rhodes_4395,x,50.0,45.1,65.2,'''Voluptatum unde excepturi: Labore porro magni, Quaerat error'''
olivia_thomas_1612,Olivia Thomas,30.0,72.1,49.2,'''Commodi debitis: Ea vitae commodi, Tempora architecto magnam'''
patrick_nicholls_9974,Patrick Nicholls,9.0,83.1,11.2,'''Repellat deleniti, Eaque quibusdam aspernatur provident Vero'''
stephanie_moore_2881,Stephanie Reid-Moore,53.0,47.1,95.2,'''Mollitia, Quam voluptatum nam Tempore quos natus blanditiis'''
charlene_davis_6727,Charlene Davis,58.0,28.1,28.2,'''Dicta perspiciatis; Excepturi sit nesciunt qui ducimus , Maxime incidunt ipsa'''
dr_james_0721,Dr Conor James,32.0,14.1,83.2,'''(Sed modi veniam consequatur) , In aspernatur and Debitis accusantium reprehenderit'''
heather_lowe_7863,Heather Lowe,42.0,92.1,88.2,'''Dolor consequatur, Consequuntur atque nostrum fugit Voluptatibus aspernatur voluptas'''
dr_turner_2878,Dr Bryan Turner,33.0,88.1,94.2,'''Note: Magnam optio, then Qui quas neque'''
matthew_moore_3355,Matthew Moore,25.0,53.1,12.2,'''(Dolor occaecati harum) , Odio and Possimus mollitia totam'''
malcolm_roberts_9567,Malcolm Roberts,72.0,6.1,89.2,'''Cumque explicabo: Quasi, Quod dolorum voluptatem necessitatibus'''
mrs_williams_3386,Mrs Elaine Williams,79.0,,47.2,'''Ab aliquam; Corrupti totam laudantium vitae aliquid deleniti , Sed aperiam'''
mr_chambers_4775,Mr Callum Chambers,29.0,38.1,97.2,'''Id commodi tempora; Quis ullam , Fugiat numquam ut'''
miss_smith_0844,Miss Rebecca Smith,95.0,37.1,18.2,'''Hic architecto: Vel, Similique saepe totam'''
naomi_brien_8741,'Naomi O''Brien',38.0,33.1,,'''Quisquam numquam quisquam accusantium: Quia natus, Doloremque praesentium quasi rerum qui'''
robert_fox_7881,Robert Newton-Fox,27.0,26.1,35.2,'''Explicabo; Ab inventore repudiandae reprehenderit quisquam , Deserunt eum delectus'''
kayleigh_begum_2421,Kayleigh Begum,93.0,9.1,49.2,'''Note: Voluptatem quasi aut, then Explicabo officiis'''
daniel_harper_5007,Daniel Harper,20.0,48.1,61.2,'''Animi quia molestias, Consequatur Voluptatem modi laboriosam adipisci at non'''
jayne_james_7377,Jayne James,52.0,99.1,32.2,'''Libero quos animi; Quae dolorum ea fugiat quaerat , A quae'''
maurice_walker_3317,Maurice Walker,11.0,59.1,72.2,'''(Exercitationem vitae) , Similique officiis minus and Tempore'''
ricky_lynch_6362,Ricky Lynch,48.0,26.1,72.2,'''Ab dicta in sit; At fugiat incidunt itaque , Ratione possimus'''
ms_bennett_3843,Ms Georgina Bennett,8.0,34.1,17.2,'''Quidem vitae deserunt quos, Voluptatem velit neque Impedit repudiandae'''
dr_taylor_6439,Dr Valerie Taylor,62.0,58.1,83.2,'''Quisquam magnam nihil nobis repudiandae dolorem, Est suscipit Ducimus cupiditate dignissimos'''
darren_walton_7176,Darren Walton,61.0,11.1,12.2,'''Nisi atque ullam eveniet: Vitae expedita expedita, Repudiandae natus beatae'''
louis_knight_2807,Louis Knight,,68.1,28.2,'''Assumenda eveniet: Corrupti perspiciatis vitae, Dolor earum sapiente'''
miss_carpenter_2938,Miss Wendy Carpenter,24.0,7.1,100.2,'''Necessitatibus molestias, Tempora eum quod Quo neque ab fuga distinctio'''
julie_schofield_4927,Julie Schofield,31.0,80.1,46.2,'''Voluptas: Necessitatibus, Dignissimos'''
kirsty_rowley_4988,Kirsty Rowley,66.0,70.1,47.2,'''Perspiciatis: Cumque rerum ex consequatur id, Ducimus iste'''
miss_charlton_2214,Miss Amanda Charlton,9.0,45.1,75.2,'''Corrupti mollitia veniam nisi inventore; Ut quis consectetur , Cupiditate mollitia'''
ms_jennings_2649,Ms Clare Jennings,100.0,62.1,51.2,'''Note: Tenetur voluptatem, then Temporibus modi iste quidem'''
brett_morris_5457,Brett Morris,30.0,10.1,75.2,'''Repellat cum ea excepturi quia ad: Magnam tenetur iure dolorem, Similique tempora'''
abbie_sutton_2957,Abbie Sutton,7.0,35.1,37.2,'''(Dignissimos libero quo) , Doloremque eum est and Nam hic excepturi expedita cupiditate illo'''
ronald_walker_9525,Ronald Walker,22.0,97.1,32.2,'''Ipsam tempore: Beatae aut in sed consequuntur, Magni debitis architecto'''
pamela_burns_4344,Pamela Burns,45.0,44.1,89.2,'''(Quidem amet) , Porro laudantium and Maxime ratione'''
