name	username	price	review
Dr Emily Rees	dr_rees_7777	72.0	'''Officia ipsum placeat; Adipisci quo et provident modi 	 Saepe eum quae nesciunt quae'''
Owen Perry	owen_perry_1207	76.0	'''Atque voluptas voluptates reprehenderit temporibus; Nobis nisi 	 Nostrum unde'''
Suzanne Thompson	suzanne_thompson_8999	36.0	'''Eos vero cupiditate ea minima; Nulla cumque provident labore tenetur 	 Officiis reprehenderit non alias'''
Stuart Hunt	stuart_hunt_3940	12.0	'''Occaecati quam dolor aliquam	 Maiores voluptatum tempore Aliquid fugit tenetur'''
Mr Jeffrey Wyatt	mr_wyatt_0220		'''Dicta dolorem aperiam nostrum: Harum debitis beatae modi	 Quasi quod vitae nisi minima maiores'''
Clifford Mitchell-Cooper	clifford_cooper_0717	69.0	'''Inventore neque magnam aperiam; Ducimus earum eum adipisci illum 	 Animi'''
Chelsea Cole	chelsea_cole_5223	30.0	'''Note: Suscipit at ipsa amet	 then Unde'''
Marie Bull-Crawford	marie_crawford_5051	68.0	'''Note: Assumenda illum	 then Dicta quas perspiciatis tempora'''
Kim Patel	kim_patel_7207	20.0	'''Note: Eius occaecati labore unde	 then Laboriosam sunt tempore repudiandae'''
Catherine Cross	catherine_cross_8162	78.0	'''Quisquam debitis provident facere voluptate	 Harum tempora Occaecati odit'''
Henry King	henry_king_5641	29.0	'''Ipsum sed voluptatibus sunt facilis iusto: Ipsam praesentium accusantium earum aperiam	 Dolorem'''
Miss Dorothy Law	miss_law_2431	57.0	'''Sint saepe deleniti	 Optio esse Aspernatur neque'''
Marcus Gallagher	marcus_gallagher_3286	90.0	'''(Sed suscipit aliquid) 	 Eveniet quo aliquam and Placeat rem debitis similique'''
Rebecca Archer	rebecca_archer_8700	1.0	'''Note: Nisi magnam	 then Deserunt sit architecto'''
o	ann_ali_1729	21.0	'''(Adipisci recusandae quas adipisci inventore praesentium) 	 Odit officia and Eveniet amet'''
Mandy Phillips	mandy_phillips_0328	28.0	'''(Placeat) 	 Adipisci and Saepe beatae temporibus illo pariatur'''
Abigail Barrett-Lowe	abigail_lowe_9386	40.0	'''(Accusantium laborum inventore sint) 	 Explicabo explicabo ullam iure expedita and Possimus repellat fugit consequuntur'''
Mr Elliott Howell	mr_howell_9936	18.0	'''Saepe expedita tempora; Voluptatem saepe 	 Recusandae rerum tempore est'''
Mr Lawrence Thomas	mr_thomas_3411	65.0	'''Veritatis beatae non quae autem vitae; Ullam alias laboriosam quos 	 Aliquam voluptatibus'''
Ms Grace Bond	ms_bond_1799	69.0	'''Repellat voluptatem; Quis recusandae porro vel 	 Quisquam eaque'''
Mathew Day	mathew_day_0643	3.0	'''(Eaque adipisci voluptatum eos) 	 Laboriosam repellat and Iste sit id'''
Keith Read	keith_read_6713	26.0	'''(Ut eum) 	 Voluptatum perferendis and Tenetur voluptate excepturi iure'''
Julia Lee	julia_lee_3732	100.0	'''Temporibus temporibus: Explicabo mollitia	 Porro et reiciendis'''
Tony Ali	tony_ali_2099	20.0	'''(Mollitia adipisci aspernatur) 	 Consequuntur quibusdam saepe praesentium and Quaerat soluta'''
Derek Bennett	derek_bennett_2489	19.0	'''Non quibusdam; Esse consequatur recusandae 	 Eligendi repudiandae dolores'''
Catherine Campbell	catherine_campbell_6109	5.0	'''Aliquam: Tenetur ipsum	 Excepturi ex'''
Joanne Evans	joanne_evans_7047	52.0	'''Sapiente quo doloremque minima rerum; Esse 	 Cumque excepturi'''
Dawn Owen-Hughes	dawn_hughes_2116	15.0	'''Note: Rerum consequatur repellendus	 then Velit'''
Amelia Bell	amelia_bell_1320	71.0	'''(Maxime incidunt) 	 Commodi debitis and Blanditiis ex'''
