name	score	total_count	remark	review
Jessica Watkins	99.0	99.1	"""Error cumque quaerat exercitationem: Ipsa	 Ea earum ab"""	"""Omnis at dolorem	 Temporibus possimus Molestias voluptatem"""
Bethan Ford	12.0	51.1	"""At expedita expedita	 Debitis Quisquam dicta illum natus esse"""	"""Quos laudantium	 Omnis vitae Doloremque ratione vel quo hic repellat"""
Dr Garry Harris	26.0	11.1	"""Dicta esse nemo unde officia reprehenderit; Officiis 	 Alias at in ipsam"""	"""Accusamus nobis	 Laudantium assumenda nemo Eligendi"""
Billy Thompson	20.0	1.1	"""Ad: Error ratione	 Pariatur in"""	"""Dolor ex at porro; Quas quaerat recusandae voluptate 	 Hic optio voluptates nihil"""
Lauren Armstrong	58.0	59.1	"""Note: Error quia placeat consectetur beatae	 then Temporibus velit"""	"""Ex perferendis numquam aut aut; Beatae tenetur praesentium cupiditate iusto 	 Vel quibusdam maiores modi eaque"""
Joel Ahmed	17.0	100.1	"""Nam: Nulla	 Voluptas laborum earum"""	"""(Molestiae quibusdam consequatur) 	 Mollitia facere commodi tempora and Natus dolorem"""
Jessica Sutton	38.0	94.1	"""Aspernatur quam ad veritatis; Fuga a mollitia ipsa 	 Voluptatum aspernatur"""	"""Odit eum accusantium; Quis architecto 	 Accusantium ipsam voluptatibus"""
Joanna Hudson	38.0	74.1	"""Note: Nulla officia sit	 then Ipsum tempora ad sint"""	"""Note: Dolores praesentium at	 then Numquam fugit possimus"""
Ruth Collier-Fraser	44.0	77.1	"""Autem	 Quam quisquam alias Quod ipsam fugit"""	"""Note: Ipsam assumenda	 then Quaerat excepturi"""
Dr Louise Ali	11.0	27.1	"""Iure	 Corporis expedita Incidunt pariatur libero minus"""	"""Labore natus; Deserunt porro sunt quam rem 	 Inventore iusto saepe"""
Caroline Elliott	97.0	13.1	"""(Molestiae eos) 	 Ex perferendis nisi rem earum and Earum quasi labore cupiditate"""	"""Note: Magni quia	 then Porro voluptatibus"""
Josh Dixon	32.0	51.1	"""Minima cum; Aspernatur vitae 	 Exercitationem velit"""	"""Minus ad molestias ducimus; Animi sint temporibus esse 	 Beatae odit"""
Mrs Holly Jackson	57.0	97.1	"""Note: Maxime sequi	 then Perspiciatis iusto"""	"""(Incidunt) 	 Expedita mollitia repudiandae molestias and Id recusandae laboriosam cupiditate"""
Dr Nigel Lloyd	9.0		"""Accusantium provident aut ratione corrupti; Aspernatur earum explicabo 	 Provident esse amet possimus nam"""	"""(Nobis id repudiandae accusamus quae) 	 Sit minus and Exercitationem maxime earum maxime"""
Mr Jordan Howard	12.0	38.1	"""Doloremque numquam iusto	 Ratione eaque sunt iusto Facere repudiandae consectetur distinctio consectetur"""	"""Qui	 Laboriosam soluta sapiente Quibusdam itaque"""
Ms Molly Knowles	51.0	11.1	"""Note: Cupiditate odit	 then Praesentium temporibus"""	"""Fuga exercitationem facilis quisquam cum nulla: Quidem atque	 Fuga magni molestias"""
Jacob Harper	94.0	41.1	"""Vel sapiente nam: Atque facere	 Corrupti dignissimos quisquam ex"""	"""Magni tempore laudantium commodi optio	 Necessitatibus quis maxime Iure fugit"""
Frank Mitchell	65.0	45.1	"""Dicta quas sint ut	 At ad voluptates Voluptate maxime"""	"""Laboriosam reprehenderit ex fugiat; Error dolorum 	 Omnis quasi perferendis vero quis"""
Charlotte Allen	17.0	2.1	"""Dicta corrupti placeat	 Pariatur beatae nesciunt Provident necessitatibus repellat nostrum"""	"""Dignissimos repellendus harum	 Sint sed Quaerat"""
Craig Harrison	61.0	59.1	"""Odio excepturi totam hic magni	 Modi Quas dolorum quasi deserunt possimus"""	"""Note: Voluptas	 then Quam odit possimus"""
Olivia Robinson-Macdonald	29.0	35.1	"""Eligendi ratione veritatis	 In porro omnis vero Repudiandae labore"""	"""Maiores; Quibusdam reprehenderit 	 Officia nulla tempore"""
Mr Aaron Robinson	76.0	34.1	"""Note: Labore	 then Soluta eius"""	"""Note: Ut iusto	 then Eligendi fugit temporibus animi corrupti asperiores"""
Dr Melissa Yates	44.0	62.1	"""Quis esse deleniti laudantium; Fuga sed 	 Saepe"""	"""Note: Repellat impedit omnis dignissimos iste	 then Dolor ab"""
Dr Jane Taylor	59.0	20.1	"""(Molestias eveniet ducimus) 	 Ullam nesciunt eos sit esse provident voluptatibus and Nobis ut quod nam"""	"""In eaque; Magni itaque 	 Ullam aliquid autem"""
Mrs Naomi Anderson		42.1	"""Modi ad expedita: Illum nemo iusto	 Laboriosam explicabo"""	"""Voluptatem: Nulla officiis delectus voluptatibus nam	 Maiores consequuntur dolore"""
x	93.0	91.1	"""Soluta; Consectetur in laboriosam 	 Dolorem voluptas repellat"""	"""(Sapiente) 	 Magnam excepturi and Necessitatibus"""
Mr Roy Davis	100.0	81.1	"""(Deserunt deserunt necessitatibus nemo) 	 Consequatur enim occaecati and Voluptatem animi asperiores quisquam unde inventore"""	"""(Rem aspernatur enim) 	 Neque amet nobis and Eos voluptate ad"""
Dr Justin Hartley	64.0	40.1	"""Voluptate possimus provident; Autem 	 Voluptatibus similique saepe"""	"""Optio odit: Esse	 Veritatis ipsum cupiditate ipsum quae"""
Mitchell Hardy	47.0	16.1	"""(Doloremque inventore) 	 Quod culpa molestias and Est impedit magni impedit"""	"""Cupiditate totam ad harum consequuntur	 Est reprehenderit eum consequatur In doloribus"""
Marcus Khan	64.0	68.1	"""Ea error dolor quasi illum: Voluptate quaerat modi	 A dolorum"""	"""Minus	 Sapiente quam incidunt Ipsa beatae a"""
Scott Holland	60.0	14.1	"""(Pariatur dolorem) 	 Sit ab dolores officia asperiores and Dolores impedit excepturi sit animi"""	"""(Accusantium fugit) 	 Molestias architecto sit and Temporibus hic"""
Francesca Summers	37.0	74.1	"""Voluptates amet: Eum quasi eius	 Nihil"""	"""Est; Modi non consequatur 	 Exercitationem at quidem"""
Miss Rachael Mason	28.0	71.1	"""Sint	 Nesciunt quasi unde quibusdam eum officia Perferendis esse laboriosam cum"""	"""(Dicta placeat rerum) 	 Ducimus nam tenetur officia similique and Optio architecto consequuntur consectetur"""
Amelia Brooks	42.0	63.1	"""Illo amet in quos	 Eius vero repudiandae quae suscipit exercitationem Maxime dicta maxime"""	"""Id natus	 Nobis accusantium Consectetur quam labore dolorem"""
Kathryn Jennings-Elliott	22.0	33.1	"""Corrupti voluptatum natus; Rerum quae 	 Assumenda repellendus"""	"""(Tenetur ab voluptatem eum) 	 Ad eligendi itaque ut similique and Sed"""
Samantha Pugh	63.0	99.1	"""Libero sit sint labore; Reprehenderit maxime voluptates 	 Labore adipisci"""	"""Note: Repudiandae exercitationem aliquid dolorem neque	 then Voluptas velit"""
Ms Heather Bull	95.0	80.1	"""Note: Eos voluptate	 then Modi veritatis autem"""	"""(In deleniti) 	 Non consequuntur and Dolor aliquam"""
