name	username	salary	total_count	comment	message
Dr Liam Thompson	dr_thompson_1440	13.0	65.1	"""Tempore quo ducimus	 Nostrum Explicabo qui modi"""	"""Note: Totam veniam	 then Sint aut"""
Ms Margaret White	ms_white_9647	29.0	44.1	"""Quisquam corporis	 Impedit aspernatur quibusdam suscipit Dolores tempore perferendis"""	"""Similique numquam; Facere incidunt rerum maiores minus 	 Reiciendis laborum fugiat"""
Pamela Morgan-Green	pamela_green_1948	43.0	31.1	"""(Corporis) 	 Saepe maiores eum and Praesentium"""	"""Explicabo numquam: Nemo	 Magnam nemo voluptate voluptatum ex quod"""
Henry Finch	henry_finch_1233	16.0	68.1	"""Occaecati aspernatur beatae quos; Porro vel voluptas adipisci magni 	 Illo necessitatibus totam minus dolore vero"""	"""(Officiis deleniti) 	 Ducimus and Odit unde excepturi"""
Anna Mitchell	anna_mitchell_3525	65.0		"""Sint maxime vitae ipsum deserunt; Porro veritatis 	 Fugit illum repudiandae ratione"""	"""Eius vitae saepe voluptatum: Debitis recusandae tempora aspernatur cum	 Explicabo vitae nulla expedita"""
Derek Stephens	derek_stephens_7574		6.1	"""Note: Libero	 then Impedit consequatur ab"""	"""Note: Asperiores	 then Vero ipsum ipsam"""
Mr Alexander Griffin	mr_griffin_4982	78.0	36.1	"""Note: Molestiae sed	 then Molestias consequatur facilis quas voluptate"""	"""Molestiae iste; Distinctio magni vitae 	 Inventore"""
Christopher Humphries	christopher_humphries_6322	7.0	75.1	"""Note: Fugit eaque iure aliquid provident	 then Praesentium qui"""	"""(Ipsum dolores) 	 Dolores reprehenderit quis laboriosam and Aliquid blanditiis doloribus"""
Douglas Davis	douglas_davis_3842	4.0	29.1	"""Quisquam eaque dolor: Vitae possimus dolor	 Nesciunt asperiores itaque"""	"""Tenetur quam cumque ab; Eveniet eaque omnis 	 Distinctio aspernatur"""
Lydia Watkins-Williams	lydia_williams_8253	86.0	96.1	"""Vel; Vitae ipsum rem 	 Deleniti ut corporis neque"""	"""Necessitatibus dolore: Recusandae iusto placeat officiis	 Incidunt perferendis recusandae libero pariatur fuga"""
Martyn Brooks	martyn_brooks_6012	53.0	63.1	"""Note: Distinctio qui earum	 then Nulla quidem illum perspiciatis corrupti"""	"""Accusantium eligendi; Fugiat quod adipisci eligendi rem cupiditate 	 Explicabo"""
Lauren Armstrong-Day	lauren_day_3882	42.0	33.1	"""Note: Excepturi consequatur ipsam sit	 then Veniam commodi"""	"""Quasi doloremque: Vitae aspernatur molestias	 Quam sit"""
Chloe Black	chloe_black_4053	77.0	7.1	"""(A iure ratione ullam) 	 Quas alias and Voluptatem ipsa"""	"""Explicabo	 Totam eos eligendi Exercitationem rem"""
Toby Porter	toby_porter_9814	47.0	88.1	"""Inventore doloremque delectus adipisci voluptatibus occaecati	 In ea Mollitia est consectetur"""	"""Quas doloribus excepturi modi	 Magnam corrupti distinctio Cupiditate perspiciatis repellat soluta a"""
Melissa Smith-Thompson	melissa_thompson_6990	79.0	22.1	"""Note: Sapiente eum nostrum iste expedita	 then Ut quidem minus est officia quo"""	"""(Eos consectetur nobis) 	 Cum and Distinctio corrupti"""
Chelsea Brown-Adams	chelsea_adams_5036	32.0	82.1	"""Quos rem deserunt	 Expedita in voluptate Officiis esse maxime cupiditate"""	"""(Eveniet ea ducimus sapiente recusandae) 	 Quasi tenetur voluptatem dolore omnis expedita and Eum ipsam nobis"""
Duncan Thomas	duncan_thomas_5186	70.0	68.1	"""Deserunt molestias; Alias fugit praesentium 	 Saepe explicabo exercitationem modi"""	"""Quia cumque; Voluptatibus quibusdam 	 Vel commodi"""
Wendy Brady	wendy_brady_0154	33.0	80.1	"""Reiciendis magnam eius; Quo eligendi quis 	 Eum ducimus"""	"""Consectetur perspiciatis cum	 Deleniti molestias in porro Ipsam animi"""
Ms Suzanne Norris	ms_norris_0838	95.0	43.1	"""Vitae error: Nesciunt culpa expedita nostrum	 Ex nostrum"""	"""Reprehenderit minus earum iure quaerat tenetur; Laudantium sapiente 	 Doloribus commodi incidunt fugiat"""
Mr Terence Grant	mr_grant_7137	99.0	73.1	"""Nemo ea rem autem voluptatem sint: Asperiores minima autem	 Expedita"""	"""(Fugiat) 	 Mollitia and Perspiciatis provident expedita consectetur alias"""
Nicola Robson	nicola_robson_7047	4.0	60.1	"""Reiciendis	 Harum Nam ratione quidem laudantium"""	"""Placeat expedita	 Omnis impedit ullam vel debitis In dolor sapiente"""
Louise Smith	louise_smith_8786	96.0	74.1	"""Note: Suscipit	 then Sunt numquam minima"""	"""Note: Repellat laborum recusandae	 then Consectetur quis sit asperiores magnam"""
Abbie Martin	abbie_martin_1244	61.0	17.1	"""Nesciunt: In provident quibusdam doloribus	 Voluptas rem"""	"""Molestias eos	 Ducimus exercitationem eaque Tempora corporis minima"""
Mohammed Brookes	mohammed_brookes_5083	50.0	94.1	"""Enim dolores quam mollitia	 Inventore amet architecto tempora Architecto tempora"""	"""(Soluta voluptatem unde) 	 Deleniti accusamus vero and Laudantium voluptatum tenetur veniam eos quibusdam"""
Louise Shaw-Turnbull	louise_turnbull_6148	52.0	91.1	"""Maxime optio quos delectus est exercitationem	 Rem deserunt provident odio Impedit harum"""	"""Iure suscipit ad; In nihil 	 Et id nemo repellat"""
Gavin Turner	gavin_turner_3806	13.0	49.1	"""At; Non atque illum assumenda recusandae quaerat 	 Itaque distinctio quidem"""	"""Qui: Ea tenetur saepe	 Autem libero dicta excepturi"""
Ellie Wood	ellie_wood_1371	9.0	99.1	"""Id numquam facilis; Cumque illum illum 	 Quam sed sit optio"""	"""Consectetur aspernatur tempora ut quos; Deserunt labore recusandae veritatis nesciunt repudiandae 	 Eligendi"""
e	dr_gallagher_6365	43.0	93.1	"""Alias at nemo: Tenetur eligendi	 Neque ut"""	"""Neque delectus: Quam ex impedit	 Vero omnis"""
