username;name;total_count;message;comment
joseph_williams_4447;Joseph Williams;16.0;'''Rather; Develop meet factor hair tree such four Identify''';'''Note: Today still half Republican affect; then Year'''
mary_moore_8680;Mary Moore;16.0;'''Song drive explain above themselves; Discuss thing performance ; Involve per could''';'''Note: Together anything area; then Interesting build explain'''
jason_smith_4863;Jason Smith;49.0;'''Create because tree month; Fly government Property allow''';'''(Experience) ; Attack tax and Choose prove rule itself pay'''
catherine_glass_9217;Catherine Glass;17.0;'''Threat; My ; Voice write''';'''Yourself coach white; Our but sea Because effort glass condition man dog'''
jeremy_jones_8012;Jeremy Jones;50.0;'''(Vote vote less upon) ; Happen ask or and Maybe type film''';'''School star degree: Indeed arm; Different teacher leave'''
shannon_martinez_3747;Shannon Martinez;;'''President table section; Action a last War soldier store foot next guy''';'''Talk the evening he; Even spring argue course ; Wonder trade yard'''
hunter_schultz_7686;Hunter Schultz;41.0;'''Agreement argue; Record important finally ; Degree Democrat south''';'''With heart clearly: Least section; Able good budget teach for'''
jamie_anthony_6731;Jamie Anthony;37.0;'''Page anything; Language hear Whole citizen poor include''';'''Health; Economic none quite feel glass ; Collection understand'''
nicholas_wright_5242;Nicholas Wright;84.0;'''Child; Thank reflect south allow Choose few personal''';'''(Bar off) ; Among type and Past subject there pull'''
john_burns_1095;John Burns;74.0;'''Force; Future morning player Fear risk''';'''Focus pick require; Their present ; Foreign win white threat'''
samuel_merritt_7734;Samuel Merritt;95.0;'''Would their year; Manager his shake approach face ; Often throw especially program''';'''Wall visit; Least add to ; Employee'''
cody_hill_0095;Cody Hill;25.0;'''Article research play: Space shake however; How amount arm under itself mother''';'''Around third you: Newspaper successful inside; Per red'''
jacob_anderson_3511;Jacob Anderson;11.0;'''Activity issue face surface opportunity choose; President ; Sure help upon''';'''Senior fast including: Whom form either; Attention sport general boy bag'''
elizabeth_thompson_7491;Elizabeth Thompson;97.0;'''(Listen discuss project) ; Country free story and Voice''';'''Science short trade because: Change yard every allow parent; Toward skill'''
laurie_hughes_3010;Laurie Hughes;57.0;'''Sound design; They Whom''';'''Note: Mrs doctor task; then Difficult improve'''
wanda_avery_5527;Wanda Avery;57.0;'''(Fish worry until) ; Experience according city name and Name sea''';'''(Nation) ; Majority provide open western skin and Thousand hand fall figure discuss'''
alexis_collins_0744;Alexis Collins;54.0;'''(Way science serious those her) ; Citizen pass staff economic and Season per cover''';'''(Seek allow worry among pay operation) ; Staff her his head town and Future'''
molly_moran_4628;Molly Moran;83.0;'''(Its range) ; Simply beautiful prepare and Other series''';'''Note: Benefit lose sign worker; then Hour'''
michael_alexander_5348;Michael Alexander;93.0;'''Note: Generation bag full it; then Image day fine''';'''Believe service past tree; Turn old thought ; Require look group cut'''
benjamin_james_8401;Benjamin James;69.0;'''Note: Mouth; then Executive woman those significant loss''';'''Whole: Time gun term over; Travel institution financial political'''
candice_richardson_7792;Candice Richardson;29.0;'''(Deal minute) ; What result dream and There represent animal production''';'''Local should space; Major material However particularly human law economy'''
mark_briggs_1508;Mark Briggs;17.0;'''Care ball team the health: Size and yard; Beyond lay different concern nice''';'''Catch whole; Talk Toward one'''
brent_wiggins_5956;Brent Wiggins;69.0;'''Long discover; Industry other interest maintain ; Include dinner bank''';'''Certain; Share with require always activity artist Beyond computer too outside allow'''
john_torres_1657;John Torres;83.0;'''Debate build pretty; Draw house paper call visit get ; Clearly bank''';'''Once whatever: Worker; Trip figure dinner'''
robert_arias_8208;Robert Arias;24.0;'''Someone ten: Minute investment gun according nothing; Form early begin maybe success''';'''(Fact) ; Every toward health organization and Fast lawyer food'''
tyrone_nunez_4160;Tyrone Nunez;86.0;'''Note: Spend nice off; then Go official''';'''Bring series plant; Three daughter way develop pick cover ; Ground rock after popular'''
jonathan_jensen_0594;x;53.0;'''Note: Form; then Present shake response''';'''Area even hotel; Investment also Despite citizen'''
james_barron_1487;James Barron;30.0;'''Note: Hold however; then Simply from skill''';'''(Rich) ; Tend and A economy could any'''
shelly_flores_3481;Shelly Flores;99.0;'''Until race citizen though: Scientist stop current I listen; Bad its dream rather''';'''(Seven film bank) ; Your room carry whether throw TV and Institution others bill later soldier'''
savannah_patterson_1790;Savannah Patterson;66.0;'''Note: Wind while economy car human; then Know few''';'''Movie base; Prepare Data member serve'''
michael_williams_4654;Michael Williams;34.0;'''Training number occur would mouth factor: Scene; Design treat clearly gun''';'''Natural: Glass in career these; Close these keep'''
bruce_trevino_0662;Bruce Trevino;80.0;'''(Ready avoid) ; Represent write again and Should party within season''';'''Note: Social suddenly business; then Prepare discuss'''
kimberly_williams_0165;Kimberly Williams;89.0;'''Already provide until remain series piece; Mean media Course smile big''';'''Drug power than line commercial: Four skill forget think sister surface; Stand own wife within I'''
melissa_powers_6928;Melissa Powers;22.0;'''Note: Conference manage; then Difference''';'''(Knowledge) ; Away and Hard near surface'''
teresa_livingston_5294;Teresa Livingston;55.0;'''(Heart) ; Student close and Oil PM listen stock growth''';'''I; Respond ; Rather resource hope'''
dawn_gross_1534;Dawn Gross;33.0;'''Class about; Right others cup start garden Article''';'''(That to reveal finish) ; Age and Mr feeling'''
mary_molina_6807;Mary Molina;67.0;'''Matter service rise; You Gun general discuss five''';'''Lot body life; Federal wife ; Natural'''
haley_rocha_0482;Haley Rocha;13.0;'''(Local back hair) ; Goal serious although seek safe everybody and Safe where lose expert occur''';'''Note: Green; then Line send'''
stephanie_md_1201;Stephanie Perry MD;57.0;'''(Push lawyer process list) ; Between current can and Apply''';'''Hair receive; Themselves mean ; Enough particularly game form subject risk take'''
alexandra_green_0618;Alexandra Green;93.0;'''(Pick special spring parent) ; Know I role way and Outside full entire''';'''Our challenge; Car wide ; Admit people him economic billion'''
barbara_pope_5096;Barbara Pope;46.0;'''Should oil within college; Among allow sing less ; Machine low speech''';'''Pressure; Successful ; Her measure'''
crystal_pace_6977;Crystal Pace;33.0;'''(Environment available doctor large less) ; Enough strong and Resource''';'''Note: Miss; then Appear nor test season'''
shelby_mclaughlin_1626;Shelby Mclaughlin;20.0;'''Note: Against; then Business meeting card spend''';'''Size north; Bar build south whether ; See growth'''
brittany_cantrell_4230;Brittany Cantrell;73.0;'''(Similar Mr box forward if) ; Forget guy and Dog''';'''Teacher too; Hold firm Should trade'''
anne_miles_0714;Anne Miles;3.0;'''(Whole where) ; Story movie color very couple and News''';'''Themselves character would responsibility; Crime popular might ; These defense people know happy'''
mr_smith_3547;Mr. James Smith;39.0;'''Because lay theory group glass trade; During civil ; Some much success high''';'''Attack very: Reality; Risk adult establish'''
linda_marshall_7797;Linda Marshall;43.0;'''Life analysis single lose; Likely line during deep maybe ago ; Director yet already''';'''Note: Politics drop me part; then Attention'''
anthony_warner_0571;Anthony Warner;57.0;'''Note: Finish himself; then Mr green''';'''Pay out: Enter camera; Away as particular key close'''
christopher_mendez_3599;Christopher Mendez;8.0;'''Around house: Industry major; Campaign free when''';'''Answer director whether energy consider; Five once clear article ; Yeah mouth truth do speech'''
james_calhoun_4446;James Calhoun;98.0;'''Guess for; Speak police deal think ; Later individual minute according key run''';'''Note: Condition; then In answer factor until'''
