username,name,age,comment,summary
dylan_davies_7719,Dylan Murray-Davies,3.0,"""Alias ullam provident natus, Alias officia vero accusantium quis dolorem Recusandae explicabo""","""Eligendi magnam mollitia vel perspiciatis quae: Quasi consequatur tempora, Culpa pariatur ullam nobis iusto"""
ms_fitzgerald_6837,Ms Frances Fitzgerald,16.0,"""(Atque soluta distinctio eius itaque) , Nulla nam itaque porro and Nihil alias consequatur dolore""","""(Quaerat maxime tempora temporibus perferendis) , Reiciendis laudantium quibusdam saepe and Illum doloremque excepturi"""
danielle_walker_1186,Danielle Bradshaw-Walker,60.0,"""Error beatae omnis: Placeat doloremque aliquam eaque voluptates repellat, Quae quisquam ex""","""(Dolores aspernatur corporis) , Quia officiis and Atque"""
mr_brien_4465,o,15.0,"""Tempora dolor, Magni sequi id Accusantium eos necessitatibus veritatis""","""(Delectus blanditiis voluptatem mollitia harum) , Earum reiciendis occaecati corporis and Nesciunt dolores"""
frank_murphy_3943,Frank Murphy,69.0,"""Note: Alias ipsum, then Tenetur deleniti nulla alias magnam""","""Illo quaerat; Autem officia , Vero reprehenderit iure fuga"""
michael_parsons_0767,Michael Parsons,57.0,"""Ullam repellendus suscipit, Totam nemo facere Error cum doloribus""","""Temporibus dolorem beatae sed: Neque explicabo numquam aliquid excepturi, Nemo temporibus non incidunt ratione"""
ruth_haynes_8494,Ruth Wood-Haynes,84.0,"""(Debitis pariatur iste consequatur sint) , Nobis illum and Quod dolorem vitae deserunt""","""Quas cum architecto laborum repellendus officia: Assumenda dicta reprehenderit, Quod"""
judith_patel_3529,Judith Patel,86.0,"""Provident; Repellendus officia , Aut eligendi commodi perspiciatis""","""Note: Esse aperiam totam voluptas, then Vitae"""
natalie_elliott_5785,Natalie Cross-Elliott,9.0,"""Consequatur necessitatibus; Deleniti provident accusamus architecto quidem , Sunt ex ipsam iure mollitia""","""Deleniti doloremque et quam, Expedita minus Placeat"""
leah_marshall_0673,Leah Marshall,22.0,"""Totam explicabo quibusdam sed doloribus: Repudiandae, Consequuntur illo dignissimos porro blanditiis""","""Optio: Doloribus maiores harum, Magnam asperiores pariatur"""
mathew_humphries_6809,Mathew Humphries,10.0,"""(Laborum delectus exercitationem autem eveniet) , Aliquid officia and Neque quod""","""Note: Ipsum, then Officia culpa repellendus pariatur adipisci"""
leslie_bowen_3889,Leslie Goodwin-Bowen,72.0,"""Omnis dolorem provident aperiam: Ab dolorum, Voluptate modi quidem""","""Quidem aliquid: Quisquam architecto, Architecto laborum provident tempora nobis"""
kathryn_hunt_9492,Kathryn Hunt,11.0,"""Enim aspernatur, Perspiciatis mollitia adipisci Fugiat consequatur adipisci maiores laboriosam""","""Note: Fugit velit libero eligendi illum modi, then Placeat"""
hazel_jones_5735,Hazel Bartlett-Jones,78.0,"""Alias aliquid placeat qui porro: Atque non, Harum architecto debitis""","""Praesentium minima: Praesentium veritatis, Rerum molestiae voluptatem amet quam"""
arthur_collier_5922,Arthur Collier,72.0,"""Recusandae odit dicta in: Necessitatibus tempore assumenda unde, Aperiam facere quaerat est iure""","""(Nobis ratione quo maiores) , Accusantium and Esse"""
rhys_walker_0312,Rhys Walker,100.0,"""Deleniti ipsum provident praesentium: Beatae fuga rem, Facere libero""","""Similique esse totam reiciendis; Molestiae nihil reprehenderit accusamus , Odio impedit"""
cameron_turner_5117,Cameron Pritchard-Turner,83.0,"""Laboriosam consequatur; Eveniet mollitia , Pariatur aut vel""","""Ducimus minus: Voluptate, Aliquid ea non"""
dr_whittaker_1121,Dr Angela Whittaker,31.0,"""Voluptates rem; Reprehenderit , Molestias dolorem ea""","""Corporis aliquam at, Quam asperiores voluptatem Mollitia excepturi"""
dr_pollard_6631,Dr Clifford Pollard,57.0,"""Nisi hic odit modi, Cumque ad quia Quis occaecati quam nisi""","""Note: Provident beatae officiis, then Illo qui"""
nicholas_kennedy_1308,Nicholas Kennedy,49.0,"""(Explicabo) , Recusandae commodi facere distinctio and Neque voluptatibus veritatis id""","""(Esse quam pariatur voluptates provident) , Architecto amet earum impedit reprehenderit commodi and Officia eligendi eligendi ipsam"""
patrick_whitehead_8779,Patrick Simpson-Whitehead,64.0,"""Note: Commodi perspiciatis, then Porro""","""Eum accusamus iste occaecati: Deleniti occaecati culpa nobis quos, Esse amet molestiae voluptatum odit"""
elaine_stephenson_3143,Elaine Stephenson,48.0,"""(Impedit error doloribus numquam adipisci) , Ad numquam and Dolore ipsam vero""","""Unde illum ipsum provident: Aliquam aliquid, Exercitationem quibusdam molestias"""
jodie_donnell_1361,Jodie O'Donnell,78.0,"""Ab aperiam sequi odit; Mollitia , Dolorum perspiciatis""","""Note: Illum blanditiis alias, then Vitae eaque"""
paige_reynolds_8644,Paige Reynolds,90.0,"""Ipsum praesentium voluptates occaecati; Eveniet ipsam , Nemo ipsum""","""Note: Blanditiis, then Architecto earum aut sint"""
dr_wallace_9485,Dr Tracey Wallace,80.0,"""Fugiat rerum, Rerum odio vero Consectetur et voluptatibus""","""Nostrum: Eius temporibus, Recusandae cum dolore"""
duncan_young_3809,Duncan Young,97.0,"""Note: Occaecati soluta tenetur suscipit inventore dolorem, then Quo rem debitis""","""Placeat ducimus alias; Vitae recusandae , Ad quasi"""
ms_simpson_3954,Ms Bethan Simpson,27.0,"""Tempore, Odio nulla Suscipit neque dolore""","""Magnam earum vero: Alias delectus adipisci praesentium, Doloribus"""
dr_johnson_2187,Dr Lindsey Johnson,70.0,"""Note: Est, then Amet voluptatibus eaque exercitationem""","""Nihil eos; Alias , Necessitatibus fugit rem"""
dr_chandler_3345,Dr Catherine Chandler,60.0,"""Provident beatae aspernatur, Dolore debitis in Nihil ullam facilis voluptas""","""(Quos consequatur inventore delectus vel) , Culpa pariatur fugiat and Doloremque quia"""
douglas_marsh_1973,Douglas Marsh,32.0,"""Enim rerum iure; Quia eum dolor atque , Commodi reiciendis odit itaque quibusdam laudantium""","""(Corrupti aspernatur illo nihil molestiae) , Deserunt repellendus officia and Ut aperiam ex velit"""
edward_pickering_0495,Edward Kelly-Pickering,48.0,"""Note: Sed delectus sapiente, then Possimus assumenda debitis""","""Note: Officiis deserunt cupiditate, then Odio molestias"""
dr_gill_0098,Dr Darren Gill,56.0,"""Note: Laudantium rerum, then Quis architecto sapiente ullam pariatur itaque""","""Note: Impedit, then Vel nobis eius asperiores"""
dr_kelly_7342,Dr Sophie Kelly,6.0,"""(Vitae accusantium earum tenetur unde) , Cupiditate possimus and Assumenda voluptatem voluptas incidunt""","""Deleniti; Accusamus eaque , Debitis aliquid quasi"""
gavin_smith_4084,Gavin Smith,13.0,"""Note: Recusandae optio minima, then Doloribus impedit asperiores voluptatibus at molestiae""","""(Fuga quibusdam fuga) , Accusamus ipsa hic and Minima accusantium tenetur"""
stanley_wilson_0405,Stanley Roberts-Wilson,35.0,"""Quisquam asperiores ullam; Animi suscipit quas eius , Neque rem vero nisi perferendis""","""Placeat provident occaecati impedit, Recusandae quibusdam id Ex possimus"""
lucy_moore_0140,Lucy Moore,44.0,"""Nesciunt; Vitae quis facilis deleniti sit sunt , Iure illum mollitia""","""Pariatur: Cum ipsa ea, Eaque labore delectus"""
diane_cook_0780,Diane Cook,75.0,"""(Nihil eos totam) , Doloremque incidunt and Quae voluptatibus""","""(Omnis veritatis eaque dignissimos animi) , Eius quisquam neque enim qui qui and Vitae quo"""
alexandra_white_6258,Alexandra White,56.0,"""Assumenda maxime eaque temporibus totam; Facilis , Minus vero quam itaque non explicabo""","""Soluta repudiandae; Quasi ipsam eos cum veritatis , Ea eaque ex cumque"""
nicole_bray_8975,Nicole Bray,3.0,"""Quod, Beatae Explicabo provident""","""Aliquam cupiditate culpa repudiandae; Modi perspiciatis recusandae voluptatem esse , Exercitationem"""
kenneth_leach_6606,Kenneth Noble-Leach,,"""Blanditiis nisi soluta: Perspiciatis animi reiciendis, Amet odio velit cupiditate ut""","""Possimus doloremque nihil numquam: Reiciendis recusandae id, Nemo architecto vel sequi"""
lewis_reed_8484,Lewis Reed,78.0,"""Repudiandae nemo nisi: Optio ipsam, Omnis sint molestiae""","""Note: Eos nihil minus numquam facilis debitis, then Alias totam earum excepturi"""
tracey_ashton_9955,Tracey Ashton,42.0,"""Earum culpa reprehenderit; Quas aliquid asperiores nostrum , Assumenda""","""Facere ex debitis tenetur, Iusto Impedit officia aliquam nesciunt eius"""
mr_sharp_9955,Mr Thomas Sharp,48.0,"""(Velit est) , Omnis error and Voluptas""","""Eligendi hic; Modi numquam numquam rem hic harum , Illum unde deserunt voluptatem a eos"""
miss_evans_7305,Miss Catherine Evans,35.0,"""Nostrum: Expedita rerum sunt accusamus, Consequatur fugit""","""Note: Culpa minus libero, then Id iste"""
eleanor_holt_1310,Eleanor Holt,52.0,"""(Fugit blanditiis recusandae) , Occaecati ipsam minima impedit and Accusamus in dolores soluta""","""Delectus: Quod id, Fuga assumenda inventore eveniet nobis esse"""
miss_dean_2804,Miss Gemma Dean,26.0,"""Note: Temporibus, then Consequuntur hic voluptates""","""Note: Culpa deserunt eveniet a, then Animi repudiandae itaque delectus"""
abigail_andrews_3185,Abigail Andrews,25.0,"""Molestias assumenda amet dignissimos nobis debitis: Natus adipisci, Nulla est suscipit alias""","""Unde, Illo laborum totam Commodi atque magnam"""
julia_little_6448,Julia Little,57.0,"""Temporibus, Est fugit quo Saepe quidem atque deleniti""","""Amet iure nobis fuga; Harum non , Soluta maiores minima"""
mitchell_parker_9162,Mitchell Parker,85.0,"""Note: Alias porro possimus at, then Fugiat dolorum""","""Libero fugit, Modi aperiam corrupti molestiae Culpa doloremque ratione"""
phillip_wilkinson_3794,Phillip Wilkinson,93.0,"""Note: Porro praesentium possimus rerum, then Expedita sed""","""Amet autem aut laudantium: Sit reprehenderit hic inventore at, Dolore placeat error quod"""
