name	username	age	total_count	price	note	summary
Stephanie Cameron	stephanie_cameron_9215	31.0	33.1	84.2	"""(Black address surface) 	 Herself easy per and Figure long throw"""	"""Sound	 Sport lead case Become writer religious former southern"""
Darryl Harrison	darryl_harrison_8894	67.0	62.1	97.2	"""Walk usually least; Student natural hit within whom 	 Send even character night"""	"""Population if camera	 Machine sometimes spring ahead read system Number nice agency"""
Clinton Lee	clinton_lee_3896	1.0	75.1	76.2	"""Two school: Worker hour	 Particular month success never world resource"""	"""Industry course	 Feel maybe Radio north entire left"""
Jose Patel	jose_patel_4400	2.0	24.1	98.2	"""Capital couple few wear	 Hundred Eye sport"""	"""Sit bit	 Former lose present should suddenly business medical Guess teach"""
Carrie Hill	carrie_hill_4401	80.0	39.1	98.2	"""(Hospital tough close) 	 Even grow head and Voice seek"""	"""Business kitchen	 Test send media thought Group majority home"""
James White	james_white_1980	7.0	16.1	94.2	"""Note: Type mind operation across	 then Glass force guess off should"""	"""Note: Discuss experience seem building	 then Challenge former strong similar nearly must"""
Kristen Kennedy	kristen_kennedy_1891	95.0	32.1	58.2	"""Beat sound pattern	 Every as including medical Believe energy"""	"""Car area	 Low its stuff Game century edge"""
Jason Campbell	jason_campbell_7692	15.0	59.1	47.2	"""Tonight after: Remain garden	 Mrs our long"""	"""Note: Challenge wrong	 then Support ready available design rock standard"""
Devon Bonilla	devon_bonilla_6801	44.0	86.1	41.2	"""Note: Difference specific family floor bag price	 then Report together"""	"""Pretty film; Himself box material western 	 Born month suggest task drug"""
Amanda Perez	amanda_perez_3031	58.0	54.1	31.2	"""Until arrive wish start; Forget my program perform degree live 	 Address"""	"""Together rest happy; Fight turn 	 Expert security he beyond"""
Kyle Hunter	kyle_hunter_0833	81.0	53.1	96.2	"""Sea risk hit future	 Indeed her Ball book possible"""	"""(Memory writer) 	 Behind everything majority and Traditional lose develop clear people"""
Allison Oconnor	allison_oconnor_1500	52.0	81.1	5.2	"""Note: Woman network next rule	 then Sometimes"""	"""Government	 Particularly This actually technology those"""
Kristi Turner	kristi_turner_7527	16.0	50.1	19.2	"""Behavior money attorney; Group this 	 Hair response"""	"""(Civil) 	 Recently any see year and Bit many vote work nature"""
Austin Curry	austin_curry_1119	62.0	97.1	9.2	"""Man a actually set happy: Hundred cause artist majority	 Girl series trade size song"""	"""Individual else need population: Tough position	 See computer"""
Mr. Michael Blake	mr_blake_0415	78.0	4.1	21.2	"""(Just medical break green) 	 Affect my source and Stay realize structure evidence produce"""	"""Travel international	 Build Analysis much people"""
Justin Kent	justin_kent_3596	63.0	57.1	46.2	"""Land: Try all newspaper	 However five"""	"""Note: Power staff place before leave	 then Rich skill between"""
Julie Young	julie_young_1582	78.0	82.1	90.2	"""(Skill him early) 	 Successful oil hair and Recognize close small cover hair"""	"""Hair walk rule; Few design 	 Responsibility believe man become environmental"""
Emily Caldwell	emily_caldwell_4883	43.0	99.1	10.2	"""Rich week beyond	 Left southern model foot court Space"""	"""(Care financial fight) 	 Most travel many themselves and Mind"""
Laura Padilla	laura_padilla_6547	53.0	52.1	66.2	"""Service car: Bring job	 Him old cell"""	"""Note: Agreement sister walk	 then Where care talk"""
Ashley Arellano	ashley_arellano_0504	89.0	49.1	55.2	"""Beyond air way several adult benefit	 Although concern now theory material give Manager respond"""	"""(Bank student here) 	 Night partner close technology and Factor season language"""
Noah Sloan	noah_sloan_1392	5.0	51.1	70.2	"""Note: Before they help	 then Eat"""	"""They affect: Open truth customer receive sister next	 Sing analysis student brother hair"""
Andrew Wright	andrew_wright_7435	60.0	92.1	8.2	"""Decade culture	 Blue staff Meet"""	"""(Reason data) 	 Rest region affect offer item and Mission effort"""
Joseph Roach	joseph_roach_2277	69.0	57.1	43.2	"""Person sister yes: Clear fast	 Later interest will large always choice"""	"""Major effort clearly; Agent writer case break 	 Politics staff"""
Mark Alvarado	mark_alvarado_7710	31.0	16.1	29.2	"""Note: Service argue good against	 then Better"""	"""Defense far test organization; Natural 	 Lot not ahead become factor successful"""
Daniel Gutierrez	daniel_gutierrez_0699	75.0	4.1	82.2	"""Note: A it	 then Billion"""	"""Cold challenge behavior now price: Republican	 Matter each"""
Sonya Hunt	sonya_hunt_7085		19.1	29.2	"""Far paper drive threat national rest; Art year no wait 	 Article tonight among reason"""	"""Positive as commercial; Suffer news tax 	 Unit us"""
Melissa Lewis DDS	melissa_dds_9234	52.0	71.1	74.2	"""Note: Treat morning	 then Through history break"""	"""(High beautiful daughter) 	 Long vote and Director policy building"""
Jessica Ward	jessica_ward_0753	1.0	54.1	66.2	"""Note: Field and	 then Paper yard center without"""	"""(Cover) 	 Establish across manager now significant and Green report six book decade"""
Alexander Guzman	alexander_guzman_7491	24.0	45.1		"""Sound tend site environmental there; Mr beyond 	 And"""	"""Tough staff table until hundred; Same front agency 	 Condition"""
Nicole Higgins	nicole_higgins_0642	7.0	85.1	100.2	"""Note: Expect here	 then Artist million organization early"""	"""Media act financial; Value war vote 	 Address another culture sort language"""
Jennifer Williams	jennifer_williams_8365	47.0	4.1	18.2	"""Note: Father	 then Hair low market coach many"""	"""Note: Music practice method commercial	 then Matter something"""
Christopher Bishop	christopher_bishop_7772	50.0	88.1	26.2	"""(History room section return explain) 	 List live those drug and Sit to home evening expert"""	"""Note: Vote someone else	 then Soldier"""
Amber Beck	amber_beck_1687	28.0	71.1	85.2	"""Result month	 Campaign Mrs"""	"""Door about marriage beyond	 Loss road be white Agency"""
Melissa Brown	melissa_brown_2936	10.0	72.1	24.2	"""(Seat citizen) 	 Research poor important and See yeah drive"""	"""Generation as seek	 Trip son evening lose deal Give ok check act me"""
Adam Duncan	adam_duncan_2231	27.0	100.1	88.2	"""Police	 Total Represent door well"""	"""Pull; Husband myself industry 	 Expert"""
Diane Stevenson	diane_stevenson_0462	5.0	72.1	88.2	"""Day hear himself: Tree current develop environmental social sure	 Crime save view"""	"""(Natural section partner) 	 Expect oil and Everyone across north ask"""
Carlos Fisher	carlos_fisher_5217	49.0	10.1	21.2	"""Still rise like: Teach plan really two voice	 Either long meet civil half before"""	"""Note: Standard past check sea reality	 then Education catch itself"""
Kevin Hunt	kevin_hunt_7498	34.0	32.1	39.2	"""Fish in certain exactly data; Because 	 Also citizen"""	"""Stuff himself employee; Hit 	 Rate system"""
Peter Harris	peter_harris_5847	42.0	94.1	49.2	"""(Federal six) 	 While together and Let wrong"""	"""Occur account	 Wide response answer fight Line affect keep"""
Krystal Smith	krystal_smith_6795	22.0	66.1	82.2	"""Sing win nice; Service mother clearly military 	 Year article special according ahead"""	"""Firm share eye expert: Player	 Employee have coach cell lot during"""
Michael Nichols	michael_nichols_8680	32.0	78.1	68.2	"""Note: Paper letter	 then Beat like discussion fall"""	"""Note: Person interest	 then Participant movement"""
o	ashley_perez_2541	31.0		24.2	"""Language; Future music 	 Under reveal keep board laugh Democrat"""	"""Family unit	 Beyond dinner Land range"""
Samantha Jones	samantha_jones_1845	11.0	77.1	20.2	"""(Blood however particular same) 	 Order over produce and Cover record"""	"""Work protect: Have certainly six by goal value	 Operation can"""
Bonnie Koch	bonnie_koch_3310	10.0	69.1	58.2	"""Evidence few course serve; Fear total pass reason 	 Toward during"""	"""Note: Another analysis choose major prevent remain	 then Order nearly television"""
