name;username;total_count;score;description;review
Marion Griffiths-Ross;marion_ross_6507;86.0;36.1;"""(Quo assumenda a dolore officiis) ; Deleniti and Voluptates sed""";"""Tempore; Repudiandae provident cupiditate Unde impedit dignissimos dignissimos"""
Liam Pearce;liam_pearce_2619;24.0;42.1;"""Odit perferendis minima dignissimos porro explicabo; Sit ; Earum porro quos""";"""Note: Voluptatum distinctio nostrum; then Velit"""
Mr Henry Kennedy;mr_kennedy_9643;18.0;68.1;"""Ab reiciendis provident; Ipsa Repellat perspiciatis""";"""Note: Porro non officia; then Nulla eos aspernatur"""
Adam White;adam_white_2312;9.0;71.1;"""Deleniti provident; Nostrum error facere accusamus nulla ; Aperiam consequuntur itaque vel""";"""Illo iusto harum; Recusandae atque repellendus libero ; Voluptate nihil possimus"""
Lee Watson;lee_watson_3926;7.0;8.1;"""Aperiam; Voluptates cumque Quo hic""";"""Laborum nemo; Adipisci expedita labore labore quidem Dolor porro sequi"""
Mathew Robertson-Thorpe;mathew_thorpe_5361;25.0;33.1;"""Cum veritatis aspernatur expedita: Natus mollitia officiis consequatur; Sint odio unde eum""";"""(Dolorem quas) ; Nulla and Mollitia earum"""
Ms Wendy Butler;ms_butler_1295;4.0;3.1;"""(Ducimus eligendi incidunt ratione eveniet) ; Suscipit eum and Repudiandae sequi""";"""Ex animi reprehenderit; Voluptas dolores Reiciendis doloribus"""
Gregory Little;gregory_little_8746;48.0;97.1;"""Id ullam rem quibusdam excepturi; Cum qui ; Beatae quis eligendi""";"""Iusto tenetur illo minus animi; Commodi rerum Suscipit sint"""
Marian Payne;marian_payne_8788;32.0;27.1;"""Note: Quibusdam numquam; then Accusamus a""";"""Voluptatibus labore: Laudantium nihil officiis; Dolore quidem eius veritatis"""
Irene Smith;irene_smith_0609;52.0;33.1;"""Note: Enim; then Nulla totam""";"""Note: Dignissimos optio; then Assumenda alias"""
Ms Catherine Allen;ms_allen_3668;64.0;79.1;"""Similique atque quis; Deleniti soluta ; Sed cum sapiente""";"""Nisi doloremque labore; Similique voluptatem perferendis ; Repellat aliquid explicabo"""
Mr Graham Evans;mr_evans_8567;9.0;87.1;"""Error temporibus officia; Cumque magnam ; Cum""";"""Praesentium ullam: Expedita; Sit maxime"""
Sandra Norton;sandra_norton_6260;73.0;46.1;"""Praesentium pariatur odit quaerat vitae; Enim voluptatum Autem""";"""(Tempora) ; Beatae excepturi and Laudantium occaecati mollitia"""
Lydia Fisher;lydia_fisher_5753;89.0;98.1;"""Reprehenderit vel; Voluptatum iure sunt earum Illo voluptates""";"""Temporibus dignissimos molestiae facere; Adipisci Suscipit rerum vero labore"""
Alan Whittaker;alan_whittaker_3841;27.0;21.1;"""(Quisquam veritatis) ; Occaecati est perspiciatis exercitationem debitis and Quam facilis commodi saepe explicabo""";"""Aut optio ad ipsum doloribus: Quos quam quis tenetur quod; Voluptates esse"""
Dr Jacob Robson;dr_robson_9041;73.0;13.1;"""Note: Tempore amet a; then Dolorem""";"""At modi necessitatibus: Maiores modi; Nulla sunt distinctio dolore"""
Mr Kevin Harvey;mr_harvey_5582;22.0;86.1;"""In; Placeat modi ; Similique reprehenderit eos saepe dolorum""";"""Note: Suscipit; then Recusandae quidem commodi"""
Ashley Wyatt;ashley_wyatt_2106;19.0;10.1;"""Dignissimos labore minima ducimus fuga rem: Aut exercitationem; Laboriosam quasi sapiente distinctio""";"""(Eaque iste voluptatibus) ; Id ducimus dolorem vero and Reprehenderit impedit iure consequuntur"""
Hayley Miller;hayley_miller_2908;90.0;45.1;"""(Praesentium repellat omnis) ; Harum ea and Officia perferendis""";"""Neque cum vitae: Quos placeat dolor; Hic adipisci asperiores voluptatem"""
Gary Dodd;gary_dodd_0470;;35.1;"""(Sit quibusdam possimus velit cum) ; Dolorem modi nam consequatur and Earum esse""";"""(Minima accusamus) ; Molestias ducimus inventore perferendis exercitationem qui and Voluptas"""
Sophie Wilson;sophie_wilson_5065;44.0;94.1;"""(Ab magni) ; Suscipit magni and Accusantium nesciunt deleniti""";"""(Tenetur) ; Porro temporibus laudantium and Beatae"""
Mrs Patricia Young;mrs_young_2230;11.0;25.1;"""Doloremque: Ducimus dignissimos illum exercitationem in provident; Et unde impedit""";"""Vero quidem; Recusandae inventore voluptatum Fuga natus enim eaque consectetur"""
Natalie Watson-Kerr;natalie_kerr_7226;92.0;88.1;"""Consequatur culpa itaque provident eos: Omnis sint; Vero asperiores eligendi autem reprehenderit""";"""Itaque sit voluptatum et: Aliquam fugiat corporis; Sunt quibusdam dolorem"""
Charles King;charles_king_7787;2.0;72.1;"""(Repellendus quos) ; Debitis pariatur repudiandae and Esse repellendus""";"""Molestiae; Totam Harum minus"""
June Harris-Brooks;june_brooks_8533;83.0;29.1;"""Aspernatur saepe necessitatibus: Distinctio eaque unde; Molestiae dicta quidem""";"""(Odio earum distinctio et) ; Recusandae libero neque molestiae rem and Minus delectus"""
Nicole Kennedy;nicole_kennedy_1657;41.0;87.1;"""Asperiores libero necessitatibus fugiat; Assumenda ; Quia cum""";"""Itaque enim; Modi provident ; Omnis"""
Rachael Mann-Mitchell;rachael_mitchell_0425;73.0;18.1;"""Sunt dolores perspiciatis saepe; Iusto autem Illo in itaque""";"""Note: Modi dolorem voluptatum iusto; then Placeat"""
D;ms_stanley_1978;84.0;;"""Ipsam: Perspiciatis; Saepe""";"""Note: Ipsum perspiciatis enim; then Ullam numquam"""
Allan O'Connor;allan_connor_4363;7.0;4.1;"""Note: Provident corporis culpa molestiae rem; then Vitae ipsam debitis possimus similique""";"""Note: Similique provident; then Ab"""
