username,name,rating,score,review,description
mary_thompson_5963,Mary Thompson,1.0,8.1,'''Dolore asperiores ab tenetur totam; Esse ullam , Qui adipisci dolorum accusantium''','''Reprehenderit illum, Animi rem magni assumenda Aut'''
pamela_storey_2728,Pamela Storey,16.0,79.1,'''Alias dolor modi dolorum assumenda; Blanditiis ducimus , Cupiditate assumenda repudiandae''','''Voluptatum natus fugit suscipit; Voluptates repudiandae eaque , Inventore odio culpa voluptatem'''
miss_brien_4744,'Miss Catherine O''Brien',54.0,14.1,'''(Blanditiis fugiat incidunt) , Mollitia excepturi and Facere adipisci et magni''','''Quam molestiae saepe, Fuga nostrum repellendus illum similique eos Repudiandae debitis nam eum dolore'''
dr_page_6488,Dr Jeremy Page,27.0,61.1,'''Amet dignissimos corporis reiciendis dolorum; Nostrum officiis veritatis , Repellat asperiores''','''Unde totam, Nihil libero veniam provident quaerat veritatis Quos'''
leon_francis_4398,Leon Francis,14.0,48.1,'''(Quasi sint delectus) , Nobis adipisci vero nostrum in and Eos corrupti''','''Eaque numquam; Tenetur ipsa , Dolorum corporis'''
ms_wood_1517,Ms Kayleigh Wood,75.0,3.1,'''Suscipit dignissimos; Eum deserunt deserunt , Assumenda''','''Animi hic pariatur: Deserunt reprehenderit perspiciatis ipsum, Voluptas ut'''
christopher_gardiner_5742,Christopher Gardiner,97.0,19.1,'''Note: Error at, then Nulla''','''Sapiente consequuntur; Nemo neque dicta deleniti , Dolore in soluta consequuntur'''
charlene_birch_0987,Charlene Birch,52.0,83.1,'''Reprehenderit; Totam possimus distinctio et , Eius consequuntur incidunt''','''Unde dolorem deleniti quia voluptas: Quae sapiente, Dignissimos iste'''
arthur_grant_2096,Arthur Grant,19.0,98.1,'''(Quibusdam recusandae) , Dolores commodi architecto assumenda fugiat consequatur and Voluptatem cumque''','''Veniam labore exercitationem error cumque ipsa, Nam saepe aliquam Error eligendi ducimus quis quaerat eum'''
cheryl_moss_9136,Cheryl Moss,10.0,14.1,'''Voluptate officia delectus dolor dolorum vel; Odit fuga , Ducimus sed et optio''','''(Hic repudiandae) , Adipisci fugit voluptatum error in maiores rem and Magni illum'''
jennifer_stokes_0917,Jennifer Stokes,26.0,52.1,'''Note: Temporibus explicabo, then Blanditiis commodi ab fuga sequi enim''','''Iusto aperiam: Quisquam maiores, Culpa numquam ducimus voluptatum sint'''
dr_williams_5946,Dr Frederick Williams,,2.1,'''Distinctio nam laborum; Repellat eius laudantium , Nobis nisi labore''','''A voluptatum quo; Blanditiis provident , Temporibus aperiam'''
alison_barrett_1225,Alison Henry-Barrett,89.0,79.1,'''Cumque quidem, Optio esse Cum totam nemo doloribus''','''(Laborum porro) , Aliquid nesciunt quas and Ea quaerat rem'''
julia_williams_9395,Julia Williams,47.0,48.1,'''Asperiores veniam; Sint rerum , Praesentium aut error ab qui''','''(Facere delectus nobis) , Minus id ad and Hic facilis asperiores ad'''
alex_jones_6988,Alex Wells-Jones,32.0,16.1,'''Note: Sit, then Tempora pariatur ex''','''Architecto ex consectetur; Non expedita sit provident , Eligendi nesciunt id non tempore voluptas'''
helen_watson_0436,Helen Watson,16.0,50.1,'''Itaque recusandae distinctio, Tempore amet tempora voluptatum illo quae Alias nulla suscipit''','''A reprehenderit consequatur: Atque ab at, Alias'''
ann_slater_0846,Ann Slater,61.0,52.1,'''Note: Deserunt, then Nostrum assumenda possimus''','''Expedita maxime; Facilis doloribus officiis assumenda , Eaque'''
neil_lowe_6470,Neil Curtis-Lowe,95.0,26.1,'''(Nam) , Dignissimos itaque and Eum magni architecto dolor''','''Enim porro: Provident autem perferendis, Minima exercitationem'''
mr_jones_4385,Mr Darren Jones,35.0,50.1,'''(Vitae vero repudiandae soluta a) , Repudiandae fuga repellendus and Atque facere delectus''','''(Asperiores) , Quam blanditiis ducimus magnam and Ipsum soluta sed corporis amet'''
nathan_archer_2691,Nathan Archer,30.0,50.1,'''Note: Nesciunt eveniet, then Quo''','''(Excepturi amet eius) , Commodi quasi and Incidunt minima voluptates at'''
deborah_jones_2766,A,88.0,18.1,'''Note: Cumque earum nostrum officia placeat sed, then Accusamus inventore occaecati ipsam optio''','''Note: Culpa quasi magnam, then Quibusdam pariatur architecto'''
jodie_lee_2622,Jodie Lee,71.0,67.1,'''(Dicta molestias quos accusamus) , Nobis and Nam suscipit''','''(Itaque) , Asperiores and Numquam'''
danielle_mann_6771,Danielle Mann,76.0,80.1,'''Note: Alias, then Fugit consequatur mollitia aliquam esse deleniti''','''Minus saepe; Ea , Odio'''
brian_walker_1863,Brian Walker,15.0,97.1,'''Nemo itaque accusantium: Iste illo sit dicta, Aliquid accusamus porro soluta''','''Note: Ipsa velit aut, then Sit dicta dolorum eum culpa'''
mr_donnelly_6316,Mr Norman Donnelly,72.0,98.1,'''(Ut vero) , Alias officiis aperiam modi and Earum''','''Omnis rerum repellat; Recusandae accusamus similique , Maiores odio'''
abigail_hunt_7715,Abigail Hunt,98.0,77.1,'''Molestiae deleniti rerum rerum aliquam molestias: Cumque laboriosam illo, Odio impedit dicta qui magnam''','''Voluptates at temporibus fugiat aspernatur: Ipsum nobis, Saepe odio veniam'''
dr_parry_2033,Dr Francis Parry,27.0,98.1,'''(Consequatur) , Voluptates autem and Aperiam nisi''','''Autem consectetur voluptatem: Labore debitis, Quos'''
joseph_sullivan_9919,Joseph Sullivan,30.0,,'''Sunt; Aliquid , Dolor reiciendis''','''Natus voluptatum possimus, Id fuga eos Inventore odio'''
angela_bell_4830,Angela Lee-Bell,26.0,100.1,'''Necessitatibus blanditiis odio; Unde ipsa , Minus et''','''Assumenda quae reiciendis asperiores: Doloremque quasi tempora, Suscipit nam vel'''
anne_payne_6554,Anne Payne,27.0,1.1,'''(Libero unde beatae illum) , Quidem dignissimos similique and Odio odio maxime aliquam quaerat''','''Accusamus maxime sint: Totam voluptatum, Ipsa in'''
roy_jackson_6127,Roy Parkin-Jackson,88.0,71.1,'''Note: Quo pariatur blanditiis fugiat quidem quo, then Sit''','''Note: Nostrum cumque praesentium atque esse nesciunt, then Magni nemo'''
dr_smith_5166,Dr Aaron Smith,34.0,86.1,'''(Unde consequuntur beatae) , Itaque rem porro and Totam nemo quibusdam voluptates nesciunt''','''Ullam nulla, Molestiae cupiditate quod Accusantium necessitatibus maiores'''
graham_martin_1286,Graham Reed-Martin,1.0,82.1,'''Note: Minima maiores dolorum reprehenderit recusandae, then Vero''','''Numquam distinctio: Consequatur nisi, Necessitatibus'''
hugh_white_0455,Hugh White,60.0,32.1,'''Note: Excepturi, then Qui nesciunt nesciunt''','''Magnam veniam, Sit iusto totam sunt Omnis'''
francesca_lewis_3594,Francesca Lewis,22.0,71.1,'''Sequi eum corrupti pariatur fugit, Vel natus Provident facilis iusto''','''Totam dicta sed vel ipsam; Commodi dolor reprehenderit asperiores , Iste voluptatem voluptatum'''
neil_spencer_8840,Neil Richardson-Spencer,90.0,85.1,'''Qui; Corporis fugit , Minima possimus expedita ipsam quos officia''','''(Totam) , Quo veniam eius perspiciatis ad and Quia odio soluta'''
anne_bradshaw_6145,Anne Bradshaw,63.0,7.1,'''Note: Similique eum rem incidunt, then Quos aliquid modi''','''Quisquam iste: A consectetur, Harum aspernatur blanditiis modi delectus soluta'''
vanessa_jones_5471,Vanessa Jones,97.0,60.1,'''Nostrum ex: Ab nostrum consequuntur ipsam sint, Veritatis unde saepe consequatur suscipit''','''Note: Sequi suscipit, then Voluptates voluptatum'''
louis_baker_1355,Louis Baker,57.0,91.1,'''Rerum veniam illo, Expedita voluptatibus modi Consectetur tempora''','''Temporibus quia; Maxime pariatur , Eos quos labore eaque'''
jayne_cunningham_8267,Jayne Cunningham,78.0,76.1,'''Quam deleniti eveniet dolorem: Placeat animi suscipit minima animi dignissimos, Non labore nobis''','''Dolorem dolores, Adipisci quibusdam totam Ipsam consequuntur'''
