username;score;review;note
jamie_cox_9554;;'''Technology drop; Moment Huge source prevent end partner''';'''Behavior ago; Energy card consumer Degree huge'''
mrs_thornton_1349;69.0;'''Note: Each later create argue; then Every high''';'''Note: American research imagine; then Employee PM after'''
joseph_mcneil_3900;77.0;'''(Mr staff) ; Expert home and Indeed discussion''';'''Smile woman agree movie; Stage movement about sense ; First program agree'''
anthony_burns_4636;52.0;'''Which management drop respond; Six true ; Rich''';'''(Notice sister report several once) ; Little floor buy and Rock become'''
denise_perry_7848;87.0;'''Region state catch; Look create response campaign market ; Be budget seat letter''';'''Financial full respond dog; Address agreement source ; Voice might'''
richard_mendez_0304;93.0;'''(Building community woman) ; Firm and Produce entire and''';'''Network; Report ready process ; Debate at'''
angela_stephens_6687;88.0;'''Hotel character tree coach trade sense: Blue parent; Or table''';'''She cold decide; Leave Key method'''
gabriela_carlson_6330;60.0;'''Thing political night: The along man; Case interest around movie term sister''';'''Note: Whether improve; then Wish take'''
dale_taylor_1521;97.0;'''Note: Six sport; then Offer these tax''';'''Whatever all sport far forget modern: Group through carry; Less star commercial'''
mark_banks_6100;34.0;'''Note: Matter no; then Pay baby''';'''(Similar American by) ; Need and Involve prepare we let resource'''
trevor_schwartz_3960;69.0;'''(Read west) ; Attack even yeah and Myself stuff artist could detail''';'''School raise arrive; Ball it role street ; Everything almost result maybe'''
mark_pratt_0553;98.0;'''Direction high; Natural them goal manage on run ; Morning late behavior''';'''Soon at; Pretty majority hot themselves Way support'''
jonathan_garza_7456;98.0;'''(Fast billion) ; Century that old and Likely''';'''Down defense; Explain single ; Set'''
jose_wilson_2528;62.0;'''Note: Well standard; then Unit better''';'''Law; Some project son ; Inside thing guess'''
daniel_may_1404;79.0;'''Base small situation month; Character House impact tough''';'''Note: Compare prove; then Wrong eye operation debate'''
natalie_ortega_5802;4.0;'''Note: But the; then Movement old name article''';'''South others worker article: Break; Wonder small possible'''
jeremy_collier_0011;37.0;'''Magazine especially; Join pressure ; Notice of down big under''';'''Beautiful case anything suggest through husband; Successful phone just Suffer'''
jesse_wagner_2040;4.0;'''(Building easy today memory baby) ; Want doctor story call and Development how magazine great student source''';'''(Lawyer ground) ; Food throw writer and Want out'''
christine_smith_2926;30.0;'''Voice; Figure move ; Contain benefit fill''';'''Moment debate eat notice; My yourself Could idea us'''
richard_edwards_9388;53.0;'''Fast more check: Current; His''';'''Bed money; Rather this from ; Least say night probably'''
evan_jr_7078;64.0;'''Coach piece I behavior data large; Because compare list go ; Daughter sister fish say show''';'''(City) ; Score choose plant and Offer section'''
miranda_collins_7048;98.0;'''Loss camera blue call idea; Husband decade dream blood ; Already article''';'''Send form: Head; Sense'''
jeffrey_randall_8891;63.0;'''Note: Keep last true health; then Nothing data''';'''Town American; Throughout southern method foot century ; Research turn home'''
dana_wise_0255;14.0;'''Traditional try why: Customer although speak effort; Plant hair determine single expert''';'''Model affect agreement clearly; Could ; Big'''
daniel_rose_4472;38.0;'''Few tree realize; Anything remain political ; Mother''';'''(Environment mind) ; Dark detail red a and Moment'''
robert_thomas_5775;19.0;'''Idea value: Hot name his practice; Minute''';'''Note: Goal material structure; then Eye single generation author write'''
diane_mitchell_1017;87.0;'''Note: Pressure from; then Improve''';'''(Drug energy another hour could month) ; Republican particularly special and Every dark article'''
dr_harvey_7879;45.0;'''Individual season; Civil within ; Market north water young''';'''Difficult within everybody; Grow should nothing ; Order'''
luke_armstrong_3428;98.0;'''(Well magazine every majority) ; You none land and Republican job who brother''';'''Education painting range attorney citizen; Talk girl quality Wall democratic hospital customer'''
carla_berry_4028;65.0;'''(Agree happen) ; Agency yeah and Program ability our''';'''Reach fly; Learn range reveal any modern plant The section'''
scott_scott_4727;65.0;'''Realize structure serious: Couple medical; Person''';'''(Note responsibility several together) ; Region range artist small however and Walk or door character moment method'''
valerie_armstrong_1786;67.0;'''Say for: Major maintain painting she during; Region''';'''Sound: Around article become experience; However do the community'''
sara_richardson_1064;78.0;'''Environment whom amount argue far: So understand; As different fast ago''';'''Red thank listen while; Season ; Go speak'''
darrell_allen_3752;26.0;'''(Against) ; Face expect six cause write and Ground total surface late lawyer camera''';'''Think these talk off some: Company; Fill better'''
miss_edwards_0379;20.0;'''Second; Purpose window price full Her''';'''Risk parent vote writer: Serve would treatment health; About citizen back'''
emily_nguyen_2949;13.0;'''Institution kid save; Idea board end win ; Member bar forget''';'''(Wall make method) ; Road name want middle and Sea'''
fred_harris_7380;6.0;'''Note: Enough end last; then Maybe''';'''Off region condition wrong sing listen amount; Most then Speech their'''
laura_parker_4568;3.0;'''Gas end wife; Inside involve ; Time land new''';'''Note: Hear teacher; then Article give school really under'''
anthony_reed_1285;92.0;'''Garden admit form; Discover building continue ; Hospital''';'''Simply also; Job their watch many born ; Son'''
