username	name	salary	message	review
joseph_gilbert_5737	Joseph Gilbert	51.0	'''Read	 Interesting gas Similar kitchen personal new'''	'''(Seem support way meet science) 	 Ever feel network cup and So'''
jerry_garcia_0721	Jerry Garcia	12.0	'''Quality consumer; Break show 	 Table partner knowledge none'''	'''(Federal policy me) 	 Enough and Onto increase'''
tammy_phillips_9249	Tammy Phillips	91.0	'''(Walk mission hair) 	 Show direction and Statement art Mr order onto'''	'''(American street) 	 Course drive quite and Home magazine effect color your week'''
ronald_williams_5146	Ronald Williams	82.0	'''Better; Memory among attorney any sort letter 	 Build situation'''	'''By learn writer	 Theory picture whom International'''
cindy_wells_4056	Cindy Wells	67.0	'''(Without thing modern apply) 	 Indeed girl voice and Note investment leader'''	'''Create share first	 Early reason Actually lead leg suddenly finally'''
bianca_thomas_3365	Bianca Thomas	25.0	'''Congress	 Conference management fear Subject each'''	'''Drive simple	 Carry weight enjoy Appear debate baby'''
rebecca_ponce_1332	Rebecca Ponce	98.0	'''Note: Sign behavior research	 then Try hit'''	'''Note: Room what good	 then Sea always fall fear'''
jennifer_powers_1740	Jennifer Powers	85.0	'''Before decade community discuss	 Radio natural image Take'''	'''Note: Star class	 then Adult while happen available'''
daniel_wilson_1417	Daniel Wilson	94.0	'''Certain fine argue data bed manager dark	 Democratic site message Goal under position major property'''	'''Movie level dark TV; Develop marriage leg 	 Across'''
dave_fisher_7309	Dave Fisher	45.0	'''(Professor theory growth nice moment) 	 Check nation nice economic and Enjoy'''	'''During even	 Guess Eye'''
annette_hanson_0105	Annette Hanson	1.0	'''Society something: Drive way voice industry	 Admit culture'''	'''Note: Quickly girl fire behind	 then Cut your beyond'''
emily_miller_3331	Emily Miller	23.0	'''Attention nature live great federal; Than see couple speech 	 Half left over'''	'''Deep long	 Defense sport street Blue reflect travel'''
victor_dds_3020	Victor Kirby DDS	82.0	'''Part thank chance: Knowledge control wear too	 Miss building'''	'''Note: Perform	 then Among team'''
dr_fox_7050	Dr. Steven Fox	72.0	'''Note: Sure result improve	 then Prove'''	'''Keep various manager set: Family key wife win	 Four bank notice'''
shawn_murphy_9233	Shawn Murphy	36.0	'''Movement drop outside animal; President air pressure 	 Government dream'''	'''Order radio	 Herself Production foot worker price common'''
ian_butler_1525	Ian Butler	73.0	'''(Seem ball billion cell different) 	 Bed prevent weight and Try market believe'''	'''(Sense what employee) 	 Together and Discover stand'''
michael_norman_1781	Michael Norman	17.0	'''(Once instead their college system land carry) 	 Discuss and Final'''	'''(Same magazine light enough) 	 Among discover war above and Hotel whole'''
spencer_davidson_0298	Spencer Davidson	95.0	'''Prove college real history respond	 Plan reach Manage would'''	'''Raise history director	 Across magazine White natural similar pretty movie'''
kyle_mills_1324	Kyle Mills	32.0	'''Note: Human international we should tree	 then Character decade pay couple'''	'''Note: Speech letter	 then Support operation PM'''
jennifer_moore_8773	Jennifer Moore	1.0	'''Season hit anyone environmental; Treat court 	 Rich attention'''	'''(Body sense who lot set significant) 	 Especially like and Little I Democrat'''
rebecca_garcia_0381	Rebecca Garcia	23.0	'''That billion: Worry push their decide carry friend	 During task possible tough'''	'''Build	 Also agent source tax mission Evidence require later'''
todd_lane_2130	Todd Lane	44.0	'''Will forward stop street: It fire serve church	 Seven argue'''	'''(Parent maintain) 	 Once by top and Determine moment sell'''
philip_bell_6534	Philip Bell	15.0	'''Room; Be garden 	 National'''	'''Already century; Car front including machine author 	 Experience different fish'''
nicholas_rubio_8708	Nicholas Rubio	10.0	'''Whom enter usually; Skin and 	 Drug room cost a particularly'''	'''Interesting compare	 President wait program Under include'''
megan_carter_6411	Megan Carter	68.0	'''Note: On network behavior writer	 then Young'''	'''Note: Determine reality food	 then Have tell ask'''
brittany_jackson_2762	Brittany Jackson	94.0	'''(Meeting number) 	 Join and Old free'''	'''Note: He since	 then Feel remember fish'''
elizabeth_morris_0898	Elizabeth Morris	14.0	'''Agency contain although: Next computer scene beyond before no	 Too accept'''	'''People allow bill music around; Writer try daughter between 	 Phone election set'''
courtney_stephens_1264	Courtney Stephens	30.0	'''Unit guess; Environmental feel together west card 	 Religious'''	'''Note: Tough together behavior star	 then Short'''
brittany_schmidt_9579	Brittany Schmidt	63.0	'''Note: Study southern without dog wait	 then South year'''	'''Last general; Next nearly 	 Prove which child'''
julie_ortiz_1139	Julie Ortiz	85.0	'''Assume partner	 History probably today way case simply Actually'''	'''After throw here: However power them	 Smile manage note'''
matthew_james_6178	Matthew James	33.0	'''Nearly maybe	 Quickly certainly Particular'''	'''Crime campaign move appear operation; Perhaps method court than 	 Certain spend'''
roy_page_8812	Roy Page	37.0	'''Hour professor process without; Toward 	 Last amount drop'''	'''He when; Single prevent newspaper 	 Hand moment if traditional'''
melissa_cook_9071	Melissa Cook	34.0	'''Note: Discover computer	 then Natural quite push'''	'''Follow goal; Society bank left use government 	 Hundred interest air Congress'''
julie_thomas_9204	Julie Thomas		'''Note: Dog	 then Week project'''	'''Professor certainly seem education; Project sister 	 Student bed including'''
logan_rodriguez_1723	Logan Rodriguez	60.0	'''(Southern interesting) 	 Thing away there and Mother no health'''	'''Here sea already: From born note	 With claim'''
rodney_townsend_9511	Rodney Townsend	45.0	'''Interview feeling summer speech often	 Key increase action Campaign'''	'''Plan thought take	 Group whose fast Seem catch head his send'''
gregory_jackson_1952	l	45.0	'''(Style design sell enjoy) 	 Force another fine and Direction second member buy'''	'''Environment once draw number: Pattern huge save woman economy	 Camera the say'''
christopher_murray_6281	Christopher Murray	10.0	'''Deal even member great return result: Wish poor agency	 Have forward accept figure'''	'''Adult foot college; Agent religious region 	 Third century'''
jessica_kelly_4304	Jessica Kelly	44.0	'''Avoid same: College represent	 Idea scene fish turn'''	'''Practice middle	 Least state sea Hope'''
dennis_moore_6919	Dennis Moore	23.0	'''(Whom rate) 	 Hair without him and Alone indeed maintain democratic total successful'''	'''(Blue kind give purpose follow) 	 Big alone and Perform mother note explain feel'''
