name;username;rating;salary;message
Graeme Briggs;graeme_briggs_8812;21.0;8.1;'''Nostrum dolores illo possimus; Possimus voluptas numquam Placeat cupiditate'''
John Phillips;john_phillips_7815;66.0;48.1;'''(Aut inventore numquam ut) ; At sunt and Odit repellendus atque incidunt'''
Carly Brown;carly_brown_6583;100.0;46.1;'''Accusantium dignissimos; Minus commodi Expedita quo'''
Hazel Sharpe;hazel_sharpe_5578;48.0;14.1;'''Et ea culpa; Quae ipsa modi recusandae dolorum Temporibus laudantium repellendus cum est'''
Brandon Robertson;brandon_robertson_2955;28.0;34.1;'''(At ratione hic sapiente iure consequatur) ; Consequatur and Perferendis nesciunt nihil quo consectetur'''
Mrs Beth Pope;mrs_pope_0197;38.0;36.1;'''Porro quisquam rerum; Eum soluta ex voluptates repellendus Officiis unde illo quod ratione'''
Dr Damian Kaur;dr_kaur_9821;24.0;;'''Similique laudantium quidem; Dolorem voluptatem eveniet ; Nam'''
Ian Macdonald;ian_macdonald_5235;90.0;94.1;'''Vitae modi odit aperiam voluptas; Deserunt ; Voluptate architecto iure'''
Justin Patel;justin_patel_6477;39.0;67.1;'''Occaecati ratione autem molestias consequuntur nam; Magnam sunt suscipit quibusdam ipsa ; Impedit repudiandae qui'''
Antony Jackson;antony_jackson_3435;12.0;57.1;'''Itaque ipsam ut quae eos ipsum; Nihil error Architecto vitae officia iure'''
Lindsey Jones;lindsey_jones_1855;88.0;10.1;'''A ducimus; Optio pariatur accusamus impedit aliquid quae Eos tempora mollitia vel maiores nisi'''
Jayne White;jayne_white_3249;99.0;45.1;'''(Aliquid optio maiores provident) ; Laudantium and Id doloribus'''
Chelsea Barnes-Macdonald;chelsea_macdonald_2065;31.0;62.1;'''Ipsa recusandae veritatis omnis; Debitis corrupti ; Enim rerum similique'''
x;marion_bradley_0886;17.0;80.1;'''(Mollitia nemo quidem) ; Nam animi placeat aliquid and Tempore rem tempora reprehenderit consectetur'''
Emma Briggs;emma_briggs_5074;40.0;50.1;'''Note: Architecto tempore; then Explicabo odio'''
Alan French-Osborne;alan_osborne_3787;98.0;28.1;'''(Quaerat iure incidunt cumque eos) ; Ipsam dolore architecto doloribus ipsam and Nihil odio illo'''
Maureen Kelly;maureen_kelly_5401;14.0;91.1;'''Note: Magnam autem quae; then Necessitatibus'''
Rhys Ali;rhys_ali_6393;8.0;3.1;'''(Odio fuga quam voluptatem exercitationem ipsam doloremque) ; Accusamus alias and Minima vel nam adipisci officiis'''
Harry Bailey;harry_bailey_7998;88.0;47.1;'''Note: A impedit repellendus quidem; then Saepe fugit dolorum'''
Mr Harry Stewart;mr_stewart_6180;47.0;64.1;'''Id temporibus vero doloribus possimus incidunt perspiciatis; Autem nemo atque et Cum aperiam'''
Phillip Bolton;phillip_bolton_3891;55.0;15.1;'''Note: Adipisci repellat hic sint; then Provident repudiandae blanditiis est illo vel'''
Frederick Hurst;frederick_hurst_4954;58.0;98.1;'''Architecto cum dolorem atque esse eveniet: Nostrum; Doloribus aliquam officia ipsa'''
Gerard Lee;gerard_lee_6211;57.0;2.1;'''Tempore animi; Corporis exercitationem placeat Hic officiis ratione'''
Mrs Carol Taylor;mrs_taylor_5841;84.0;46.1;'''At numquam: Culpa voluptatibus; A possimus ducimus'''
Dean Tomlinson;dean_tomlinson_6311;44.0;84.1;'''Note: Veniam esse optio; then Placeat ratione'''
Nicole Graham;nicole_graham_4263;9.0;33.1;'''Officia ratione beatae ex aliquid: Vel totam perferendis officia officia; Id dolore'''
Damien Taylor;damien_taylor_2048;10.0;78.1;'''Note: Blanditiis; then Impedit aut'''
Joe Bowen-Gray;joe_gray_2867;99.0;98.1;'''Repellat recusandae eos; Blanditiis Porro porro quibusdam'''
Dawn Bibi;dawn_bibi_8294;59.0;92.1;'''(Ipsum blanditiis corporis) ; Eum sequi magni and Numquam aliquam sequi neque libero'''
Gary Manning;gary_manning_4420;79.0;19.1;'''(Exercitationem hic iusto officiis quaerat) ; Nemo minima sequi illo and Laboriosam totam doloribus'''
Mr Barry Saunders;mr_saunders_6008;47.0;83.1;'''Doloribus perspiciatis; Aliquid placeat ; Illum sit itaque'''
Dr Terry Wright;dr_wright_6110;61.0;73.1;'''(Porro nisi explicabo) ; Itaque delectus odio quae suscipit and Minima suscipit'''
Oliver Wood;oliver_wood_3624;95.0;30.1;'''(At aliquam) ; Harum ipsa and Commodi incidunt'''
Gerald Bryan;gerald_bryan_3644;72.0;47.1;'''Nostrum aperiam delectus: Sapiente adipisci; Dolore fuga provident aspernatur nesciunt'''
Ms Claire Crawford;ms_crawford_5172;62.0;11.1;'''(Blanditiis quos) ; Porro ad repudiandae and Laboriosam quos rerum'''
Leon Williams-Campbell;leon_campbell_0922;24.0;1.1;'''Qui deleniti in hic asperiores; Voluptate numquam asperiores quas ; Iste modi quibusdam esse autem'''
William Bryan;william_bryan_2902;19.0;43.1;'''(Illo culpa quidem cumque animi reiciendis) ; Nostrum and Numquam quod'''
Oliver Russell-Thomson;oliver_thomson_1714;55.0;94.1;'''(Ad vitae voluptas sapiente) ; Cumque illo and Omnis at'''
Mr Matthew Bailey;mr_bailey_7268;15.0;75.1;'''Laudantium fugiat; Fugit voluptates eaque ; Laudantium odio'''
Dominic Pugh-Lamb;dominic_lamb_6476;81.0;10.1;'''(Deserunt placeat quas quod) ; Beatae saepe and Quos molestias corporis sit laudantium repellendus'''
William Smith-Wilson;william_wilson_1594;80.0;94.1;'''Tenetur nulla: Eius culpa doloribus; Veritatis vero harum'''
Dr Simon Tomlinson;dr_tomlinson_3940;58.0;67.1;'''(Repellat sapiente aut) ; Deserunt cum and Debitis aliquid quam maxime dolore sunt'''
Sean Tucker;sean_tucker_0332;71.0;26.1;'''Vel beatae; Voluptatibus voluptatibus recusandae officiis eligendi Unde porro sequi'''
Dr Malcolm Lucas;dr_lucas_8731;;12.1;'''(Id earum molestiae) ; Ullam quae and Nihil est mollitia consectetur ullam'''
Kyle Smith-Humphries;kyle_humphries_7588;43.0;79.1;'''Dignissimos; Itaque laboriosam repudiandae ; Quam molestias sunt'''
