username	name	total_count	salary	description	comment
catherine_chambers_9703	Catherine Chambers	7.0	4.1	'''Garden until change best ball; Win mouth benefit finally most 	 Choice participant mission report over'''	'''Certainly like: Sure hard thousand	 Hard'''
nancy_thompson_5634	Nancy Thompson	59.0	52.1	'''Boy blue forward light; Professor both language sit speak rate 	 Range speech together certainly member'''	'''(Late message population popular offer economy) 	 Light care well and Your'''
jimmy_scott_1444	Jimmy Scott	19.0	6.1	'''Note: Campaign within run night inside	 then Minute candidate'''	'''Difference only	 One many Truth'''
kevin_martin_3730	Kevin Martin	28.0	100.1	'''Drop open husband	 Design animal sure Catch method'''	'''Any no value son choice paper; Open PM talk 	 Current she girl'''
kyle_brock_5288	Kyle Brock	55.0	32.1	'''Model at; Method lawyer have without 	 Story past course'''	'''(Reduce above) 	 Military soon fill and Challenge feeling soldier'''
chelsea_wiggins_3941	Chelsea Wiggins	29.0	1.1	'''Note: War	 then Impact social them kitchen commercial send'''	'''Those now new these others; At miss degree 	 Pm so'''
bethany_dominguez_2410	Bethany Dominguez	79.0	19.1	'''Wait sport: Fine star increase	 Class'''	'''Account a really box	 Purpose perform education Rest staff medical safe'''
kelly_mcdonald_6131	Kelly Mcdonald	55.0	83.1	'''Share rate; Must work none now 	 Current organization still property drop rule'''	'''(Bring they) 	 Speech and Significant green analysis'''
kathleen_macias_6101	Kathleen Macias	46.0	44.1	'''Knowledge special fire	 Energy ago vote animal among Tell million week myself'''	'''Anyone word watch; Both mission make 	 Chance'''
william_mcdonald_3701	William Mcdonald	42.0	87.1	'''(Eat thought anyone popular) 	 Recent could new serious full ok and Fund especially letter game'''	'''Note: Require dream	 then Line serious vote use'''
eddie_miller_2836	Eddie Miller	61.0	15.1	'''Professional interview my owner among: Step century although	 Citizen medical network'''	'''Chance majority real way six: Range group country	 Girl thing music easy agreement subject'''
charlotte_flynn_2005	Charlotte Flynn	15.0	38.1	'''Visit team edge growth decide: Better suggest travel	 Animal young art water produce alone'''	'''(Man record) 	 Consumer body and Land new'''
dylan_maddox_2126	Dylan Maddox	40.0	69.1	'''Note: Free role single	 then Support'''	'''(Really threat) 	 Then no camera and Treat'''
pamela_lopez_7998	Pamela Lopez	47.0	53.1	'''Rich: Never blue	 Management bad guess'''	'''Heart tree: Together	 Cause see democratic'''
victor_johnson_1534	Victor Johnson	28.0	100.1	'''More grow author between feel	 Carry guy same police success Figure'''	'''(Politics weight I in finish) 	 Win and Staff worker six'''
michael_clay_8807	Michael Clay	19.0	47.1	'''Note: Loss	 then Letter teach catch history'''	'''Risk reflect; Scientist meeting 	 Country figure'''
donald_sanford_3280	Donald Sanford	49.0	44.1	'''Real coach left	 Far alone she Best'''	'''Hard station evidence never: Try end	 Indeed research'''
brandon_jones_5404	Brandon Jones	64.0	57.1	'''Note: Kid seek	 then Difference reach artist'''	'''(Rule effort century) 	 Brother memory thus and Position bag drop'''
david_johnson_0818	David Johnson	14.0	74.1	'''Teacher to realize; Talk information hundred 	 Fast'''	'''Fight hope professional it; Place finally 	 Method'''
danielle_coleman_5097	Danielle Coleman	58.0	33.1	'''Dinner letter perhaps; Maintain I physical speech space 	 Throw model'''	'''(Everyone sell drop suffer) 	 Recent rich born foot and Suggest street yeah add'''
sarah_lindsey_7998	Sarah Lindsey	26.0		'''(View effect cold) 	 Realize at factor school and Like foot'''	'''Note: Decision major every me	 then Nearly use'''
paige_greene_7447	Paige Greene		27.1	'''Little: But care	 Join certain month deal upon'''	'''(From skin however suggest) 	 There difference and Community safe while record'''
wesley_merritt_9704	Wesley Merritt	87.0	34.1	'''Start line; Notice end can kid eight send 	 Amount'''	'''Note: Its simple	 then Toward'''
emily_rush_5405	Emily Rush	72.0	19.1	'''Evening line alone	 Ready Result save stay office focus'''	'''Across reason official beat either	 That TV ability Attorney tree service from hope protect'''
brian_love_1935	Brian Love	52.0	19.1	'''(During course he) 	 Listen whatever surface and Bank item'''	'''Note: Figure indicate become	 then Score'''
christopher_collins_6169	D	76.0	67.1	'''Note: Fly answer drop wait	 then Course change product'''	'''Pattern surface professional support; President early Democrat wait picture 	 Bad moment bill eat'''
alyssa_rush_6846	Alyssa Rush	59.0	56.1	'''(My learn) 	 Black management popular and Large why factor discuss'''	'''Inside through agree media: Watch expect her	 Voice ten laugh type'''
andrew_lee_4545	Andrew Lee	3.0	69.1	'''Across read prevent majority: Appear example perhaps total	 Kind article'''	'''Simple benefit performance	 Former mission shoulder Current nothing serious'''
jessica_king_9511	Jessica King	59.0	62.1	'''Success possible however policy continue: Already	 Size'''	'''(White) 	 Raise glass system and Movie reason'''
michelle_hale_5262	Michelle Hale	78.0	88.1	'''List another ground look: Serve	 Myself'''	'''(All go ever camera production) 	 Little necessary international and Summer company produce'''
jennifer_medina_8803	Jennifer Medina	39.0	91.1	'''Note: Very total way wall sit	 then Rich'''	'''See week work; Majority 	 Number inside campaign'''
mary_lamb_5942	Mary Lamb	79.0	64.1	'''Security church nature staff; Gun choose save 	 Course'''	'''Attorney amount: Often note number environmental manager difficult	 Tree country forward how official'''
patricia_davis_2776	Patricia Davis	62.0	45.1	'''(Cultural respond sort) 	 Scene human and Eat home'''	'''Note: Everybody too local experience decade	 then Support interview thus character about'''
shawn_harvey_5765	Shawn Harvey	15.0	36.1	'''Each view peace	 Oil look clear Bad bank step'''	'''Report seven young; Focus relationship project 	 Class deep beyond back'''
claudia_christensen_8787	Claudia Christensen	53.0	47.1	'''Population information	 Of street Address stage'''	'''Upon focus throw final price million	 Everything still for car Heavy task'''
ashley_delacruz_1385	Ashley Delacruz	93.0	19.1	'''(Certainly ready upon of) 	 And far and Crime save'''	'''Another now: Miss open political both	 I'''
jacqueline_edwards_5784	Jacqueline Edwards	89.0	21.1	'''Full close person environmental	 Movie apply new Decision car'''	'''(Hundred understand forget) 	 Open sound food risk and Arrive wall treat same'''
richard_olson_4024	Richard Olson	88.0	47.1	'''Culture lead visit world; Whether war 	 Respond fund'''	'''Method: Design ten reveal marriage side	 Individual least statement full first'''
ashley_tanner_8937	Ashley Tanner	82.0	60.1	'''See development all: Despite administration thought movement book	 To'''	'''(Reduce together activity world stage each) 	 Ahead policy and Down president big'''
christine_mccoy_9351	Christine Mccoy	54.0	7.1	'''Floor	 Hundred sit relationship Pretty similar'''	'''Front poor; At series treatment 	 Break'''
heather_simpson_4210	Heather Simpson	100.0	53.1	'''Note: Far chance	 then Wrong during'''	'''A million heavy despite research such	 Until camera open information Write stand condition huge'''
kevin_lynn_3695	Kevin Lynn	92.0	60.1	'''Must blue close; Land probably 	 Specific person'''	'''Note: Save	 then Factor possible democratic'''
paul_brown_4617	Paul Brown	12.0	55.1	'''Note: Democrat series house least by	 then Threat thousand'''	'''(Democratic) 	 Hand yes near and Choice improve public'''
