username	name	age	total_count	salary	remark	note
jason_turner_0281	Jason Turner	60.0	57.1	53.2	'''(Decade event but let clearly mind) 	 Early and Then voice piece rest local'''	'''(Throughout remember television process hot) 	 Hand enjoy threat and Hard stock usually maybe'''
chelsea_davis_1740	Chelsea Davis	85.0	77.1	9.2	'''(Memory throw trip against general imagine) 	 Contain building power arrive and Green difference especially'''	'''Someone brother: Upon body society	 Statement with'''
alex_miller_7287	x	100.0	94.1	5.2	'''Ahead strong international ahead: People report of important thing seek	 Avoid situation rise thing positive'''	'''Note: End special yet	 then Analysis free mean she blood'''
angela_gardner_8965	Angela Gardner	86.0	94.1	31.2	'''(Skin different they) 	 Rich and Friend people cup occur'''	'''Painting term season; The 	 Better deep couple'''
brandon_lyons_5205	Brandon Lyons		28.1	40.2	'''Human; Bed 	 Until rock'''	'''Note: Everything	 then Including arrive lead American that now'''
amy_fleming_7078	Amy Fleming	59.0	59.1	66.2	'''Maybe different fast father: Hold different media	 Different stock spring various'''	'''Ok memory: Music bring tell east pattern	 Someone'''
taylor_holloway_2166	Taylor Holloway	19.0	77.1	56.2	'''Your thousand; Majority sound hundred could music 	 Mission'''	'''Play feel wish new indicate face; Worker like remember throughout in 	 Step able'''
bradley_young_2478	Bradley Young	58.0	35.1	85.2	'''(Trial car) 	 Able and Then lay cause letter away'''	'''Note: Benefit many hospital herself president	 then Possible'''
jordan_lopez_9383	Jordan Lopez	20.0	87.1	74.2	'''Assume fund beyond pass; Person source evidence eye 	 Perform house pretty'''	'''Hit though	 Serve must Democrat Professor land finally'''
wanda_perkins_6054	Wanda Perkins	65.0	71.1	25.2	'''Theory color good; Suffer traditional 	 Win success bank'''	'''Note: Bed money black billion	 then Firm'''
michael_woodward_8750	Michael Woodward	22.0	4.1	55.2	'''Note: Election Congress her vote	 then Final'''	'''Herself race effect; Morning hit 	 Talk story thousand'''
william_dillon_3960	William Dillon	75.0	67.1	56.2	'''Economy: Here claim face set	 Rise'''	'''Coach foreign case; Think operation worker will 	 May image'''
danielle_brown_6891	Danielle Brown	97.0	65.1	11.2	'''Do probably; Movement war put no 	 North student room'''	'''Use animal forget their	 Again Painting young talk on'''
wayne_jensen_6005	Wayne Jensen	29.0	81.1	81.2	'''(Name night down) 	 Pressure reflect and Grow conference'''	'''Long activity; South response though indicate rather strong 	 Dinner can federal able blue'''
paul_thompson_0687	Paul Thompson	54.0	40.1	91.2	'''Nearly: Ball	 Fish be several'''	'''Several agency	 Fall American painting trip resource Science feel control PM'''
tina_delgado_0922	Tina Delgado	82.0	61.1	22.2	'''Whom information mind material claim: Until wide service manager sign	 Type writer'''	'''Teacher; Seem to rather 	 Maybe'''
sandra_mahoney_4168	Sandra Mahoney	37.0	99.1	86.2	'''Position several	 Congress School early free'''	'''Network; Care threat yet 	 Carry standard focus important'''
robert_valencia_6591	Robert Valencia	33.0	70.1	43.2	'''(Reach machine three head) 	 Left expert indicate and In politics rest'''	'''(Huge even measure often low) 	 Sound result knowledge and Trade your'''
mark_patel_7283	Mark Patel	13.0	76.1	18.2	'''Inside behind course; Then open 	 Break hotel eat well'''	'''Tend Democrat	 Air Player this quickly investment'''
elizabeth_taylor_7478	Elizabeth Taylor	75.0	13.1	97.2	'''Note: Glass decide bank	 then Above'''	'''(Range performance) 	 Week especially try and Air'''
amanda_paul_1509	Amanda Paul	34.0	11.1	45.2	'''(Garden can reduce) 	 Story beat and Room risk fill example recent response'''	'''Food any heavy: Expect	 Past hour hand'''
christopher_burnett_1830	Christopher Burnett	10.0	3.1	72.2	'''Personal last condition church better	 Under public expect Want sense ok'''	'''Line official surface; Charge 	 Huge return project scientist certainly people'''
lisa_dvm_7909	Lisa Cabrera DVM	5.0	44.1	51.2	'''Key unit ok guy my	 Four option must agent Television'''	'''Speech next evening participant: Rise its	 Statement draw century television table'''
kelli_martinez_8605	Kelli Martinez	26.0	53.1	66.2	'''Note: Project action fill place	 then College involve'''	'''Past order collection finish effect: Wrong within only relate	 Walk away western'''
chad_dds_4976	Chad Compton DDS	43.0	61.1	100.2	'''(Month Mr) 	 Case state box point yeah professor and Professor production'''	'''Simple president I source; Morning class century 	 Future sport us family build during ground'''
jennifer_watkins_8261	Jennifer Watkins	32.0	40.1	16.2	'''(Gun report) 	 Republican energy risk there young data and Weight establish'''	'''Note: Site	 then After about'''
victoria_walters_7328	Victoria Walters	13.0	77.1	61.2	'''Compare other	 Yourself themselves kid Structure capital hit'''	'''Professor tough future	 Certain region coach laugh Whose wrong around'''
richard_carlson_5763	Richard Carlson	54.0	20.1	7.2	'''Something	 Boy Total'''	'''Military next sometimes	 Plan soon young Whose career lead'''
jordan_gray_2223	Jordan Gray	44.0		64.2	'''Of water; Now own 	 Model evidence'''	'''Note: Resource themselves	 then Design relate first stock'''
michael_russell_5262	Michael Russell	74.0	49.1	27.2	'''(List structure hold also end) 	 Possible and Machine between'''	'''Local region: Happen trouble information	 Story small former'''
robert_md_7218	Robert Tapia MD	83.0	80.1	48.2	'''Half nor thousand music person both; Trade attention 	 According most'''	'''Note: Help future suffer	 then Ago pretty'''
melissa_moore_2679	Melissa Moore	26.0	40.1	51.2	'''(Beautiful answer) 	 Seven accept and Forward suddenly born debate'''	'''(Nature lead from) 	 Remain training account dog wear personal and Kind arm'''
amy_manning_2585	Amy Manning	44.0	30.1	50.2	'''Note: Send rate public	 then Social'''	'''After consider possible	 Along probably Sport'''
mr_mccoy_1942	Mr. Miguel Mccoy	12.0	60.1	80.2	'''Student statement next capital	 Population Civil plan'''	'''Either identify there: Heavy	 Blood effect possible'''
brandon_gardner_8830	Brandon Gardner	79.0	78.1	74.2	'''Note: Once	 then Either successful factor pick all improve'''	'''Note: Catch knowledge cost	 then Well be'''
francisco_cox_6690	Francisco Cox	74.0	8.1	23.2	'''Off everyone modern; Decision yet represent by cold 	 Arrive science'''	'''Amount enter others	 Education Half than accept door fish'''
anthony_davidson_2782	Anthony Davidson	99.0	43.1	42.2	'''Serious according thought: Customer protect industry	 Meeting treatment increase'''	'''Note: Artist	 then Three coach'''
kathleen_brown_1934	Kathleen Brown	83.0	75.1	33.2	'''Note: Born clearly field	 then Resource song'''	'''Author play; Situation degree 	 Stage far effect character'''
george_williams_2087	George Williams	53.0	72.1	97.2	'''Program employee hear out read; Off week these since 	 Second dog his same laugh'''	'''War here	 Onto first Support'''
mr_campbell_9971	Mr. Robert Campbell	35.0	99.1	46.2	'''(Ago) 	 Shoulder act very and East'''	'''(Box then she mouth) 	 Reason vote personal grow appear and Teach add teach near different'''
ricky_ruiz_4753	Ricky Ruiz	64.0	87.1	78.2	'''Soon consider understand difference; Modern piece 	 Recent door capital'''	'''(Job possible life) 	 Discover avoid and Out black'''
jon_wilkins_6514	Jon Wilkins	73.0	65.1	22.2	'''Phone	 Reason nation Meet morning rate down'''	'''(Strategy than) 	 Campaign development and Task marriage whatever perhaps'''
melissa_brooks_2524	Melissa Brooks	81.0	31.1	39.2	'''Note: Chair gun worker	 then Article TV mission nature'''	'''Themselves smile yet born	 Order foreign consumer something guess Tree need'''
jennifer_reed_5895	Jennifer Reed	44.0	62.1	29.2	'''(Often) 	 Ask industry much and Either small'''	'''(Indicate any project) 	 Various yard and Candidate here son art'''
sandra_jenkins_3467	Sandra Jenkins	16.0	27.1		'''Country former wonder across grow: Test especially	 Customer your feel blue'''	'''From stage	 Evening according but name Water likely up'''
elizabeth_kelley_3738	Elizabeth Kelley	53.0	90.1	44.2	'''Social all	 Same set Design check'''	'''Note: Be	 then Read both meeting evidence study'''
jessica_brandt_7427	Jessica Brandt	29.0	47.1	22.2	'''Past: Else than media	 Suddenly fight actually no'''	'''Note: Relate four reach	 then Prepare local quickly'''
timothy_burns_8928	Timothy Burns	38.0	24.1	71.2	'''Note: Such	 then Air tell'''	'''(So) 	 Key organization rather and Future note'''
