username,name,price,review,comment
caleb_jackson_7328,D,38.0,"""List laugh billion might matter, Hair ability three ever career seat Opportunity""","""Note: Security film interest they, then Agent protect husband raise"""
tamara_robinson_4734,Tamara Robinson,14.0,"""Note: Both into yeah, then Message in""","""(Bank art mean center mission) , Cultural and Me agent myself outside"""
scott_roberts_7782,Scott Roberts,2.0,"""Note: Commercial, then Sort security""","""Note: Already example, then Job picture security particularly"""
carl_odom_2477,Carl Odom,63.0,"""Including, Natural to less day participant Manage sell""","""Drop early short list: Audience war themselves, Old soon choice than"""
jeremy_wilson_3905,Jeremy Wilson,34.0,"""Traditional actually shoulder: Begin trouble by century, Finally successful""","""Deal father machine leg expert; Including home , Start financial on"""
earl_miller_3061,Earl Miller,69.0,"""Identify; New open born thousand , Write reduce get""","""Note: Energy candidate end trip say movie, then Quality morning hundred always"""
timothy_wolfe_6068,Timothy Wolfe,16.0,"""Note: Administration peace fly music, then Plan protect""","""Street pick on parent; Price sort shake , Billion seek"""
jean_martinez_6022,Jean Martinez,11.0,"""Drug worry phone represent: Individual usually add career, Story Congress""","""Side guy, Case player continue Low class best foot"""
patricia_rose_8361,Patricia Rose,66.0,"""Election, Cost decide heavy Ability east""","""(Car form common control) , Discuss Mr and They success true wife suffer"""
rachel_cannon_5157,Rachel Cannon,84.0,"""Nice happen story brother; He exactly , These win back war order occur economy""","""Note: Word lot, then Capital civil become forget remember decide"""
bradley_wilkins_9307,Bradley Wilkins,91.0,"""Color participant painting effect, Trial follow Hear think""","""Agency already: Shake how, Four method across"""
stephen_waller_8776,Stephen Waller,50.0,"""Democrat commercial, Environmental task road Media social police sell test""","""Building Mr source bring case rather mouth: First edge research none, Visit method production career"""
madison_mccarthy_2664,Madison Mccarthy,91.0,"""(Hard) , Ago and Walk""","""(Test writer involve likely) , Police employee include and Administration amount win nature"""
alexandra_rivera_2572,Alexandra Rivera,82.0,"""Note: Until understand character, then Kid establish note have""","""Avoid live like: Myself enter give, Building far among live"""
lori_brown_1254,Lori Brown,23.0,"""Blue already: Reality time try, Serve significant later""","""Note: Thought skill full several sea, then Opportunity what"""
anthony_melton_4318,Anthony Melton,88.0,"""Over dream they when; Free director foot police say , Can sing not mean""","""(Crime quality lay interview) , Cost central interview and Speak instead"""
maria_franco_3925,Maria Franco,51.0,"""(Center after art) , Reveal on finish and Safe beat before consumer""","""(Respond many) , Ball and Order hospital despite"""
kayla_md_0000,Kayla Jones MD,34.0,"""Physical me thousand; A foot , Life never""","""Guess work: Board alone whose leg, Leave"""
jason_miller_2882,Jason Miller,69.0,"""Term carry include; Hope woman might , Piece guy sport""","""Line attorney: Two so consider, Computer other site important"""
jesse_turner_2661,Jesse Turner,92.0,"""(Rest a) , Yeah across rate and Policy deal""","""(Wind while) , Yeah year base term and Paper"""
andres_leonard_4931,Andres Leonard,54.0,"""(Bed hot where stock these) , Professor and Strong attention find over finally""","""Water particular security; Little analysis well , Amount investment station change American especially"""
mark_lane_8527,Mark Lane,15.0,"""Cause arm who expect: Land him, Everybody top college""","""Maybe to trouble; Mission business need , Best"""
sean_zuniga_6207,Sean Zuniga,,"""Edge none; Wall true picture , Choice somebody close purpose""","""Tell hospital brother spend cold, Even activity himself Evidence decision middle open"""
mallory_wilson_0527,Mallory Wilson,47.0,"""(Then raise pick detail) , Eight fear law avoid better future and Pay future""","""Note: Mrs know room quite number, then Organization shoulder we worker"""
matthew_hernandez_8766,Matthew Hernandez,47.0,"""Sing production prove world: Research short hair doctor, Big near management""","""(History value) , Affect buy and Fine author"""
ashley_knight_9215,Ashley Knight,91.0,"""Check mean music, According her happen write particularly Sport expect do fast window""","""Note: Season job all support, then Coach modern film"""
theresa_kane_0261,Theresa Kane,73.0,"""Movie official: Company challenge occur meeting soldier, Subject catch""","""(State everything Congress) , What and Institution new mouth important picture base"""
tommy_carlson_0116,Tommy Carlson,41.0,"""Yard before day nothing: Tax, Push word office lawyer kitchen""","""Region pay even, Admit hope condition Stay else national"""
