username,name,age,comment
dr_coleman_1204,Dr Darren Coleman,58.0,"""Note: Culpa hic inventore laudantium fuga, then A nemo cumque autem eum exercitationem"""
ann_macdonald_7383,Ann Macdonald,31.0,"""Ipsam nulla: Libero quos voluptate, Ab vero ipsa vero"""
amy_white_2287,Amy Williams-White,39.0,"""Debitis illo; Molestiae , Iste nostrum blanditiis"""
mrs_palmer_9612,Mrs Carol Palmer,48.0,"""(Velit) , Molestias and Architecto id ducimus perferendis"""
mr_morris_8590,e,90.0,"""Note: Asperiores blanditiis, then Dolore autem"""
mr_ellis_0136,Mr George Ellis,26.0,"""Libero corporis molestias ratione: Vitae occaecati, Eos dolore dolor repudiandae nisi"""
mr_khan_0250,Mr Allan Khan,7.0,"""Facilis: Dolorum id perspiciatis fugit, Ratione eveniet"""
stacey_wood_4225,Stacey Johnson-Wood,57.0,"""Animi facilis commodi, Provident sed sunt dolores Natus doloribus"""
naomi_smith_6660,Naomi Smith,67.0,"""Ipsum, Inventore sed ut voluptate Laudantium libero"""
arthur_bartlett_7994,Arthur Bartlett,41.0,"""(Quae voluptas aliquam error debitis) , Error aliquid dolores and Magni"""
ms_davies_8595,Ms Jayne Davies,,"""(Harum assumenda ut) , Alias libero velit and Itaque dolorum recusandae error illo culpa"""
miss_ward_7747,Miss Emily Ward,80.0,"""In voluptatem: Officia iusto dicta non, Suscipit nisi"""
mark_green_8510,Mark Lucas-Green,50.0,"""Quam soluta beatae ut: Repellendus quisquam sit ducimus, Quos"""
declan_banks_2498,Declan Banks,80.0,"""Harum: Asperiores vitae suscipit, Nesciunt veritatis facere ullam"""
josephine_owen_1176,Josephine Owen,72.0,"""Dolorem possimus debitis: Eaque velit pariatur, Assumenda voluptatibus in"""
dr_ellis_2605,Dr Brian Ellis,53.0,"""(Adipisci animi voluptatum) , Labore quo ab and Quidem odio sequi"""
mr_johnson_0533,Mr Nathan Johnson,56.0,"""Ea quas, Quae commodi reprehenderit Fuga corrupti quis adipisci modi iusto"""
cheryl_andrews_8420,Cheryl Andrews,44.0,"""Quibusdam odio sint quam fuga; Sit dolor minima , A amet earum ab"""
bryan_noble_6798,Bryan Noble,29.0,"""Note: Neque tenetur esse, then Autem corporis"""
mrs_jones_1872,Mrs Melissa Jones,11.0,"""Pariatur illum facilis: Temporibus, Ullam consectetur excepturi reiciendis nesciunt rerum"""
kathleen_davies_2896,Kathleen Davies,61.0,"""Note: Rem repellendus amet illo, then In"""
anne_jenkins_5097,Anne Thomson-Jenkins,71.0,"""(Aut magni cum nostrum sint) , Voluptatum autem minima omnis distinctio and Eum autem deserunt"""
mr_hughes_9289,Mr Denis Hughes,36.0,"""(Nemo vel voluptatum odio) , Beatae maiores quod iure and Laboriosam quasi tempora occaecati sapiente temporibus"""
emma_wilkinson_6483,Emma Owen-Wilkinson,15.0,"""(Mollitia expedita dolorum quae) , Excepturi reiciendis and Asperiores facilis"""
dr_lowe_2087,Dr Alice Lowe,53.0,"""In illo voluptatum illum, Magni atque Soluta"""
