name,username,total_count,price,rating,message,comment
Tracy Peters,tracy_peters_2263,23.0,88.1,85.2,'''Sit dignissimos commodi: Dolorum sunt sit totam, Quas nisi''','''Note: Sequi dolore alias, then Beatae facere consectetur rem molestias officia'''
Sian Griffiths,sian_griffiths_4465,18.0,36.1,52.2,'''Aliquam earum, Provident Hic numquam''','''Hic rerum: Sunt cumque, Nulla ab delectus sunt'''
Ellie Doyle-Turner,ellie_turner_3997,63.0,45.1,17.2,'''(Veniam optio natus) , Ipsum eaque cupiditate and Suscipit dignissimos''','''Ipsa quibusdam: Accusamus ab adipisci quos, Amet dolorem perspiciatis soluta beatae'''
Andrew Anderson-Brown,andrew_brown_5717,,49.1,98.2,'''Accusantium quibusdam: Id quaerat laboriosam, Officiis vero porro''','''Note: Fuga optio modi dicta natus quidem, then Velit ducimus repudiandae'''
Mohamed Bowen,mohamed_bowen_0999,82.0,24.1,39.2,'''Harum molestiae quibusdam quidem consectetur non; Voluptate vitae voluptatem , Deleniti sunt provident''','''Provident: Quam fuga quibusdam facere, Magnam nulla dolorem'''
o,henry_hall_1067,5.0,24.1,38.2,'''Perspiciatis libero ex laudantium, Ullam optio Minima''','''Facere quia eos, Est atque Optio nisi autem'''
Valerie Warren,valerie_warren_0330,4.0,25.1,94.2,'''Sit nobis iste consequuntur ex ipsam: Aperiam aliquam, Omnis''','''Repudiandae nihil ipsam: Nemo consequuntur, Placeat'''
Leah Cook,leah_cook_9675,78.0,51.1,21.2,'''Note: Autem distinctio voluptas, then Est omnis''','''(Autem odit accusamus voluptas officia ipsum) , Cum inventore itaque and Suscipit nesciunt minima'''
Miss Beth Jones,miss_jones_6415,73.0,14.1,73.2,'''Ab quasi, Quis molestias debitis natus Architecto minus''','''Note: Eaque, then Id natus reprehenderit provident sequi'''
Paige Stokes,paige_stokes_1360,19.0,75.1,69.2,'''Nostrum dicta: Accusamus exercitationem fugit, Eum tempora rem''','''(Soluta fugiat iure a porro) , Dolore labore quod and Quo exercitationem sit'''
Heather Slater,heather_slater_4311,12.0,,35.2,'''Repellendus vitae; Ea , Laudantium tempora voluptate similique dignissimos''','''Ut ipsum voluptate: Animi nemo neque debitis blanditiis, Itaque ducimus consequatur'''
Ms Pamela Hyde,ms_hyde_7658,58.0,68.1,79.2,'''Adipisci cupiditate, Mollitia aliquid Nisi reiciendis modi facere tempora''','''(Quibusdam in explicabo) , Rerum consequatur repellendus and Totam dolor quam similique'''
Megan Payne,megan_payne_0563,44.0,20.1,56.2,'''Ipsam odio neque: Inventore, Voluptates sapiente sequi sed perspiciatis''','''Note: Deserunt molestias suscipit perspiciatis, then Libero inventore incidunt error culpa'''
Sylvia Watson,sylvia_watson_5860,43.0,78.1,88.2,'''Dolorum provident dolor nam: Voluptatibus dolores, Modi dolore voluptas''','''Aspernatur, Repudiandae eveniet magnam Doloremque totam'''
Mr Marc Webster,mr_webster_9270,56.0,45.1,34.2,'''Note: Eos labore ex aliquam, then Maxime deserunt''','''Note: Soluta quaerat, then Quasi dolores libero'''
Rita Taylor,rita_taylor_4530,75.0,2.1,28.2,'''Non; Dolorum et aspernatur , A''','''Quos; Necessitatibus assumenda cumque beatae , Unde blanditiis et'''
Dr Damien Adams,dr_adams_9455,91.0,74.1,97.2,'''Cum porro animi; Aperiam rerum , Eum consectetur molestias''','''Dolorem natus; Neque maxime commodi maiores , Nesciunt'''
Mrs Patricia Edwards,mrs_edwards_3648,23.0,72.1,85.2,'''Note: Placeat nam, then Et eos laborum dicta nobis''','''Note: Deleniti, then Nulla eaque similique hic vitae'''
Mrs Linda Briggs,mrs_briggs_1241,58.0,100.1,74.2,'''Architecto ipsum fuga maxime; Eaque velit deleniti , Non accusamus unde nobis neque''','''Id adipisci, Ipsum vel tempore Esse repellat ad provident'''
Rachael Cooke,rachael_cooke_6386,96.0,4.1,25.2,'''Assumenda impedit; Blanditiis hic minima consequatur , Enim quisquam adipisci labore similique''','''(Autem doloremque) , Magni and Animi quis adipisci'''
Karen Robertson,karen_robertson_4943,25.0,34.1,82.2,'''(Porro voluptatem facere) , Quos enim ab iste and Vitae occaecati''','''Porro explicabo facilis nulla expedita, Assumenda qui numquam cum Officia'''
Miss Fiona Perry,miss_perry_6630,77.0,27.1,48.2,'''Repellendus tempore dignissimos nobis: Doloribus, Delectus porro''','''Quam fugit: Praesentium, Ipsum accusantium cum blanditiis tempora adipisci'''
Ms Helen Gray,ms_gray_4207,96.0,17.1,47.2,'''Note: Fuga, then Voluptatibus esse harum''','''Et alias: Et adipisci consequuntur iure debitis accusantium, Molestias'''
Mr Frederick Lawson,mr_lawson_6248,73.0,24.1,34.2,'''(Vero sunt nemo sapiente quasi) , Soluta quis and Vero''','''Itaque, Eius eaque Pariatur'''
Anne Clark,anne_clark_9204,37.0,18.1,64.2,'''Note: Atque a, then Harum ducimus architecto exercitationem''','''Explicabo at architecto quidem atque corporis: Veritatis natus beatae amet, Corrupti rem eveniet saepe consequuntur voluptas'''
Mr Geoffrey Nelson,mr_nelson_2606,71.0,25.1,48.2,'''Recusandae vero officia nam quas doloribus: Repellendus quidem possimus, Et tenetur dicta corrupti''','''Cum voluptates dolor; Aperiam placeat quaerat , Libero dolore placeat'''
Darren Richards,darren_richards_9826,3.0,31.1,57.2,'''Note: Voluptates quo unde laboriosam atque corrupti, then Exercitationem consequuntur''','''(Maxime ducimus quaerat maiores) , Minima atque and Doloremque laboriosam'''
Donald Johnson,donald_johnson_7719,26.0,77.1,,'''Voluptas quidem; Facilis iste sapiente odit , Tempore''','''Laboriosam minus incidunt eligendi libero facilis; Laudantium iusto provident eveniet excepturi earum , Debitis labore ab ipsa'''
Aaron Richards,aaron_richards_9170,17.0,55.1,34.2,'''Veniam veritatis aperiam, Qui nesciunt amet aliquam placeat Ex voluptates facilis quasi''','''Fuga amet, Amet fugiat modi quibusdam eos voluptates Consequatur'''
George Hall,george_hall_5747,73.0,4.1,93.2,'''Qui aliquid cupiditate, Est Laborum quis quos''','''(Deserunt) , Qui inventore nesciunt totam and Deserunt accusantium aut nihil'''
Chloe Hewitt,chloe_hewitt_5280,64.0,12.1,30.2,'''Minima repudiandae laboriosam; Culpa consequuntur modi , Aut perferendis harum facilis tempore''','''Optio quod impedit et: Perferendis quam magni, Laudantium adipisci temporibus'''
Ms Joanna Williams,ms_williams_8188,86.0,82.1,81.2,'''Note: Et eligendi expedita, then Quidem ut corrupti''','''(Nisi accusamus occaecati excepturi tempore debitis) , Laborum exercitationem recusandae sed and Rerum fugiat'''
Mr Hugh Garner,mr_garner_3002,18.0,76.1,100.2,'''Note: Velit quo animi, then Accusantium quo voluptate maxime modi''','''Note: Deleniti rem, then Quis dolorum magni deserunt consectetur facilis'''
Phillip Robertson,phillip_robertson_4085,65.0,94.1,97.2,'''Corrupti a id ipsum: Dolor quod, Placeat quisquam''','''Quia: Ea atque facere pariatur necessitatibus, Harum minus voluptas'''
Aimee Miles,aimee_miles_4471,96.0,98.1,32.2,'''Non aliquam ipsa: Error vitae, Provident numquam ea voluptates mollitia''','''(Magnam animi) , Nulla expedita culpa and Rem'''
Dorothy Kelly,dorothy_kelly_3718,42.0,46.1,10.2,'''Perspiciatis porro; Voluptas laboriosam dignissimos , Molestias veritatis dolores''','''Note: Architecto, then Aliquid unde eos'''
Mrs Hayley Lynch,mrs_lynch_5937,98.0,64.1,98.2,'''Note: Doloribus illum corporis cum, then Unde dicta''','''Numquam eum sed fuga voluptate eligendi, Ab ullam Accusamus assumenda id'''
Gordon Dobson,gordon_dobson_6709,54.0,20.1,29.2,'''Corporis qui temporibus voluptatibus placeat; Ipsa , Eveniet eligendi ad''','''Eum: Quia voluptas quos, Voluptatum totam'''
