name,username,rating,summary,message
Rachel Smith-O'Connor,rachel_connor_6792,89.0,"""Note: Similique veniam adipisci dolorum delectus, then Libero nemo aliquam""","""Nisi explicabo: Eos quia soluta, Eum ipsa quisquam"""
Shannon Mitchell,shannon_mitchell_4807,16.0,"""Similique minus: Accusantium temporibus sed, Ad cum optio facilis nemo""","""Recusandae distinctio recusandae, At ullam voluptates saepe Nisi consectetur ut"""
Ms Christine Akhtar,ms_akhtar_4793,92.0,"""Note: Eaque blanditiis, then Reiciendis illum eaque corrupti laboriosam""","""Note: Et magni, then Voluptatibus itaque"""
Mary Patel,mary_patel_3838,29.0,"""Optio consectetur velit; Maiores saepe voluptatum molestiae et sed , Ipsum corporis""","""Note: Fuga perferendis quas eligendi aliquid, then Eveniet veniam velit"""
Olivia Vaughan,olivia_vaughan_7495,6.0,"""(Exercitationem) , Itaque tempore maiores illo minima repudiandae and Occaecati voluptas corporis quo""","""Dolores soluta eligendi harum animi, Numquam Repellendus"""
Ian Whitehead-Harris,ian_harris_8311,88.0,"""Omnis minima, Molestias Doloribus atque quos iusto tempora""","""Cum: Laborum similique, Consequatur neque accusantium officiis"""
Dr Zoe Rogers,dr_rogers_3465,7.0,"""Note: Fugiat delectus, then Molestias labore consequuntur""","""(Magni sunt) , Ipsam ea and Distinctio repellat"""
Heather Booth-Fletcher,heather_fletcher_8725,52.0,"""Natus sunt alias quam: Voluptate amet, Perferendis""","""Incidunt fuga, Animi tempora tempora sequi totam Molestias impedit"""
Gregory Woodward,gregory_woodward_9345,88.0,"""Note: Ad odio sed, then At sint in odio sapiente necessitatibus""","""Voluptas iste harum magnam, Alias Laudantium alias ratione"""
Pamela Atkinson,pamela_atkinson_3972,7.0,"""(Recusandae ipsum est tempora) , Impedit consectetur and Quo ipsa""","""Porro totam; Optio tempore et provident , Mollitia"""
Dr Lawrence Smith,dr_smith_5839,40.0,"""(Explicabo deserunt) , Aliquid aspernatur and Officiis laboriosam unde""","""(Sit ex nesciunt quo) , Odit and Similique"""
Ashleigh O'Neill,ashleigh_neill_4129,85.0,"""Commodi blanditiis aliquid ratione; In consequuntur quidem , Itaque""","""Note: Voluptatibus repudiandae at, then Officiis"""
Luke Riley,luke_riley_9161,78.0,"""(Exercitationem commodi) , Ad autem sed and Voluptates molestiae unde sint laborum""","""Incidunt cumque: Ipsa incidunt, Voluptatibus commodi maiores"""
Mr Kevin Gill,mr_gill_5460,35.0,"""(Perferendis excepturi) , Accusamus rerum alias autem and Architecto sapiente quasi at""","""Eius suscipit eaque: Labore odio voluptatibus rerum aspernatur, Voluptatem dignissimos aspernatur"""
Timothy Thomas-Hughes,timothy_hughes_5154,20.0,"""Iure tempore: Quis in, Distinctio""","""Note: Distinctio, then Asperiores neque nemo"""
Holly Spencer,holly_spencer_9621,86.0,"""Voluptatem tenetur architecto neque, Hic ipsa distinctio Temporibus""","""Recusandae porro natus magni magnam eum: Odio, Adipisci voluptate quisquam animi iste tempore"""
Mr Marcus Myers,mr_myers_6972,60.0,"""Error nostrum incidunt, Omnis nobis Consectetur aperiam adipisci""","""Odit; Animi repudiandae vel , A nulla"""
Nicola Rees,nicola_rees_8602,81.0,"""Officia eum delectus: Pariatur iste sed explicabo, Eius harum tenetur impedit natus""","""(Pariatur voluptatum tenetur quaerat possimus) , Maiores illum dolor eum and Voluptate quia delectus"""
Wayne Cunningham,wayne_cunningham_1905,16.0,"""Note: Vero vel, then Facere rem exercitationem exercitationem""","""Note: Magni deserunt, then Labore"""
Gary Hunter,gary_hunter_6803,44.0,"""Note: Molestias deleniti porro quo, then Totam quae ad""","""Note: Modi perspiciatis incidunt exercitationem dolores, then Fugiat"""
Philip Bennett,philip_bennett_8435,90.0,"""Amet qui quibusdam porro optio non; Voluptate tempora molestias , Incidunt voluptatibus impedit""","""Nulla earum: Cum nobis id eveniet, Inventore libero"""
Mathew Johnson,mathew_johnson_5999,14.0,"""Optio dicta, Nisi numquam aliquam Debitis adipisci ad nostrum maxime mollitia""","""Debitis aut tenetur vel: Autem officiis quos fugiat, Neque labore ut porro explicabo dolorum"""
Christian Oliver,christian_oliver_5191,81.0,"""(Esse vitae pariatur laborum) , Possimus perferendis minima nulla reiciendis cumque and Ab amet unde veritatis voluptatem""","""Quasi provident aliquam enim: Consequatur qui a tempora, Blanditiis esse fuga enim quasi ex"""
Pamela Cox-James,pamela_james_9620,47.0,"""(Qui omnis) , Animi expedita and Dolore harum nobis laboriosam""","""Velit alias doloribus dolores vero, Nulla Quisquam libero corporis"""
l,mr_taylor_5968,1.0,"""Ipsa fugiat dignissimos; Iste dicta voluptates amet vitae , Magnam""","""Laboriosam eligendi nesciunt, Itaque maxime omnis Minima"""
Mr Gregory Power,mr_power_7967,70.0,"""(Neque praesentium blanditiis animi occaecati) , Quasi aliquid magnam and Distinctio beatae""","""Eaque corporis placeat: Assumenda odit, Eum veniam modi"""
Julia Ali,julia_ali_1750,61.0,"""Ea rerum adipisci ex pariatur; Labore labore est ab maxime , Non""","""Minima: Provident consequatur ipsam, Veniam eius velit quam"""
Mohammed Gardner,mohammed_gardner_6732,49.0,"""Note: Laudantium tempora aliquid, then Consequatur reprehenderit quod""","""Laudantium ipsam: Vero praesentium dicta, Qui illo deleniti"""
Brett Davies,brett_davies_7883,72.0,"""Dolorum animi: Commodi perspiciatis, Dolorem""","""Non dolore ducimus, Beatae vero ab Illo corrupti"""
Gemma Parkinson,gemma_parkinson_2867,,"""Note: Odio dolorum dicta, then Aliquam architecto nam earum""","""(Tempora esse) , Cupiditate and Voluptatum non ipsam"""
Dr Jason Stone,dr_stone_5248,21.0,"""(A) , Nam ut and A odit molestiae similique deserunt eum""","""Modi pariatur similique: Modi repudiandae deleniti, Reprehenderit"""
Sam Berry-Evans,sam_evans_8786,97.0,"""Amet illum: Expedita nam odit quod, Facere odio itaque""","""Repellat corporis voluptas, Aperiam hic eligendi eum Deleniti iste voluptate"""
Mr Callum Harper,mr_harper_2615,56.0,"""Note: Doloribus quo alias dolorem, then Aliquid optio nostrum hic vitae libero""","""Note: Quae facilis, then Illum exercitationem magni nobis reprehenderit"""
Malcolm Lewis,malcolm_lewis_2123,77.0,"""Id quibusdam nostrum vero placeat, Eum unde nisi minus Dolorem nisi optio a""","""Reiciendis reiciendis at necessitatibus tenetur aliquid: Sed incidunt, Facilis illo"""
George Hodgson-Thomas,george_thomas_7364,96.0,"""In enim voluptates; Nesciunt , Aliquid""","""Nisi perspiciatis: Laborum tempore, Quia"""
