name,salary,age,remark
Mr Christian Marshall,53.0,61.1,"""(Quo molestiae) , Necessitatibus voluptatibus impedit consequatur et and Ipsum quam"""
Miss Marian Singh,65.0,81.1,"""Expedita quasi accusamus; Atque voluptatibus similique ea tempore , Reprehenderit saepe ad quos"""
Vanessa Moore,1.0,33.1,"""(Qui placeat) , Molestiae perferendis quam and Odio ab"""
Dr Martyn Ferguson,84.0,98.1,"""Minus nesciunt: Ad eligendi numquam eaque, Minima rerum"""
Miss Valerie Ellis,4.0,2.1,"""(Ducimus delectus deserunt libero) , Consequatur and Sit voluptas incidunt"""
Luke Duffy,68.0,33.1,"""(Doloremque vel magnam aperiam recusandae) , Aspernatur culpa dolor and Deserunt ipsa quos"""
Scott Hussain-Smith,54.0,33.1,"""Dolores inventore fugiat ea, Exercitationem molestiae Libero"""
Brett Mitchell,,79.1,"""Architecto quos ullam, Impedit maxime impedit Magni magnam"""
Dr Carl Bennett,73.0,85.1,"""Maiores suscipit laborum, Voluptatum repellat eaque cumque repellat Quis non delectus"""
Benjamin Fox,77.0,17.1,"""Corrupti quo vitae at, Reiciendis eum inventore Explicabo modi aliquam modi autem earum"""
Alice Hanson-Reid,21.0,44.1,"""Deleniti: Itaque unde possimus incidunt repellendus, Ut dolore quo"""
Hazel Webb,25.0,35.1,"""Vel placeat nostrum incidunt quod, Commodi adipisci fugit saepe repudiandae alias Enim adipisci"""
Mrs Jennifer Hopkins,41.0,44.1,"""Inventore voluptate: Aliquam, Modi molestiae harum"""
Dr Adam Wright,68.0,75.1,"""(At rem quo debitis) , Minima autem nihil nemo ipsum in and Quisquam reprehenderit molestias"""
Billy Payne,7.0,90.1,"""(Eligendi debitis) , Temporibus asperiores and Dolores fugit"""
Brenda Fry,27.0,37.1,"""Ullam dolorum illo, Fuga corrupti alias deleniti Iusto voluptate ex sed at quos"""
Barry Carter,75.0,70.1,"""(Molestias esse deserunt) , Assumenda modi and Voluptatem reiciendis inventore non"""
Kevin Robinson,60.0,53.1,"""(Labore pariatur illum) , Blanditiis corrupti eos sequi vel and In voluptate"""
e,50.0,70.1,"""Harum dolorem; Numquam , Atque sit"""
George Gordon,65.0,37.1,"""(Officiis) , Minima tempore quas and Hic"""
Claire Holland,74.0,36.1,"""(Dignissimos iure amet ratione sint fugiat) , Optio eaque and At minus ipsum pariatur"""
Mr Eric Davies,73.0,40.1,"""Error: Reiciendis, Accusamus"""
Kyle Ahmed-Jones,34.0,35.1,"""Note: Non cupiditate necessitatibus, then Architecto quia eaque"""
Mr Jeffrey Porter,75.0,53.1,"""Consequatur repudiandae, Porro iure accusamus consequatur Repudiandae"""
Louis Morris,32.0,69.1,"""Note: Iure voluptatem dolores aut, then At"""
Dr Melissa Walker,81.0,78.1,"""Velit repudiandae eius totam: Qui quas quia soluta doloribus possimus, Pariatur"""
Barbara George,65.0,89.1,"""Aliquid dolore pariatur: Nostrum deleniti, Impedit at eligendi"""
Joanna Richardson,66.0,6.1,"""Unde nihil perspiciatis placeat laudantium odit: Ratione nostrum voluptates, Quasi placeat alias iste"""
Rosie Holmes,51.0,5.1,"""Accusamus illum; Laboriosam quam a , Blanditiis harum"""
Mark Singh,7.0,47.1,"""Note: Hic quis laborum, then Facilis nemo"""
Mrs Elizabeth O'Neill,41.0,26.1,"""Quibusdam dolorem inventore sequi; Ea , Amet odio fugiat laudantium similique ipsa"""
Russell Green-Porter,32.0,68.1,"""Expedita debitis: Doloribus quidem recusandae iste, Dolores voluptate ullam modi minus"""
Dr Russell Elliott,40.0,84.1,"""Odit ab, Veritatis et Minima quia autem ipsam"""
Amelia Willis,62.0,96.1,"""Ducimus deleniti: Corporis accusantium, Aperiam illo fugiat"""
Mrs Annette Smith,38.0,39.1,"""Explicabo quasi; In quis repellendus ipsam , Facilis"""
Kerry Smith,4.0,25.1,"""Note: Omnis odio rerum modi, then Ullam eius ea"""
Clive Roberts,59.0,66.1,"""Note: Recusandae optio, then Odio corrupti ut"""
Mr Robin Walsh,26.0,62.1,"""(Ipsam officiis expedita ducimus accusantium) , Dolore totam unde and Ducimus quidem"""
Kathleen Gibbons,2.0,96.1,"""Reprehenderit ducimus magnam facere architecto, Adipisci aliquid vero ex aliquid quos Saepe nemo saepe cupiditate"""
Dr Louise Smith,90.0,41.1,"""Facere: Veritatis quaerat dolorum animi, Veniam repellendus"""
Mr Geoffrey Pearce,95.0,62.1,"""Enim ab, Rem quo voluptate architecto Vel labore officiis quia"""
Mr Gerald Savage,85.0,84.1,"""Natus omnis totam suscipit eaque, Optio dolore recusandae veritatis doloremque Cumque"""
Mr Justin King,16.0,83.1,"""Soluta cum iusto nesciunt, Nihil sint hic Porro incidunt"""
Adam Wyatt-Webb,49.0,45.1,"""Repellendus asperiores, Doloremque rem Amet quibusdam minus eius"""
Marian Owen-Mitchell,63.0,39.1,"""Note: Modi commodi aspernatur neque excepturi, then Maxime doloremque consequatur voluptas"""
Geraldine Berry,58.0,79.1,"""Velit: Reiciendis porro enim earum, Culpa aspernatur necessitatibus blanditiis pariatur nulla"""
Mr Oliver Gilbert,50.0,,"""At autem adipisci a quo expedita, Adipisci quasi aperiam provident Quisquam provident"""
