name;salary;rating;description;summary
Bernard Harris-Perry;49.0;91.1;"""Note: Qui debitis; then Eaque labore ipsam labore quo""";"""Note: Atque cumque; then Sint nihil voluptatem pariatur ducimus"""
Lauren Holland-Johnson;72.0;43.1;"""Aspernatur voluptas provident voluptas; Quas delectus quidem corrupti enim Atque quia velit atque impedit""";"""Excepturi odit sequi; Ut Magni nostrum maiores aperiam"""
Mrs Sian Richardson;;14.1;"""(Delectus maiores soluta) ; Officiis laboriosam minus illo numquam and Sunt labore consectetur""";"""Note: Alias corporis similique; then Quaerat aspernatur occaecati"""
Miss Jodie Fox;90.0;26.1;"""Esse sed vero; Libero ; Maxime facere""";"""Note: In neque; then Cupiditate"""
Darren Phillips;28.0;21.1;"""Nam occaecati asperiores: Et aut explicabo mollitia; Omnis praesentium illum""";"""Inventore voluptate voluptas; Harum quam Facilis perspiciatis error reiciendis"""
Henry Ford;69.0;76.1;"""(Necessitatibus neque aperiam dolore minus) ; Autem and Maiores""";"""(Autem dignissimos earum excepturi) ; Libero veniam necessitatibus and Ipsa"""
Dr Mitchell Roberts;52.0;51.1;"""Impedit praesentium odio: Repudiandae laborum ratione ab; Laborum laboriosam consequatur impedit sint""";"""Note: Alias nostrum; then Quaerat eius quibusdam sapiente blanditiis"""
Miss Clare Bennett;84.0;66.1;"""Architecto nam ab saepe: Nesciunt soluta; Quidem libero consequatur quo""";"""Note: Quam voluptatem voluptates; then Voluptatem"""
Mrs Kayleigh Hall;7.0;69.1;"""(Magnam) ; Aliquam cum and Repellat""";"""Minima tempora quidem: Omnis deserunt veniam; Omnis consequuntur fugiat ducimus"""
Iain Green;11.0;26.1;"""(Natus) ; Voluptas corrupti and Quasi cum""";"""Dolore accusamus reiciendis eaque repellendus; Suscipit excepturi Eligendi unde"""
Leon Willis;10.0;80.1;"""Note: Minus omnis; then Facere quae""";"""Ab asperiores; Porro fuga ; Ab"""
Wendy Watson;53.0;2.1;"""Nemo; Officia animi beatae id eius unde Ab incidunt""";"""Note: Voluptates commodi adipisci; then Explicabo temporibus eius"""
Mr Brian Chamberlain;58.0;19.1;"""Magni modi quod magni; Consectetur odio commodi Voluptatem quod eos""";"""Molestias rem reprehenderit dolores tempora accusantium: Aliquid totam dignissimos; Magni earum"""
Clive Pritchard;56.0;76.1;"""Note: Nisi rem; then Tempore aspernatur""";"""Note: Eos aliquam nihil eaque recusandae perferendis; then Repellat asperiores sapiente est praesentium ipsam"""
Nigel Khan;73.0;61.1;"""Architecto ea non tempora ut; Repellat aliquam ; Eos sed odio""";"""Debitis recusandae; Perferendis expedita voluptatum excepturi sunt ; Sapiente eveniet praesentium tempore a"""
Guy Dickinson;14.0;9.1;"""Nam magni ut nisi; Nostrum ducimus nihil ; Placeat labore quibusdam""";"""(Molestiae incidunt error labore) ; Voluptas nisi magni and Cum laborum saepe"""
Chloe Shaw;42.0;18.1;"""(Ad voluptates) ; Quia neque ipsa animi beatae and Aperiam accusantium""";"""Numquam iure; At ; Rem explicabo saepe"""
Alice Walsh;99.0;;"""Explicabo quasi: Distinctio recusandae eveniet dolorum quam; Pariatur accusantium""";"""Voluptates aut odit; Voluptates suscipit illum blanditiis ; Dignissimos"""
Miss Valerie James;54.0;80.1;"""Numquam cum: Vitae; Temporibus""";"""Ducimus dolor velit: Hic odio totam quae perspiciatis; Tempore qui"""
Dawn Smith;95.0;93.1;"""Note: Distinctio nostrum beatae suscipit aut; then Doloremque expedita""";"""Quasi deserunt dolore: Quaerat; Eos eligendi quibusdam inventore sequi"""
Mr Danny Page;70.0;81.1;"""Et: Sit itaque; Qui commodi""";"""Iure culpa soluta sequi; Maxime ; Ullam ratione"""
Mr Aaron Elliott;13.0;2.1;"""(Autem harum praesentium quos optio) ; Alias eligendi quam and Explicabo rem asperiores nulla""";"""Note: Magni quidem; then Necessitatibus perferendis doloremque"""
Sharon Morgan;36.0;74.1;"""Autem aut; Quia cumque ; Deserunt eaque hic exercitationem ea repudiandae""";"""(Delectus non provident nesciunt similique ullam) ; Voluptates reiciendis hic and Voluptate eius delectus"""
Frederick Miller;5.0;24.1;"""Repellat sit; Rem a dolores ; Cumque sint""";"""Dicta; Quos animi eos Dolore corrupti"""
Francesca Webster;30.0;29.1;"""(Reiciendis corporis illo) ; Nesciunt illo and Explicabo""";"""(Deleniti) ; Voluptates distinctio explicabo repellendus quos and Veniam dignissimos similique provident"""
Christian Morrison;76.0;32.1;"""Note: Inventore voluptas ipsa iure; then Neque""";"""At mollitia sit: In; Expedita sequi"""
Dr David Lees;77.0;87.1;"""Unde perferendis; Doloribus sapiente delectus similique totam ; Optio in nesciunt esse""";"""Note: Voluptatibus explicabo nemo aliquam voluptates illo; then Maiores aliquam adipisci temporibus autem"""
Miss Carly Ali;78.0;55.1;"""Note: Maiores ea provident; then Corrupti eum molestiae""";"""Excepturi repudiandae; Molestias ; Nulla"""
Alison Foster;98.0;47.1;"""(Expedita modi) ; Impedit aperiam and Rerum""";"""Voluptatem debitis perspiciatis; Omnis recusandae dicta esse ; Mollitia"""
Miss Dorothy Connor;31.0;3.1;"""(Molestiae omnis) ; Odit a nihil and Consequuntur accusantium vel""";"""Architecto; Perspiciatis asperiores Possimus facere"""
Joyce Cooke;30.0;37.1;"""(Impedit et aspernatur) ; Consequatur omnis and Beatae a eveniet""";"""(Nulla reprehenderit) ; Atque cupiditate molestias and Fugit natus"""
Dale Hicks;71.0;45.1;"""Deserunt vel tenetur; Tenetur id temporibus Repellendus""";"""Minus molestias vero odit tenetur tempore: Fugiat sequi; Est tenetur expedita fugit"""
Miss Abigail Hughes;46.0;63.1;"""Note: Autem sunt nam magni; then Sunt molestiae quasi""";"""Laborum; Provident repellendus beatae dignissimos Maiores similique aspernatur"""
Mr Graham Bray;97.0;55.1;"""(Cumque suscipit aperiam) ; Minus mollitia at accusamus and Nesciunt velit quod velit minus eos""";"""Fugit ullam; Doloremque ab ducimus sequi hic Itaque aperiam"""
Emma Lawrence;93.0;78.1;"""Animi non possimus velit: Repellat occaecati vel voluptatum libero; Corporis esse corporis perferendis""";"""Voluptatum sunt tenetur natus; Suscipit nostrum ea nobis ; Illum laudantium sequi"""
Frances Young-Davies;4.0;47.1;"""(Ipsa earum) ; Soluta molestias architecto suscipit and Facilis""";"""Note: Ea quisquam; then Quia omnis molestiae minus"""
Ashleigh Clark-Richardson;29.0;22.1;"""Ullam modi itaque; Laborum iusto minus ; Nobis quia""";"""Provident sed dolorum: Ad aliquid repellendus sint; Sit architecto illo cum"""
o;79.0;27.1;"""Architecto laudantium; Ea voluptates perferendis ; Non maiores""";"""Note: Officia cupiditate quaerat; then Ab ea"""
Mohammad Mitchell;24.0;76.1;"""(Nulla esse ad) ; Sed beatae alias libero praesentium and Magnam""";"""Note: Quo a; then Porro id"""
Abbie Taylor;3.0;41.1;"""In quidem dignissimos ut: Alias ipsam harum ipsum veritatis; Libero eius""";"""(Repudiandae minima illum quod sapiente recusandae) ; Facere ad ipsum vero and Libero occaecati"""
Mr Rhys Sharp;83.0;9.1;"""Temporibus tempore dolores; Architecto minus ; Sed libero voluptatum minus""";"""Dolorem consequatur culpa autem debitis labore; Ducimus voluptas voluptatum accusantium maxime Veritatis perspiciatis"""
