name,age,salary,price,remark
Tony Baker,64.0,64.1,97.2,'''Note: Natus pariatur, then Corporis fugiat hic alias'''
Marie Booth,89.0,82.1,54.2,'''Nostrum cumque mollitia illum, Harum dolore Veniam est maiores totam fuga placeat doloremque'''
Miss Katy Johnson,30.0,21.1,4.2,'''Note: Omnis nulla dolore, then Eos'''
Mr Matthew Gardiner,86.0,47.1,77.2,'''Rem recusandae explicabo; Dicta pariatur , Soluta quo debitis vitae'''
Christian Powell-Miller,79.0,40.1,89.2,'''(Modi) , Cupiditate and Id ex'''
Sandra Baker,88.0,90.1,25.2,'''Note: Vel architecto laborum reprehenderit earum, then Facilis dolorem eius sit'''
Mr Mitchell Jackson,46.0,93.1,91.2,'''Note: Nam numquam dolorem recusandae harum, then Voluptate distinctio'''
Rachel Bryan,,13.1,9.2,'''Adipisci dolor: Magni, Aut odit quia eius'''
Charles Armstrong,89.0,32.1,3.2,'''Minima iste cupiditate, Ipsam eos dolorum Veritatis dicta reprehenderit corrupti rerum'''
Natasha Collins-Smith,4.0,26.1,54.2,'''Modi; Sed suscipit cumque praesentium natus , Est ratione'''
Eric Iqbal,25.0,41.1,97.2,'''(Nesciunt vero) , Est perspiciatis ipsa eos and Iusto amet quidem enim'''
Bethan Shah,40.0,44.1,44.2,'''(Fugiat accusamus ipsam est blanditiis) , Voluptates and Ullam quae eum voluptas enim dolor'''
Mrs Pauline Mason,22.0,21.1,40.2,'''Iste ad aliquam corrupti enim: Quod quas nulla aut fuga ratione, Quo tempore'''
Russell Clarke,3.0,21.1,25.2,'''Omnis ducimus, Excepturi odit ab Consequuntur illum maxime earum dolor'''
Frances Jones,18.0,31.1,71.2,'''Debitis cumque sit iure; Tempora , Commodi alias velit minima soluta'''
Anthony Dale,31.0,2.1,93.2,'''Note: Est earum rerum, then Reprehenderit illo'''
Lorraine Ingram,22.0,25.1,14.2,'''Repellendus ab error: Accusantium doloremque dolores a, Ducimus accusamus dolorem quo'''
Emily Williamson-Miller,32.0,7.1,8.2,'''Note: Repudiandae deleniti suscipit laboriosam, then Accusamus dignissimos'''
Lee Farmer,67.0,36.1,47.2,'''(Corrupti corrupti) , Excepturi nobis and Consequuntur minima veniam'''
Joanne Wood,31.0,83.1,27.2,'''Quisquam tenetur: Possimus facilis dolor neque, Repellendus quisquam assumenda beatae maxime'''
Brett Watson,22.0,99.1,10.2,'''Note: Numquam ducimus, then Provident'''
Vanessa White,71.0,38.1,45.2,'''Eligendi, At harum modi Nostrum temporibus'''
Martin Wright,98.0,33.1,55.2,'''Eligendi, Laboriosam dolore natus asperiores labore cupiditate Soluta tempore'''
Mrs Alice Skinner,61.0,71.1,9.2,'''Dicta perspiciatis perspiciatis; Consectetur quam , Quis id quis dolores'''
Sophie Peacock,19.0,94.1,39.2,'''(Est molestiae alias praesentium laudantium) , Facilis at molestias laudantium aliquam harum accusantium and Commodi expedita'''
Dr Vincent Sutton,36.0,17.1,42.2,'''Dicta corporis autem, Voluptatem ducimus asperiores Placeat explicabo temporibus'''
Dr Melissa Robertson,29.0,3.1,15.2,'''Iusto eligendi iusto amet vero esse: Aliquid suscipit inventore sapiente, Iure at'''
Megan Lane,45.0,41.1,6.2,'''(Sint impedit fugiat) , Praesentium in eligendi and Quas doloremque quisquam perferendis aliquid dolorum'''
Mr David Hammond,37.0,92.1,,'''Note: Commodi reprehenderit, then Repellendus cum itaque veniam'''
Russell Newman-Dickinson,69.0,73.1,64.2,'''Expedita cumque laudantium, Expedita voluptate similique adipisci quidem Quod'''
Ashleigh Lee,3.0,97.1,88.2,'''Perspiciatis nisi dolorem, Corporis iste Dolores a labore omnis facilis et'''
Dr Geoffrey Wallis,47.0,7.1,1.2,'''Quo minima dicta occaecati; Illo amet alias , Soluta assumenda quidem cupiditate nesciunt'''
Jay Clarke,78.0,78.1,39.2,'''Modi, Distinctio deleniti nam eum Delectus pariatur quod assumenda'''
Miss Beverley Green,8.0,13.1,21.2,'''Vel quia ea, Facilis consequuntur quaerat Delectus'''
Alan Stevens,91.0,47.1,10.2,'''Tempore officiis ut, Laudantium quisquam mollitia ex nihil Autem rem'''
Louis Moss,77.0,95.1,24.2,'''(Explicabo aspernatur impedit) , Modi qui sunt and Sequi dolorem nihil architecto quos rerum'''
Wayne Gardner,64.0,100.1,43.2,'''Aperiam dolorem: Facere, Ratione beatae'''
Jenna Cross,77.0,73.1,85.2,'''(Dolores) , Quasi and Quisquam illum'''
Kevin Heath,71.0,84.1,70.2,'''Note: Ratione laboriosam recusandae ipsam molestiae dolorum, then Facere'''
e,45.0,,44.2,'''Necessitatibus molestias laboriosam cum asperiores: Accusamus saepe impedit, Totam expedita'''
Derek Jones,7.0,100.1,64.2,'''Autem nostrum vero exercitationem, Officia id Accusamus unde culpa reiciendis'''
Louis Skinner-Hale,11.0,90.1,98.2,'''Perferendis excepturi odio nihil doloremque, Enim molestiae quam fuga Doloremque vero minus'''
