name,username,salary,total_count,description
Terence Ali,terence_ali_0151,60.0,69.1,'''Provident nulla; Corrupti soluta adipisci voluptate ipsum quidem , Repellendus'''
Stacey Hancock,stacey_hancock_2146,74.0,99.1,'''Fugiat voluptates, Optio Consequuntur explicabo ex aut'''
Hayley Murphy,hayley_murphy_8767,71.0,62.1,'''Deleniti: Qui maxime esse harum ab adipisci, Quisquam aperiam repudiandae'''
Stephanie Phillips,stephanie_phillips_4611,92.0,86.1,'''Odio dolores: Corporis quidem magnam esse, Quis distinctio ratione accusamus'''
Denis Baker-Mistry,denis_mistry_1318,47.0,39.1,'''Temporibus saepe pariatur, Esse error minima qui laudantium Dolor consequuntur minima'''
Heather Allen,heather_allen_8689,34.0,76.1,'''Aliquam: Eveniet, Praesentium minus'''
Karl Skinner,karl_skinner_4320,,27.1,'''Suscipit cupiditate, Quas harum Repellendus inventore'''
Ms Jacqueline Pope,ms_pope_9701,3.0,78.1,'''Tempora numquam: Occaecati ullam totam, Architecto nam consequatur pariatur'''
Donald Reid,donald_reid_9343,38.0,89.1,'''Ut tenetur, Quos rerum enim Esse quos'''
Zoe Long,zoe_long_6856,54.0,50.1,'''Repudiandae mollitia voluptas; Temporibus , Neque minima tempore sequi'''
Chelsea Wells,chelsea_wells_2810,85.0,55.1,'''Note: Iusto assumenda deserunt, then Quia nemo'''
Douglas Booth,douglas_booth_5214,71.0,37.1,'''Note: Nesciunt laborum delectus saepe similique qui laudantium, then Impedit quidem'''
Mr Conor Anderson,mr_anderson_6986,82.0,37.1,'''(Harum hic) , Delectus ullam and Vel'''
x,brenda_boyle_8486,68.0,33.1,'''Voluptates dolore: Sapiente unde nobis, Sequi ad totam'''
Melissa Bryan,melissa_bryan_1978,47.0,12.1,'''Veniam esse nostrum fugit; Eveniet , Laborum porro'''
Leslie Harris,leslie_harris_3189,19.0,4.1,'''Note: Doloremque saepe, then Itaque consectetur ipsa'''
Dr Helen Cooke,dr_cooke_3376,14.0,29.1,'''Vero est laboriosam illo; Consectetur eos , Exercitationem amet id officia eos'''
Wendy Faulkner,wendy_faulkner_0310,97.0,37.1,'''Note: Quo necessitatibus, then Amet vel rem'''
Hugh Davies,hugh_davies_7307,89.0,94.1,'''Placeat minima aperiam fuga perferendis molestiae; Vel minima quo , Soluta'''
Donna Briggs,donna_briggs_7314,6.0,,'''Similique expedita, Ad Cum rerum quam voluptas accusamus'''
Barry Nicholson,barry_nicholson_5118,17.0,15.1,'''Note: Molestias quasi maiores minus rem, then Minima odit aperiam'''
Andrew Williams,andrew_williams_5751,80.0,19.1,'''Illo: Ducimus in, Aliquid dignissimos itaque ipsa'''
Nathan Howells-Murphy,nathan_murphy_3090,38.0,74.1,'''(Dicta corporis totam laboriosam dolorum) , Libero tempore and Laborum sit'''
'Dr Callum O''Connor',dr_connor_7052,38.0,60.1,'''Note: Quibusdam eum hic sint deserunt, then Iusto ea itaque magni minus fuga'''
Bethan Smith,bethan_smith_1222,12.0,88.1,'''In consectetur quod, Architecto exercitationem vel earum Repellat consequuntur'''
Ms Tina Morris,ms_morris_7401,83.0,51.1,'''Aut eius dicta iure, Sunt voluptatem labore necessitatibus fugiat Sunt quam'''
