name,username,total_count,price,review,message
Jesse Murray,jesse_murray_8904,27.0,86.1,'''Note: Listen task interest condition pretty before, then Manager property day perhaps author buy''','''Marriage alone: Move everybody race, Behavior author lay'''
Erika Stanton,erika_stanton_5088,18.0,37.1,'''Attention foot option improve international, Fill Improve single strategy move employee''','''Note: Their land manager, then Measure happen'''
Cynthia Whitehead,cynthia_whitehead_1822,35.0,96.1,'''(Worker staff country) , Appear debate and Cultural''','''Civil course, Family national Deal fine'''
Shawn Allen,shawn_allen_4237,31.0,71.1,'''(Follow source everything) , Interest ten provide service year and Night''','''Note: General moment still, then Manager'''
Samantha James,samantha_james_8578,82.0,18.1,'''Remain yeah ready; Thus , Natural full recent happy become her''','''Energy player its development quality: Line raise age most, While'''
Terri Pham,terri_pham_0476,61.0,32.1,'''(Responsibility catch) , Policy create five and Rather animal people question thought''','''Exactly issue: Street customer minute magazine government, Claim perhaps explain store'''
James Pratt,james_pratt_2233,98.0,48.1,'''Hair left: Sound raise, Year including culture serve''','''Attention development author; Cup rule choose , Kind guy term meet cause'''
Michael Mason,michael_mason_1467,46.0,98.1,'''Note: Break, then Stop husband ahead''','''Note: Lot recent, then Return hard add election miss'''
Nathan Taylor,nathan_taylor_0719,13.0,8.1,'''Evidence plant, Pick campaign green section Month paper''','''Month up role; Lose mission Mrs , My'''
Gabriela Johnson,gabriela_johnson_9091,80.0,41.1,'''Sure conference civil buy; Goal production raise , Successful describe away''','''College turn group: Person goal form word dog, Itself hope'''
D,gabriel_knight_5443,26.0,31.1,'''Those father wrong; Foreign , Point another stuff''','''(Word) , Off physical wife and Interest effort focus remember'''
Robert Brown,robert_brown_3432,97.0,75.1,'''Role scene, Cell particularly Development society painting''','''Note: Call marriage enough, then Strategy war'''
Ann Nguyen,ann_nguyen_1647,83.0,20.1,'''Economic relationship light; Consider drop , From much''','''Than major anything staff, As whom realize Cover somebody skin vote media'''
Jose Joyce,jose_joyce_3870,1.0,23.1,'''West technology; Wear shoulder , Establish''','''Example large step; Evening , Where effort eye officer animal'''
Eric Hill,eric_hill_3735,18.0,28.1,'''Note: For finish responsibility responsibility, then Form low near''','''Note: Everyone college student condition, then Natural meet'''
Crystal Dodson,crystal_dodson_8000,70.0,83.1,'''Note: Conference, then Bring''','''Herself need other process water career: Congress, Wrong west series'''
Jacob Acevedo,jacob_acevedo_1158,52.0,52.1,'''We: Strong record yeah physical shoulder, First western star heart so''','''Other line, Area wonder Write'''
Kathryn Fernandez,kathryn_fernandez_0093,35.0,39.1,'''Cut establish, Senior career Community culture grow upon among''','''Note: Style information, then Positive especially yard statement southern'''
Lisa Chang,lisa_chang_0523,18.0,80.1,'''More organization some: Agreement series song, Produce market which''','''Note: Piece your at high man, then Speech part'''
Victor Collins,victor_collins_6512,82.0,59.1,'''(Eight true according) , Ago side go fund and A agree''','''Notice thought their: Agent summer certain, Figure rule during wall rather'''
Michael Alexander,michael_alexander_5249,63.0,73.1,'''(Decade public) , Machine and Parent baby''','''Very; Until , Apply ever fine'''
Angel Flores,angel_flores_9024,27.0,12.1,'''Its design perform suddenly community standard, Message its until Decision purpose best movie usually''','''If budget, Side generation Themselves listen strong'''
Linda Brooks,linda_brooks_7657,90.0,61.1,'''(Explain nor skin) , Try factor high team and Music''','''Past so American rock: Officer Mrs else, Simply always really soon attack direction'''
Crystal Peterson,crystal_peterson_0650,,7.1,'''Note: Opportunity first, then Certain force state list''','''Response modern point business among purpose, Garden mention major attack clearly Machine grow question ball'''
Richard Brooks,richard_brooks_1181,44.0,18.1,'''(Safe design) , Really and Fish happen forward necessary''','''Give thought: People wait of, Evidence be when'''
Colleen Smith,colleen_smith_9594,62.0,38.1,'''(Lead be) , Live somebody and Company join where act''','''Own across edge worker, Seek rather stock Speech rule physical imagine language'''
Matthew Goodman,matthew_goodman_4010,69.0,18.1,'''Authority goal performance common; Country , Particular marriage sort''','''Blue allow necessary; Also some phone , Quite history'''
Abigail English MD,abigail_md_1865,23.0,40.1,'''Respond behind east, Meeting issue happen Road care surface''','''Business successful heavy such process, Song subject chance effort character road Few station'''
Emily English,emily_english_1332,28.0,41.1,'''Note: Soon whatever its remain, then After language''','''(Agency) , Describe risk country and From line call'''
Brian Mercado,brian_mercado_8822,87.0,62.1,'''Argue hear modern politics, Than analysis size Course her''','''Cell summer, Quickly sometimes prepare To national'''
Laura Lutz,laura_lutz_9342,3.0,21.1,'''North find: Trade style, Third treat recognize about''','''Right left nature threat; Generation stuff , Purpose themselves fight situation'''
Ashley Allen,ashley_allen_3364,8.0,34.1,'''By result; Simple indeed record , Let back face third''','''Indicate off live, Until city Article'''
Gerald Hernandez,gerald_hernandez_5274,45.0,,'''(Response the) , Body run hard force country and Hour win think in as''','''(Air learn) , Single meeting forget race and Seem federal'''
Michael Marshall,michael_marshall_4982,61.0,34.1,'''Service: Admit meeting through marriage without, Another after lose most''','''(Late its window despite subject school) , Red expect and Season stand international'''
Deborah Williams,deborah_williams_3743,40.0,52.1,'''(Employee see) , Place yet partner and Win lose pay or''','''(Hard man lose ahead scene) , Marriage increase and Radio force'''
David Pope,david_pope_2568,59.0,55.1,'''Know improve seem stay, Artist crime white Will perhaps art detail read save''','''Ball by owner write, Almost fund Not that economy concern'''
Vanessa Ingram,vanessa_ingram_4084,15.0,98.1,'''Once expect threat: Parent special add, Hard resource receive nation''','''(Win rest coach) , Affect quite president and Business'''
David Reese,david_reese_0310,62.0,72.1,'''For data, Should concern Generation once class myself''','''Various better people: Sell nice care them vote, Able report improve stand doctor expert'''
Stephen Mcknight,stephen_mcknight_1721,25.0,11.1,'''Board establish, Heart tree natural wait poor Current particular drop''','''Write eye: Bring you friend, Set'''
Laurie Davis,laurie_davis_3889,19.0,2.1,'''(Food walk ahead) , From computer kitchen and Less government''','''Production conference fish fight fill nor; Including able strong , Whom woman theory miss'''
Michelle Kennedy,michelle_kennedy_8113,33.0,24.1,'''Note: Effect record, then Hair''','''(Not voice than) , After window say and That activity great'''
Jose Parker,jose_parker_6155,69.0,15.1,'''Thank blue own example word knowledge; Price finish hand , Story''','''Ahead: Paper pressure family, Red'''
Ruth Dillon,ruth_dillon_7341,62.0,13.1,'''Hundred, Number pick Mission''','''Measure gas gun different; Film right cold establish , Beyond'''
