name,username,age,salary,message
o,ms_kemp_7294,97.0,40.1,'''Deleniti vel; Consequatur doloribus ratione , Sit alias'''
Sian Parker-Fletcher,sian_fletcher_5358,73.0,96.1,'''(Minima mollitia) , In a ipsam and In laboriosam vero'''
Dr Richard Berry,dr_berry_3388,16.0,2.1,'''Animi corrupti libero dolores veniam; Omnis eum architecto temporibus , Dolore'''
Ms Tracy Begum,ms_begum_2191,73.0,48.1,'''Debitis esse fugit; Reprehenderit magni architecto , Ex provident voluptatem esse'''
Dr Jamie Lee,dr_lee_0935,63.0,1.1,'''Note: Possimus iure vel, then Asperiores'''
Raymond Carpenter,raymond_carpenter_9224,8.0,85.1,'''(Dolores rem) , Itaque maiores and Nisi doloribus'''
'Christopher Garner-O''Brien',christopher_brien_7461,87.0,79.1,'''Minima nobis sint; Alias recusandae , Laborum quae'''
Victoria Vincent,victoria_vincent_0057,57.0,26.1,'''Facilis debitis dolores odio repellendus, Delectus adipisci deleniti Ipsam distinctio'''
Katy Holden,katy_holden_1593,70.0,74.1,'''Accusamus ab nulla qui, Optio suscipit Quos porro voluptatibus accusantium'''
Kate Watson,kate_watson_4392,22.0,38.1,'''Magnam eius: Hic perspiciatis, Nulla earum quis distinctio'''
Darren Barnes,darren_barnes_1120,40.0,63.1,'''Cum possimus; Voluptatem minus temporibus , A assumenda'''
Peter Newton,peter_newton_7501,23.0,63.1,'''Note: Eaque, then Praesentium doloremque tempora earum'''
Sally Shepherd,sally_shepherd_3236,19.0,54.1,'''Repellendus impedit quasi impedit: Magni, Illo vel eum cum'''
Douglas Briggs,douglas_briggs_0772,95.0,31.1,'''Note: Error quisquam possimus dignissimos ea, then Sequi odio dignissimos dolore'''
Mr Anthony Walsh,mr_walsh_0551,74.0,82.1,'''Deserunt sint sapiente; Ea harum rerum totam , Quos eius fuga at'''
Mrs Jennifer Wood,mrs_wood_9056,46.0,83.1,'''Vel: Soluta sint corrupti, Ipsum velit facilis dolorum'''
Denise Hutchinson,denise_hutchinson_1147,60.0,,'''(Excepturi eius) , Vel esse autem and Inventore pariatur culpa delectus'''
Hugh Bishop,hugh_bishop_2873,48.0,23.1,'''Ex placeat; Vel ullam , Aliquid veniam'''
Dr Norman Fuller,dr_fuller_4961,,17.1,'''(Ab dignissimos velit iusto id voluptas) , Ea eius eos cum rem and Veniam'''
Mrs Debra Thomson,mrs_thomson_7322,18.0,54.1,'''Fuga quidem eaque neque: Nesciunt recusandae nobis, Magnam architecto officiis'''
Anthony Webster,anthony_webster_1201,54.0,42.1,'''(Rem quidem placeat dolor) , Et eum vero and Mollitia modi'''
Shaun Cook,shaun_cook_8947,77.0,46.1,'''(Voluptatum odio reprehenderit tenetur) , Vel and Eligendi inventore vitae ullam labore'''
Dr Linda Sutton,dr_sutton_4466,6.0,56.1,'''Vitae provident at: Exercitationem doloribus repellat, Accusamus sunt nostrum ratione'''
