name	username	total_count	age	note	comment
Clare Cooper	clare_cooper_0680	16.0	61.1	"""Note: Eveniet eaque	 then Reprehenderit nulla perferendis dolor"""	"""Inventore repellat et; Et 	 Rerum"""
Dr Claire Howells	dr_howells_9145	33.0	75.1	"""Maxime beatae quasi: Cupiditate	 Inventore tenetur neque dolore voluptates"""	"""(Mollitia molestias excepturi consequuntur) 	 Iusto and Ipsum commodi ex error veritatis mollitia"""
Dr Marie Boyle	dr_boyle_0354	43.0	90.1	"""(Dolores sequi iusto quod) 	 Et officiis sequi dolores praesentium voluptate and Itaque tempora molestias"""	"""Note: Sapiente sit molestiae in eos	 then Quo quidem eum"""
Ms Rachael Wade	ms_wade_9724	38.0	41.1	"""Dolorem soluta dolores	 Et Eaque aut consectetur"""	"""Perspiciatis assumenda magni culpa; Nulla reiciendis 	 Iste possimus maxime ipsa quam"""
Linda Skinner	linda_skinner_0189	66.0	78.1	"""Note: Ad eius soluta iusto provident voluptates	 then Aut impedit a in"""	"""Atque	 Voluptate Itaque iste"""
Martyn Shaw	martyn_shaw_1274	38.0	84.1	"""Quia	 Cumque Nulla ullam porro ex"""	"""(Modi est porro) 	 Praesentium magnam and Autem ullam"""
Mrs Carolyn Wilson	mrs_wilson_0841	28.0		"""Note: Pariatur ipsum laborum vitae fugiat	 then Nobis ipsam repellendus"""	"""(Id ipsum illum optio) 	 Doloribus molestiae and Incidunt deserunt placeat"""
John Dunn	john_dunn_6771	16.0	47.1	"""Maiores ratione nemo at impedit; Tempore qui eaque officiis dicta 	 Sequi"""	"""Consectetur repellat adipisci voluptates laborum: Asperiores magni assumenda	 Impedit odio amet"""
Clare Andrews-Stewart	clare_stewart_1660	7.0	59.1	"""Consectetur officiis: Quisquam maiores	 Tempore voluptatum"""	"""Natus totam perspiciatis voluptate nostrum; Porro libero nesciunt 	 Amet"""
Rachel Ward	rachel_ward_7176	19.0	56.1	"""Ex	 Corrupti neque sequi consequatur Praesentium magni"""	"""Laudantium sequi; Ullam illo 	 Nihil"""
Mark Clark	mark_clark_8295	16.0	55.1	"""(Perferendis laudantium nihil) 	 Vero and Ullam fuga ipsa molestias"""	"""Note: At sunt totam assumenda doloribus rem	 then Maiores rem nulla"""
Iain Gill	iain_gill_9933	99.0	12.1	"""Note: Mollitia numquam beatae	 then Veritatis"""	"""Necessitatibus magni: Aliquid modi	 Similique veniam voluptates"""
Miss Christine Akhtar	miss_akhtar_0010	89.0	75.1	"""(Eum repellendus minima soluta veniam) 	 Accusantium totam sequi nemo doloremque and Itaque ex similique"""	"""Tenetur quasi laborum	 Culpa harum Nobis voluptates reprehenderit dolor"""
Denise Pugh	denise_pugh_2482	68.0	24.1	"""Vitae cupiditate reprehenderit; Optio 	 Repudiandae"""	"""Note: Magni dicta	 then Deleniti earum temporibus impedit"""
Geraldine North	geraldine_north_6946	18.0	17.1	"""Note: Quod	 then Quod minima animi"""	"""Iste itaque non; In consequuntur 	 Odit modi"""
Tracy Pearce-Palmer	tracy_palmer_5822	77.0	33.1	"""Quas earum at; Maiores sunt neque 	 Nisi vitae labore"""	"""Animi quidem debitis ullam: Atque quasi	 Nihil debitis praesentium a quo voluptas"""
Mr John Webster	mr_webster_8072	91.0	67.1	"""Quos iusto esse	 Sequi Magnam illum recusandae"""	"""Magni: Aut labore aliquam perferendis tenetur	 Itaque sunt sequi"""
Dr Kenneth Hill	dr_hill_4599		9.1	"""(Maiores deleniti) 	 Natus a and Praesentium hic"""	"""Quo itaque autem amet iste excepturi: Facere a quod	 Nesciunt"""
Mr Derek Davis	mr_davis_3896	92.0	5.1	"""Eaque assumenda; Illum illo explicabo quis 	 Quos recusandae"""	"""(Ratione nihil vitae) 	 Distinctio adipisci laborum totam and Eveniet nihil neque labore"""
Josh Dawson	josh_dawson_0565	59.0	3.1	"""(Possimus natus voluptas) 	 Amet in inventore magnam harum cum and Dolor occaecati qui"""	"""Veritatis nam debitis: Veniam modi sapiente quis est	 Necessitatibus mollitia nisi commodi quod"""
Mrs Kayleigh Young	mrs_young_5376	61.0	81.1	"""(Doloremque ex nam) 	 Facilis and Unde eveniet impedit voluptatibus"""	"""Blanditiis quidem omnis: Officiis	 Doloribus veritatis tempore"""
Kyle Smith	kyle_smith_6310	95.0	47.1	"""Note: Officiis vitae facere	 then Ex eveniet"""	"""Reprehenderit esse: Debitis dolorem rem porro ea blanditiis	 Temporibus sit"""
Tracey Ellis	tracey_ellis_7189	79.0	35.1	"""(Ea) 	 Pariatur esse adipisci and Laborum a libero"""	"""Reiciendis beatae laudantium consequuntur: Porro qui	 Minima consectetur"""
Jessica Hunter	jessica_hunter_2910	93.0	27.1	"""Note: Vel repellat natus	 then Fugit quos laudantium"""	"""Sunt alias: Molestiae assumenda quisquam modi numquam	 Sunt reiciendis"""
Miss Marilyn Kaur	miss_kaur_4917	97.0	31.1	"""Quaerat: Corrupti rem et	 Placeat reprehenderit quisquam"""	"""Note: Soluta maiores deleniti voluptatibus	 then Unde blanditiis rem"""
e	katie_walters_3217	86.0	68.1	"""Note: A laboriosam	 then Exercitationem possimus"""	"""Esse natus voluptates	 Minima atque ex reprehenderit Cum quia deleniti"""
Stuart Briggs	stuart_briggs_7510	6.0	29.1	"""Quasi nobis hic aut	 Assumenda consequatur tenetur quas voluptatibus Quibusdam odio"""	"""(Sit aspernatur eveniet) 	 A perferendis and Doloremque laudantium illo"""
Ms Ann Young	ms_young_9874	8.0	2.1	"""Impedit maiores iste voluptate ratione: Est quas facere eaque dolores	 Ullam nemo eaque"""	"""Beatae dignissimos corrupti aliquam: Omnis libero atque	 Eius incidunt"""
Dr Tony Owens	dr_owens_1065	21.0	88.1	"""Odio aliquid enim velit facilis: Repellat	 Nobis explicabo illo repellendus rerum"""	"""Quos totam vero beatae blanditiis; Enim consequuntur laudantium delectus 	 Officiis"""
Georgina Perkins	georgina_perkins_9266	57.0	94.1	"""Inventore consequatur; Delectus sapiente provident reiciendis distinctio 	 Ratione facilis quia"""	"""Fugit debitis voluptatem libero cupiditate	 Libero eveniet totam tenetur Saepe porro nobis"""
David Pearson-Edwards	david_edwards_6154	53.0	49.1	"""Odio veritatis possimus: Veritatis vero modi	 Esse pariatur fuga"""	"""(Ducimus modi) 	 Voluptatum error sequi and Similique modi"""
Amanda Thompson-Baker	amanda_baker_2489	22.0	74.1	"""(Perferendis vitae cumque amet) 	 Facere corrupti and Ut totam commodi"""	"""Sapiente nisi accusantium: Facere maxime animi	 Iusto architecto ratione dolor corporis est"""
Hayley Clarke	hayley_clarke_9024	50.0	64.1	"""(Unde corporis possimus consequatur) 	 Reiciendis at molestias and Inventore at iure"""	"""Deserunt deleniti	 Accusantium explicabo rerum facere Hic pariatur iusto placeat totam"""
Dr Antony Clarke	dr_clarke_4898	3.0	10.1	"""Nemo quis nemo consequatur est praesentium: Nemo animi tenetur eius deserunt	 Nostrum"""	"""Note: Ipsam iure ducimus	 then Similique dolore eveniet ratione facilis"""
Dr Tina Morrison	dr_morrison_3224	88.0	82.1	"""Note: At quaerat esse quibusdam autem	 then Et quod doloremque animi"""	"""(Reiciendis tempore beatae soluta) 	 Ipsa necessitatibus and Deleniti numquam minus magnam"""
Dr Lawrence Ward	dr_ward_2806	65.0	40.1	"""(Vitae atque quaerat officia) 	 Voluptatibus sint and Laborum"""	"""Veniam odit delectus in nihil; Facere hic iusto eligendi 	 Quibusdam nihil"""
Dr Reece Garner	dr_garner_9946	14.0	40.1	"""(Id consectetur molestiae alias) 	 Quia reprehenderit aliquam and Voluptates soluta"""	"""Id ut; Hic iure placeat quasi 	 Rem vero quis quia deleniti nobis"""
Hazel Young	hazel_young_6985	18.0	68.1	"""Reprehenderit voluptatibus repellendus; Corrupti adipisci placeat officia recusandae ab 	 Consectetur voluptatum quod eaque repellendus"""	"""Nemo tempora sunt beatae; Non quidem culpa 	 Quia quod temporibus aspernatur"""
Miss Katy Johnson	miss_johnson_4731	51.0	67.1	"""Note: Dolorem	 then Quod"""	"""Rerum quis dignissimos: Incidunt temporibus necessitatibus inventore	 Cumque veritatis esse laborum perferendis quam"""
Dr Laura Hawkins	dr_hawkins_6799	28.0	52.1	"""(Ducimus sit voluptatem) 	 Eum maxime est similique inventore and Eaque sit ex"""	"""Note: Quisquam nemo	 then Nihil est quibusdam eligendi accusamus"""
Rita Armstrong	rita_armstrong_5630	72.0	90.1	"""Laudantium quos: Suscipit laboriosam	 Ex repudiandae"""	"""Maxime non dolorem; Sunt illo 	 Dignissimos animi"""
Anthony Byrne	anthony_byrne_1838	70.0	55.1	"""(Quibusdam voluptas modi nesciunt accusantium) 	 Consequuntur and Perspiciatis tempore possimus rem"""	"""Note: Sequi vitae doloribus ad consectetur	 then Sunt eligendi magni in"""
Harry Robinson	harry_robinson_9317	39.0	23.1	"""Dicta ea facilis	 Quaerat saepe Ipsum"""	"""Sunt reiciendis: Fuga	 Nostrum necessitatibus reprehenderit"""
Alison Barlow	alison_barlow_2802	1.0	27.1	"""Aliquid iusto: Quas ipsum porro perspiciatis libero	 Iste rem voluptatum repellat voluptas officiis"""	"""Optio esse	 Sed quo dicta Sunt doloremque dolore earum"""
Stewart Harrison	stewart_harrison_3720	24.0	93.1	"""Aut alias impedit amet ut: Repellat esse rerum	 Rem suscipit"""	"""Nam soluta; Fuga perferendis ea 	 Pariatur labore pariatur sequi porro"""
Rachael Savage	rachael_savage_8068	47.0	8.1	"""Porro: Hic nam sed dolor earum	 Natus iste voluptas"""	"""Doloremque	 Tempora Consequatur consequuntur"""
Scott Ahmed-Curtis	scott_curtis_8892	67.0	43.1	"""(Voluptas fugit voluptas) 	 Alias dignissimos and Expedita"""	"""Impedit	 Ipsam Quia"""
Mohammad Bartlett-Evans	mohammad_evans_1220	57.0	85.1	"""Nemo aut deleniti quos; Culpa 	 Numquam perferendis occaecati molestiae ipsum deserunt"""	"""Modi officiis labore expedita; Enim labore 	 Enim corporis totam delectus maxime magni"""
Vincent Hall-Lee	vincent_lee_1709	67.0	3.1	"""Note: Architecto molestias	 then Ducimus"""	"""(Odio at blanditiis) 	 Cumque aperiam and Numquam totam hic"""
