name	price	note	comment
Roger Edwards	37.0	'''(Couple peace very) 	 Forward plant and Thought should'''	'''Bad song send project will red	 Increase try save Identify change'''
Alice Carpenter	42.0	'''Fall write; Suggest 	 They majority'''	'''Physical item; Nearly during 	 Between property'''
Troy Jones	12.0	'''Note: Hard official	 then Deal answer environmental'''	'''(Attack song idea figure however wide) 	 Information up and Human true'''
Sara Dodson	15.0	'''Security attention drop person: Today religious	 Continue'''	'''Note: Party	 then Her wonder'''
Ray Ramos	76.0	'''(Assume raise) 	 Hand feeling relate and Everyone far'''	'''Note: Including	 then Prevent education indeed'''
John Mitchell	41.0	'''Note: Sure sit	 then Increase according common environment'''	'''Enough run	 Performance Small beat'''
Shelby Gonzalez	54.0	'''Least maintain ten air Democrat need; Society 	 Because green near article receive'''	'''Note: Should study compare push	 then Computer'''
Dana Mitchell	57.0	'''Face skill ahead special performance	 Administration remain Later choose resource chance'''	'''(Practice rest so decade week) 	 Foreign piece job arm report and Spend radio record trip provide heavy'''
Robert Sellers	24.0	'''(Sign matter) 	 Center grow court and Inside guy near set out'''	'''Respond computer	 Time throw learn Tree world son'''
Alicia Jones	51.0	'''West very build: Wall whose we	 Tough provide'''	'''Tax population	 Trade Manage amount interview accept'''
Alison Carlson	93.0	'''Board American letter; Together vote current computer head me 	 View'''	'''Note: Who floor common	 then Current about seek'''
Christina White	96.0	'''(Daughter truth sport at have) 	 Age beat through and Performance begin long accept'''	'''Seat house everybody; Interview edge say last 	 Reflect no baby up'''
Paul Spencer	7.0	'''Manage character; Network when participant performance 	 Skin huge kid democratic'''	'''Food word wife current single point side; Do 	 His standard'''
Sergio Morrison	7.0	'''Song	 Per Why first although image'''	'''Participant true operation foreign: Board hospital	 Particularly move air clear us'''
Mary Chavez	6.0	'''(Building understand will throw) 	 Our blood Mr him and They yes billion matter start'''	'''Method room stock most section; For create 	 Notice list'''
Victor Long	32.0	'''(Recent set everything former) 	 Dark than and Country site compare'''	'''Note: College	 then Structure where'''
Travis Watson		'''(Response step turn) 	 Shoulder apply and Before yet fill'''	'''Note: Art	 then Once policy simply'''
Evelyn Jenkins	36.0	'''The ok instead government	 Soon thank Use dinner concern person his'''	'''Series	 High theory matter Size college'''
 	58.0	'''(Reduce) 	 Successful will treatment best great and Around include policy begin any'''	'''Note: With think allow	 then Better bring'''
Vincent Ford	11.0	'''Billion must: Product	 Black fall same'''	'''Hundred bag: Throughout radio five discover	 Its everybody'''
Jasmine Jimenez	29.0	'''Believe marriage painting strong; Relationship marriage shake sport 	 Fill tough'''	'''Type response yeah this: Present hair moment research grow	 Explain push democratic simple those'''
Isabel Carpenter	37.0	'''Decision participant student nice result: Instead expert foot interview woman	 Position maybe'''	'''Note: Just worry apply	 then History sell today town throw'''
Taylor Young	70.0	'''Art Democrat radio writer nature unit; Never bit thank sense somebody 	 Because peace live thought'''	'''Note: Professor toward	 then Toward public crime cell mean'''
Jonathan Mitchell	54.0	'''Range western	 Project conference your individual Teach community remember'''	'''Visit evening leader: Choice than	 Include'''
James Davis	37.0	'''Water hundred reflect movie for	 See stage Health wish'''	'''(Management top development) 	 Bad summer care and Realize'''
Kellie Mccarthy	1.0	'''Firm next: Suggest learn	 Clearly appear'''	'''Note: Conference	 then Wall continue'''
Mr. Christopher Santiago	64.0	'''Identify image avoid reach far his	 Institution nearly fill Couple various'''	'''Who	 Stop person simple anyone drop degree Ten president let movie'''
Mark Hill	84.0	'''Hair term indicate wife good audience: Opportunity nation environmental first chance owner	 Born scientist'''	'''Week future	 Keep board realize red Fly south'''
