username,name,salary,message,note
victoria_rees_8956,Victoria Rees,78.0,'''Nemo laboriosam; Explicabo velit quisquam , Corporis''','''Dicta dicta: Culpa, Provident vero quod nihil'''
holly_brown_5409,Holly Brown,32.0,'''(Inventore mollitia) , Quos dolorum and Tenetur consequatur incidunt''','''Repellendus minus eveniet minus, Facilis Similique nisi'''
leanne_ashton_8057,Leanne Price-Ashton,93.0,'''Eos, Cum eveniet Distinctio deserunt''','''Architecto accusantium aspernatur cumque repellendus dolor; Expedita magni , Nesciunt'''
tom_hall_9083,Tom Hall,52.0,'''Quae quo ab: Tenetur tenetur, Laborum eum''','''(Ex aut) , Facere debitis maxime nam quam and Nulla at'''
arthur_neill_1544,'Arthur Pollard-O''Neill',56.0,'''(Aliquid neque) , Et and Asperiores''','''Nisi repellendus; Ad ipsum sunt , Cumque esse delectus alias'''
eleanor_joyce_7012,Eleanor Carter-Joyce,17.0,'''Note: Aliquid impedit ullam nam aliquam, then Corrupti tempora quam''','''Note: Autem deleniti ea soluta, then Eveniet tenetur'''
mrs_patel_8491,Mrs Joyce Patel,40.0,'''Ducimus quis voluptatem, Architecto reprehenderit accusantium sunt nesciunt Et quos placeat voluptatem maxime similique''','''Atque dolorem illo quidem natus minus, Explicabo Recusandae dolores'''
dr_mccarthy_6862,Dr Amy McCarthy,35.0,'''(Fuga eveniet fuga totam error voluptatem) , Aperiam accusantium blanditiis delectus commodi and Beatae voluptatem''','''Quam ipsa; Sequi dignissimos ex labore tempora , Molestias repellendus magnam'''
diana_hill_3211,Diana Hill,8.0,'''Laboriosam nesciunt dolore; Deleniti ab tenetur , Nostrum animi inventore''','''Repellat ab tempore, Eaque nostrum quia sed dolor Dicta temporibus'''
miss_mann_9094,Miss Karen Mann,79.0,'''Iure eaque, Aliquam quae Suscipit dicta animi''','''Quae a; Minus suscipit ad , Laudantium explicabo'''
ms_cooper_2742,Ms Lauren Cooper,22.0,'''Error officia; Enim , Quam praesentium optio''','''Recusandae est laborum: Voluptatum quam nesciunt nihil aliquid, Placeat repellat aspernatur at'''
shane_wilson_1821,Shane Wilson,98.0,'''(Facilis quae) , Incidunt perspiciatis error and Aliquid quis''','''Ab ut adipisci cupiditate; Excepturi quos quisquam , Temporibus reprehenderit mollitia exercitationem expedita'''
stuart_clarke_5884,Stuart Clarke,78.0,'''Delectus assumenda vero a rerum, Quasi vel asperiores Labore reprehenderit placeat at''','''(Unde eligendi fugit) , Recusandae ipsa nemo tenetur and Numquam dolore aliquid accusantium quaerat'''
hollie_smith_6004,Hollie Smith,15.0,'''Eos nisi sunt, Est fugiat possimus Odio''','''(Tempore soluta) , Odio quas modi neque and Dolorum'''
sally_carter_2638,Sally Green-Carter,90.0,'''Dicta accusamus ducimus officiis minus, Atque cum quod Soluta cum''','''(Earum fugit) , Voluptatum neque and Odit voluptatibus magnam'''
lisa_ryan_8707,Lisa Ryan,96.0,'''Note: Ex doloribus minima laborum reprehenderit neque, then Deserunt''','''Inventore commodi; Quia pariatur , Facilis sed veritatis'''
pamela_thomas_4276,Pamela Long-Thomas,24.0,'''(In) , Omnis voluptatibus modi accusamus and Iure accusamus exercitationem rem''','''Animi vero officiis: Maiores accusamus consequatur ipsam, Nam'''
steven_clark_6945,Steven Clark,2.0,'''Tempore: Aperiam eaque quos animi, Commodi pariatur animi sint''','''Iusto consequuntur optio minima; Possimus delectus soluta , Soluta similique dolor molestias quos'''
mr_wilkins_0797,Mr Guy Wilkins,40.0,'''Note: Cumque consequatur corporis dolorem, then Quaerat quas similique accusamus''','''Excepturi impedit iste vel: Perspiciatis ab vitae dolores, Labore molestias sunt'''
kim_mccarthy_0831,Kim McCarthy,,'''Unde fugit temporibus voluptas fugit: Quam ullam, Eveniet assumenda nemo odit error''','''Excepturi; Molestias illo odit , Illo doloribus iusto'''
jade_smith_6212,Jade Hutchinson-Smith,5.0,'''(Quos quam temporibus odio) , Pariatur perferendis eveniet and Sed corporis assumenda''','''Note: Consectetur eos, then Deserunt odit natus'''
lisa_allan_0950,Lisa Allan,20.0,'''Quae, Maiores Itaque ab''','''Note: Est nihil in provident, then Minus natus repudiandae voluptatibus modi'''
alice_burke_7256,D,49.0,'''Note: Tempore itaque est ratione modi nostrum, then Asperiores optio quis''','''(Alias ab sed quasi quos) , Atque and Rerum'''
mr_martin_6622,Mr Paul Martin,37.0,'''(Officia veniam cupiditate) , Magnam libero and Fugiat laborum''','''Esse voluptatem veritatis ad, Expedita illo Sapiente accusantium'''
carl_fraser_1662,Carl Fraser,22.0,'''Autem magni perferendis quia: Hic illo fugit, Fugit doloribus rem rerum sed numquam''','''Note: Expedita esse eos, then Nulla eaque'''
anthony_hughes_5940,Anthony Hughes,54.0,'''Iusto dolorum doloribus nostrum earum odit: Saepe corrupti ipsum cum eum recusandae, Molestias iste doloribus''','''Cupiditate: Labore quam iusto laudantium repudiandae, Dignissimos doloribus repellat autem cum corrupti'''
ronald_martin_0988,Ronald Martin,75.0,'''Note: Dignissimos, then Ipsum velit''','''Note: Error sapiente, then Optio nisi'''
dr_walters_4791,Dr James Walters,88.0,'''Iure nisi; Velit maiores , Rerum delectus earum itaque occaecati enim''','''Note: Optio adipisci, then Similique'''
timothy_ellis_9120,Timothy Ellis,14.0,'''Note: Ipsam aliquid totam, then Ut quisquam voluptatum repellendus laudantium''','''Aut saepe nihil; Accusantium dolores tempore , Ipsa aliquid aperiam quos'''
sophie_goodwin_0717,Sophie Goodwin,12.0,'''Sint voluptatum necessitatibus praesentium aperiam; Quasi , Mollitia suscipit est deleniti totam''','''Autem; Excepturi quo , Corporis dolorem'''
mohammed_jones_4272,Mohammed Shaw-Jones,96.0,'''(Vitae incidunt) , Nihil eos and Quia inventore quisquam modi''','''Officia libero: Architecto magni, Ea laboriosam praesentium'''
jamie_harris_7630,Jamie Harris,86.0,'''Note: Id similique iste similique quidem dolore, then Cupiditate aliquid''','''Earum, Unde dolorem libero eligendi Deleniti exercitationem fugit'''
toby_hayward_5135,Toby Hayward,72.0,'''Blanditiis error dignissimos nisi occaecati quia, Commodi similique quod Occaecati repellendus corporis''','''Perferendis aperiam, Nesciunt magni Aliquam natus totam officia'''
miss_murray_2922,Miss Charlotte Murray,61.0,'''(Est magnam) , Eos at fuga voluptas fuga and Dolores voluptates deserunt''','''(Labore delectus) , Cum and Dolores iusto'''
rosie_pickering_6271,Rosie Pickering,74.0,'''Note: Officia cum voluptatibus, then Fugiat non temporibus''','''Note: Temporibus porro, then Dolorum dolorum rem nulla'''
declan_giles_3433,Declan Giles,27.0,'''Note: Architecto, then Repellat''','''Aut dicta quasi: Autem exercitationem occaecati, Deserunt corrupti omnis'''
ms_patel_5209,Ms Georgina Patel,82.0,'''Note: Ea dolor, then Vero''','''Explicabo temporibus, Facere in unde Quia ad autem dolor doloremque'''
