name;age;description
Geraldine Gallagher;18.0;"""Note: Nisi non; then Tempora sunt eos"""
Suzanne Mitchell;84.0;"""Eos; Eos dolores ; Voluptates"""
Sharon Manning;91.0;"""(Quos vitae est) ; Commodi and Enim libero"""
Leonard Clements;17.0;"""Laudantium blanditiis: Illum iusto excepturi; Deserunt sit"""
Dr Alan Burton;5.0;"""(Sequi) ; Porro and Esse tenetur qui consectetur"""
Bryan Smith-Chapman;32.0;"""Sapiente delectus alias voluptatem; Atque repudiandae consectetur ; Voluptate natus veritatis nobis aperiam velit"""
Janice Hicks;42.0;"""Expedita iure impedit quis; At dolore sit ; Atque sunt"""
Dr Stewart Gray;72.0;"""Voluptatum laudantium itaque; Doloremque atque Incidunt veritatis voluptatum illo libero"""
Barry Townsend;52.0;"""Corrupti assumenda mollitia; Nobis neque Eius suscipit explicabo ut vitae repellat"""
Peter Williams;25.0;"""(Maxime placeat fuga) ; Voluptas totam labore aut and Id tempora"""
Mohammad Bradley;5.0;"""Quidem odit necessitatibus assumenda: Magni voluptas; Fugiat porro dignissimos molestias officia"""
Dr Ronald Pritchard;90.0;"""Officiis odio reprehenderit; Magni illum id accusantium voluptatem Deserunt molestiae"""
Ms Stacey O'Donnell;54.0;"""Sint sit: Fugiat eum placeat; Eligendi"""
Miss Rachael Griffiths;98.0;"""Vero ut maxime; Velit non possimus Non minima qui"""
Billy Williamson;39.0;"""Quae exercitationem; Omnis mollitia autem laudantium Quaerat perferendis molestias impedit"""
Kate Goddard;13.0;"""Tempore nostrum vitae quo perspiciatis blanditiis; Vel sapiente dolores ; Explicabo perspiciatis architecto occaecati"""
Jean Jones;67.0;"""(Minima perferendis dolor) ; Maiores rerum modi tenetur and Molestiae"""
Elliott Hayward-King;5.0;"""Nemo provident; Adipisci maiores ; Nesciunt similique soluta"""
Jasmine Thomas;12.0;"""Quam velit autem: Veniam; Cumque temporibus at impedit"""
James Jones-Edwards;82.0;"""(Optio at aliquid corrupti) ; A magnam voluptas and Dolore atque doloribus"""
Ms Grace Day;33.0;"""Magnam rerum: Error accusamus magnam; Exercitationem asperiores vitae officia animi"""
Mr Damian Martin;51.0;"""Nisi harum recusandae; Eveniet sequi a Unde beatae eos"""
June Riley-Godfrey;48.0;"""Aut minus sit tenetur laboriosam laboriosam; Quia eum veritatis culpa aperiam pariatur Dolorem perferendis provident voluptatibus at"""
Katie Johnson;53.0;"""Amet veniam quisquam; Animi doloremque ; Non nobis eligendi rem"""
Vanessa Cox;90.0;"""(Minus) ; In consequatur alias ad velit and Deserunt"""
Hilary Collier;44.0;"""Note: Voluptatum possimus accusamus sit; then Provident quisquam ratione"""
Janice Cunningham-Cartwright;6.0;"""Ratione nemo aperiam unde deserunt; Corporis voluptatum laborum fuga ; Pariatur soluta nobis error"""
Christine Morgan;37.0;"""Note: Doloribus quasi; then Voluptate animi quod"""
Mark Austin;2.0;"""(Autem sit doloremque) ; Reiciendis repellat modi deleniti natus ex and Veniam vitae"""
Dr Joanne Phillips;33.0;"""Deleniti sed sed ex; Qui nam ; Id necessitatibus"""
Gerard Tomlinson;94.0;"""Neque fugiat similique quod: Necessitatibus explicabo repudiandae numquam quaerat; Autem eum"""
Carly Williams-Bull;29.0;"""Perspiciatis commodi laborum; Eaque facilis iusto ; Consequuntur nulla"""
Dr Linda Blackburn;89.0;"""Quas; Dolorem a quo tenetur Laboriosam modi"""
Ms Jane Ali;51.0;"""Quis sequi temporibus nisi; Nam eum dignissimos quo Pariatur ex ex quaerat"""
Miss Heather Carter;55.0;"""(Ducimus) ; Neque placeat maxime and Fuga"""
Miss Samantha Chapman;1.0;"""(Ducimus) ; Veniam est consequatur iure occaecati and Eaque"""
Mathew Poole;59.0;"""(Iusto perferendis) ; Esse architecto voluptates and Dolorem accusamus"""
o;2.0;"""Iusto maiores amet voluptatem repellat: Error; Sint odio maxime quae"""
Ross Harrison-Lloyd;4.0;"""Repellendus consequatur ut id tempora: Quidem voluptatem excepturi occaecati; Odit mollitia provident neque"""
Angela Bennett;;"""Laborum quod veritatis: Culpa; Impedit quidem esse"""
Iain Hall;24.0;"""Necessitatibus adipisci suscipit in; Provident ; Molestias rem ab"""
Olivia Webb;93.0;"""Animi inventore mollitia nostrum: Libero voluptatum facilis; Rerum impedit aut"""
