name	username	age	rating	price	comment	note
Lawrence Bell	lawrence_bell_7715	43.0	87.1	54.2	"""Quidem voluptas: Eius atque deleniti	 Alias beatae ullam soluta quam doloremque"""	"""(Excepturi) 	 Dolorum veniam ipsam and Quia vel similique mollitia"""
Miss Catherine Rahman	miss_rahman_6569	96.0	81.1	32.2	"""Occaecati rem	 Dicta ipsum minima dicta autem Sit quam eius mollitia"""	"""Autem: Cupiditate beatae nobis	 Quod nemo aliquid itaque"""
Clifford Clark	clifford_clark_2034	65.0	70.1	61.2	"""Note: Perferendis soluta eligendi ratione neque officia	 then Totam"""	"""(Atque ipsum rem nemo ut) 	 Deserunt rem and Quas et quo"""
Barbara Smith	barbara_smith_6305	88.0	78.1	76.2	"""Facilis debitis ut	 Laborum maxime rerum unde est ratione Quisquam magni iste expedita"""	"""Voluptatem totam maxime veniam nostrum; Repellat quos deserunt dolor nemo 	 Commodi officia consectetur"""
Mr Glenn Reynolds	mr_reynolds_0964	47.0	33.1	37.2	"""Blanditiis dignissimos adipisci inventore	 Laborum natus Eum soluta"""	"""Est nobis modi minus cupiditate: Repellendus totam exercitationem dolorem velit	 Numquam perspiciatis sit nam dicta"""
Joel Taylor-Walton	joel_walton_6072	12.0	13.1	21.2	"""Facere aut ipsam	 Fugit sapiente quasi Ipsa voluptate voluptatum eaque"""	"""Fugiat laboriosam nam: Provident	 Commodi"""
Hilary Barnett	hilary_barnett_7298	74.0	90.1	37.2	"""(Laborum quos) 	 Ipsa totam quo accusantium and Tempore atque"""	"""Note: Nobis quaerat	 then Id"""
Lee Barnes	lee_barnes_4282	47.0	94.1	11.2	"""Libero inventore occaecati; A 	 Ad asperiores"""	"""Quaerat repudiandae itaque; Modi est porro ab enim corporis 	 Laborum"""
Linda Banks	linda_banks_5629	58.0	98.1	2.2	"""(Natus voluptatem dolore) 	 Doloremque repellendus reiciendis and Natus libero dignissimos"""	"""Nostrum sint vel esse	 Commodi dicta Hic voluptas quia"""
Mr Christian Dickinson	mr_dickinson_4385	65.0	41.1	33.2	"""(Aliquid facilis) 	 Quam cupiditate and Vel eaque quibusdam fugiat"""	"""Voluptatem deleniti porro: Recusandae similique	 Eos debitis"""
Jeffrey Fleming-Whitehead	jeffrey_whitehead_5114	9.0	88.1	5.2	"""Eaque error: Deleniti labore	 Quam repellendus"""	"""Deserunt soluta voluptatum placeat fugiat: Consequuntur quas eligendi	 Cumque nam optio"""
Susan Farrell	susan_farrell_5515	78.0	1.1	12.2	"""Exercitationem veritatis sapiente: Eaque ipsam quaerat sit	 Laudantium eveniet voluptatem ex deserunt"""	"""Laboriosam quae eaque error neque ducimus; Recusandae vitae possimus aliquid veritatis 	 Impedit aliquam"""
Ms Samantha Butcher	ms_butcher_5079	37.0	62.1	23.2	"""Pariatur incidunt sed reiciendis	 Magni atque Recusandae vero laboriosam"""	"""Non magnam: Veniam	 Eos"""
Martin Walker-Gibson	martin_gibson_0222	35.0	22.1	99.2	"""Expedita sapiente esse mollitia facilis consequatur; Voluptatibus 	 Molestias similique non"""	"""Illo ad nemo vitae	 Voluptas Voluptatem fugit aperiam facere"""
Lesley Gregory-Reid	lesley_reid_0387	69.0	7.1	23.2	"""Delectus praesentium earum; Quam dolore 	 Minima nulla officiis dolorum esse"""	"""Modi asperiores: Nesciunt magnam culpa porro a	 Eaque recusandae velit excepturi"""
Elizabeth Begum	elizabeth_begum_2573	15.0	22.1	87.2	"""(Unde autem rerum in) 	 Est voluptate inventore and Facilis"""	"""Accusantium corporis blanditiis a; Aliquid minima 	 Sunt culpa aut"""
Ms Lynne Kent	ms_kent_0003	14.0	54.1	20.2	"""Alias sunt exercitationem rem id itaque: Voluptate	 Minima deserunt"""	"""Eos ipsa ratione id; Suscipit beatae quae natus 	 Vitae architecto"""
Mr Denis Power	mr_power_5933	1.0	63.1	28.2	"""Note: Officia aspernatur cum natus	 then Impedit dicta rerum maiores mollitia provident"""	"""Suscipit magni: Et error	 Sapiente amet"""
Gareth Walker	gareth_walker_2500	35.0	12.1	45.2	"""Voluptatum quis ratione: Minus nostrum pariatur enim sunt odio	 Deserunt"""	"""(Praesentium quam) 	 Eveniet a tempora consequuntur and Magnam quos"""
Abigail Patel	abigail_patel_5621	12.0	61.1	6.2	"""(Necessitatibus) 	 Dolores quae id perferendis and Sed velit deserunt"""	"""(Ipsa labore eaque expedita) 	 Quia architecto pariatur and Numquam repudiandae et"""
Eileen Hardy-Walton	eileen_walton_1626	8.0	50.1	57.2	"""Dolore natus itaque; Reiciendis natus assumenda consequatur 	 Ipsam deleniti"""	"""Note: Nisi consectetur similique	 then Itaque fuga assumenda"""
Natalie Hawkins	natalie_hawkins_0105	29.0	75.1	20.2	"""In cum doloremque nemo asperiores iure	 Voluptatibus fuga autem explicabo Numquam iure"""	"""Natus aperiam error; Eos atque tempora 	 Pariatur ducimus"""
Mary Davison	mary_davison_0601	11.0	36.1	62.2	"""(Aut ratione porro rem inventore) 	 Corporis ipsa reprehenderit voluptates mollitia and Nam libero architecto illo dolorum incidunt"""	"""(Dolores id) 	 Laudantium quo laboriosam and Amet voluptatem mollitia"""
Mr Charles Dodd	mr_dodd_4942	81.0	42.1	40.2	"""Consectetur repellat labore sit deserunt: Dolorum provident magnam illum error dolore	 Odio ratione reiciendis sunt"""	"""Corrupti assumenda cumque labore animi: Nobis dolorum	 Possimus veritatis sit ea"""
Dale Carter	dale_carter_5907	7.0	43.1	59.2	"""(Eligendi) 	 Blanditiis and Asperiores possimus corrupti"""	"""(Explicabo officia dolore) 	 Quos est adipisci ut nobis and Ipsam esse incidunt dolorum nobis ipsam enim"""
Josephine Knight	josephine_knight_1629	7.0	21.1	91.2	"""Tenetur tenetur; Amet 	 Voluptatem est"""	"""Minus: Ducimus	 Consequuntur"""
Bethany Parker-Singh	bethany_singh_5737	98.0	76.1	47.2	"""Facere: Pariatur quis occaecati dolorum	 Totam"""	"""Nobis nisi vero enim: Voluptatibus architecto	 Sit minus perspiciatis deleniti"""
Callum Rogers-Gibson	callum_gibson_5085	6.0	61.1	59.2	"""Optio beatae aut suscipit ab a	 Dolore rem odit vitae optio dicta Illo"""	"""Laudantium aut tempora error porro	 Ad nihil assumenda Exercitationem quo doloribus aspernatur quisquam deserunt"""
John Howarth-Williams	john_williams_8179	33.0	56.1	93.2	"""Maxime optio doloremque; Occaecati cumque eaque 	 Facere quas"""	"""Debitis consequatur non voluptate: Nostrum pariatur	 Quidem"""
Francis Allen-Hill	francis_hill_5894	13.0	70.1	52.2	"""Delectus: Explicabo at velit quasi	 Nisi ad harum"""	"""Impedit dignissimos atque; Esse iure ad ipsum velit iure 	 Repellat placeat fugit non"""
o	marie_graham_3830	66.0	71.1	11.2	"""Note: Vel ullam	 then Quasi expedita quibusdam placeat"""	"""(Soluta totam dicta) 	 Dolore and Maiores exercitationem consequatur"""
Mr Dean Hutchinson	mr_hutchinson_8412	84.0	33.1	81.2	"""Ab: Corporis quas assumenda	 Fugit"""	"""Praesentium accusamus; Similique molestias maxime voluptatibus veniam 	 Nostrum nesciunt mollitia"""
Valerie Russell	valerie_russell_8804	18.0	67.1	39.2	"""Quos	 Officia quo fugiat Ipsa harum totam"""	"""(Deleniti totam) 	 Aliquam rerum and Tempora enim"""
Stuart Palmer	stuart_palmer_4486	98.0	42.1	57.2	"""(Tempora qui corporis id) 	 Totam perferendis and Suscipit quas incidunt"""	"""Inventore at rem: Iure odio consectetur	 Neque"""
Janet Carter	janet_carter_0859	28.0	49.1		"""Numquam sapiente iusto eaque inventore	 Provident Delectus"""	"""Nesciunt placeat: Sed pariatur at	 A odit consequatur repudiandae"""
Dr Jade Holmes	dr_holmes_4107	45.0	76.1	75.2	"""Ad neque; Odit autem reiciendis fugit similique iste 	 Rem incidunt eum tenetur eaque"""	"""Note: Facere minus dignissimos	 then Nisi"""
Bruce Roberts-Storey	bruce_storey_7596		12.1	63.2	"""Numquam; Illum blanditiis dolor corrupti 	 Debitis harum"""	"""Corrupti quisquam corporis: Tempore	 Ad ipsa architecto fugit"""
Alison Jones	alison_jones_3644	49.0		90.2	"""Note: Maiores pariatur	 then Ab cum"""	"""Sint: Porro quod eius	 Ab repellendus ea"""
Leah Dixon-Wood	leah_wood_4798	29.0	81.1	51.2	"""Officia; Quasi reprehenderit consectetur consectetur fugit amet 	 Ad"""	"""(Nihil delectus et porro commodi) 	 Atque aut facere animi inventore nihil and Aut"""
Christopher Graham	christopher_graham_5723	91.0	15.1	68.2	"""Officiis corporis distinctio similique harum: Praesentium eius nostrum	 Illum quam"""	"""(Veniam provident earum) 	 Sapiente and Debitis nisi illo"""
Mrs Grace Fletcher	mrs_fletcher_8247	47.0	18.1	7.2	"""Omnis suscipit	 Dolore tenetur rerum Consequatur dolorum"""	"""Excepturi quam: Nihil voluptatibus commodi	 Ullam blanditiis quos"""
Harry Baker	harry_baker_2515	40.0	64.1	82.2	"""(Corrupti) 	 Temporibus autem and Velit est maiores dignissimos"""	"""(Amet ullam autem autem) 	 Numquam velit enim rem and Assumenda voluptate"""
