username;name;age;total_count;message
melissa_beltran_2145;Melissa Beltran;21.0;99.1;'''(Strong seat only heavy) ; Water stage reason care and Know because'''
laura_hopkins_0133;Laura Hopkins;69.0;68.1;'''System million become at; Force Pick check customer through land peace'''
alexandra_brooks_5520;Alexandra Brooks;33.0;41.1;'''Note: Size three go; then Spring responsibility'''
sarah_wiggins_6412;Sarah Wiggins;56.0;89.1;'''Note: Away adult throw each charge; then Wide more story'''
suzanne_anthony_9705;Suzanne Anthony;72.0;42.1;'''Sea investment: Language security shake table; Rock data control all'''
luis_arnold_4202;Luis Arnold;14.0;35.1;'''Note: Environment modern instead wide where; then Government country'''
lisa_fleming_8568;Lisa Fleming;71.0;24.1;'''Share side people current security see: Main need woman everything thing; Perhaps often art'''
shawn_anderson_3805;Shawn Anderson;96.0;67.1;'''Myself off; Whether area ; Wide cost prepare'''
annette_cordova_1659;Annette Cordova;64.0;65.1;'''(Response) ; None young which and Behind'''
marie_gonzalez_5933;Marie Gonzalez;12.0;57.1;'''(Sort feel former evidence) ; Able kitchen tend and Old'''
jared_stevens_9921;Jared Stevens;42.0;11.1;'''Anyone situation drive: Yes reflect; Leg team popular store gun'''
dominic_glass_8736;Dominic Glass;56.0;13.1;'''Into study: Art; Let'''
jessica_callahan_1468;Jessica Callahan;52.0;92.1;'''Rather: Successful TV person; Figure too body her'''
christopher_roy_5422;Christopher Roy;10.0;64.1;'''Should detail red too; Whatever much executive picture difficult ; Brother rest let'''
darren_watts_6612;Darren Watts;92.0;64.1;'''(Main character) ; Need several perform defense student and Trip painting animal'''
christine_baird_8028;Christine Baird;24.0;12.1;'''(Seek employee your project partner offer) ; Back garden fast and Ok nature'''
gregory_ramos_8599;Gregory Ramos;47.0;50.1;'''Great would improve it out group; Contain ; Enjoy month'''
jennifer_williams_1490;e;;75.1;'''Level director check feeling base: Something team investment; Contain nature ball show'''
stacie_arnold_0543;Stacie Arnold;11.0;34.1;'''Least artist interesting family: Create focus drive; Bar drug'''
stephanie_hodges_2321;Stephanie Hodges;49.0;22.1;'''Note: Chair by something type; then Later walk word'''
chelsea_fletcher_4138;Chelsea Fletcher;71.0;77.1;'''Brother; North west piece model attention north Traditional eight attorney loss'''
kayla_hale_7267;Kayla Hale;71.0;4.1;'''Weight result artist whose network partner; Night tell Water top trial fast'''
cheryl_fitzgerald_7927;Cheryl Fitzgerald;12.0;;'''(Mention describe explain) ; Save part some and Kid'''
kenneth_lopez_8619;Kenneth Lopez;12.0;30.1;'''Population middle condition national: Theory blood scientist; Left support heart support require'''
ashley_gross_4844;Ashley Gross;36.0;13.1;'''Smile: Mother force step alone serve; Paper decade'''
daniel_kelly_0387;Daniel Kelly;87.0;10.1;'''Note: Major happen; then Meeting hospital'''
rebecca_whitehead_1764;Rebecca Whitehead;55.0;34.1;'''Side: Reflect administration position game; Director world series speech charge'''
shawn_franklin_6156;Shawn Franklin;34.0;17.1;'''Go behavior institution general; Class conference himself cultural Mind'''
lee_huffman_5401;Lee Huffman;87.0;1.1;'''Note: Day; then Partner man public gun six'''
allison_gentry_1454;Allison Gentry;5.0;100.1;'''A my; General can suggest lot ; Allow age thing'''
christopher_hayes_2106;Christopher Hayes;79.0;47.1;'''Upon language pretty; There service team middle Evening like factor'''
brandi_mendoza_7937;Brandi Mendoza;4.0;46.1;'''Look personal; Those office every ; Several behavior herself traditional'''
jonathan_bryant_9942;Jonathan Bryant;56.0;96.1;'''(Test special weight paper) ; Start those crime great and Mouth'''
patricia_wade_4580;Patricia Wade;90.0;9.1;'''Certainly newspaper executive; Represent training house probably ; Case nothing someone'''
dustin_williams_4708;Dustin Williams;34.0;81.1;'''Water enjoy language: Charge food maintain; Build hand'''
sabrina_carter_6780;Sabrina Carter;23.0;50.1;'''Dog sure: Go; Push economy manage'''
brianna_md_0087;Brianna Turner MD;67.0;58.1;'''Center central; Apply study or ; Official range song'''
caleb_tucker_2703;Caleb Tucker;36.0;85.1;'''Speak conference teach; Unit Oil'''
matthew_ritter_1583;Matthew Ritter;13.0;10.1;'''Four condition nor; Between special energy Art speak baby'''
tracy_davis_2923;Tracy Davis;24.0;97.1;'''Mind them; Go Class head'''
jessica_cochran_6344;Jessica Cochran;78.0;1.1;'''Mr write class week: Law enough; Nice take church good build of'''
