name;rating;salary;price;message
Eric Poole-Singh;51.0;22.1;75.2;"""Autem hic sequi: Aliquam sunt reiciendis harum dolores; Consectetur tenetur dolorum a suscipit vero"""
Dylan Lee;11.0;74.1;66.2;"""Accusantium dignissimos; Enim dignissimos Amet corrupti atque provident"""
Trevor Green;65.0;100.1;15.2;"""Reprehenderit incidunt; Corrupti modi Blanditiis"""
A;75.0;44.1;91.2;"""Nulla non; Numquam consectetur itaque nesciunt ; Id accusamus alias voluptate"""
Nigel Gregory;85.0;39.1;29.2;"""Eius ex rerum quidem recusandae eos; Ut temporibus animi sunt asperiores Pariatur ipsam voluptas dolor"""
Dr Robert Hartley;75.0;36.1;64.2;"""Incidunt doloribus quos; Deserunt voluptatum corporis ; Ad provident id illum repudiandae"""
Craig White;52.0;99.1;80.2;"""Note: Adipisci minus exercitationem; then Error sint minus"""
Lydia Hart-Bevan;61.0;1.1;45.2;"""Nostrum eveniet repellat a; Deserunt Asperiores libero"""
Dr Yvonne Ward;;63.1;61.2;"""(Iure cum iusto) ; Quis hic tempora and Dicta enim exercitationem nulla fuga illum"""
Megan Lee-Lambert;85.0;5.1;9.2;"""Perspiciatis; Explicabo eveniet ; Sed"""
Caroline Walker;99.0;67.1;17.2;"""Explicabo: Repellendus eligendi; Ab facilis minima"""
Miss Beverley Pearce;24.0;70.1;41.2;"""Hic; Amet quisquam necessitatibus ; Ab"""
Kelly Morgan-Carter;78.0;20.1;51.2;"""(Architecto tempora) ; Voluptates consequuntur id perferendis and Dolorem molestias laborum"""
Amy Wood;75.0;4.1;61.2;"""(Distinctio fuga nihil non) ; Minus sunt nobis and Ab quaerat blanditiis"""
Anna Thomson;63.0;32.1;12.2;"""Quis veritatis; Perspiciatis voluptates accusantium ; Voluptatum tempore magni vero"""
Charlie Pollard;82.0;12.1;25.2;"""Note: Commodi; then Error cumque voluptatum corporis impedit"""
Carolyn Bell;36.0;32.1;27.2;"""Iure dolore minima possimus error: Tempora rerum; Repudiandae cupiditate quasi"""
Pauline Murphy;33.0;9.1;95.2;"""Note: Laudantium nihil; then Harum eveniet maxime alias"""
Gordon Stevens;16.0;9.1;91.2;"""Sapiente in libero neque recusandae; Adipisci velit Distinctio nemo dolorem reiciendis adipisci"""
Mr Howard Johnson;100.0;32.1;12.2;"""Note: Nisi; then Repudiandae"""
Kenneth Lee-Smith;34.0;86.1;15.2;"""(Repellat et inventore doloremque ut) ; Illo sit and Ullam unde iste earum alias quaerat"""
Dr Stephen Kay;76.0;3.1;97.2;"""Note: Ipsum; then Error distinctio animi rerum aut atque"""
Miss Katy Fitzgerald;62.0;4.1;48.2;"""Molestiae cumque consequatur sit ex esse: Dolore aut exercitationem tempora; Fugiat natus ipsam in"""
Dr Louise Moran;90.0;51.1;44.2;"""(Odit non) ; Culpa neque maiores and Dolorem"""
Dr Terry Kaur;6.0;82.1;10.2;"""Facilis asperiores explicabo tenetur; Ducimus voluptas ; Odio quo fuga quidem"""
Conor Lyons-Allen;65.0;14.1;29.2;"""Sint tenetur non est; Repellat ; Dolorem occaecati"""
Mr Paul Schofield;97.0;68.1;78.2;"""Note: Reiciendis sequi; then Eveniet quaerat placeat iure"""
John Lloyd;21.0;44.1;77.2;"""Laudantium: Doloribus alias; Consequuntur occaecati suscipit ut"""
Dr Leigh Jones;10.0;94.1;67.2;"""Aut voluptas; Eum ipsa quo ; Aspernatur aliquid odit dignissimos voluptatibus"""
Ruth Lee;82.0;71.1;23.2;"""Note: Quod; then Quisquam laudantium quasi"""
Susan Smith-McCarthy;18.0;67.1;13.2;"""Aliquid doloremque: Quos a voluptate veritatis; Corrupti incidunt"""
Mathew Campbell;97.0;71.1;100.2;"""Assumenda quod rerum: Reprehenderit consectetur amet a vitae eos; Dignissimos architecto vel sapiente in"""
Lawrence Clarke;32.0;2.1;58.2;"""Note: Odio tenetur incidunt beatae; then Consequuntur adipisci"""
Mr Hugh Hayes;50.0;57.1;14.2;"""Vel minima; Qui temporibus ; At beatae"""
Irene Harvey-Hooper;49.0;95.1;74.2;"""(Consequuntur excepturi) ; Placeat sunt nesciunt and Similique delectus consectetur"""
Lisa Jones;79.0;70.1;96.2;"""(Animi odit) ; Soluta accusantium tenetur aperiam praesentium and Pariatur in culpa reiciendis"""
Brian Patel-Harrison;2.0;56.1;;"""Facilis magnam eius; Nihil incidunt voluptates numquam Esse consectetur"""
Craig Page;1.0;53.1;94.2;"""(Mollitia praesentium) ; Quia commodi repellendus and Quos id quo dignissimos saepe"""
Mr Mohammad Kay;55.0;;56.2;"""Pariatur maxime rem adipisci: Eos optio a; Deserunt ullam"""
Paul Smith;36.0;81.1;1.2;"""Saepe quasi porro; Occaecati Cum sapiente eos accusamus facere"""
Dr Max Burton;75.0;62.1;21.2;"""Note: Perspiciatis optio doloribus dolorem possimus; then Rerum occaecati numquam in praesentium"""
Leon Newton;65.0;51.1;100.2;"""Iusto: Provident necessitatibus tempora; Sequi veritatis odit"""
