name;age;total_count;description
Melanie Scott;88.0;91.1;'''Similique: Nam officiis officia; Quae'''
Mr Julian Hopkins;8.0;41.1;'''Note: Adipisci magni temporibus accusamus ut; then Doloremque cum praesentium'''
Elizabeth Harper-Moss;76.0;64.1;'''Eaque laborum totam exercitationem: Distinctio eveniet qui laboriosam veritatis vel; Facilis'''
Ms Tina Lyons;19.0;61.1;'''Error ut molestias quasi molestiae; Quis nesciunt Illo officia accusantium maiores minus'''
Mr Danny Davies;78.0;15.1;'''Atque: Blanditiis; Nesciunt'''
Dr Gerard Jones;54.0;20.1;'''Aspernatur omnis sint exercitationem; Ex At eligendi'''
Ashley Harvey;93.0;55.1;'''Note: Inventore vel deserunt eaque impedit; then Velit iure optio porro'''
Mohamed Webb;;71.1;'''Note: Quae sed vero quae nemo; then Voluptas culpa cumque totam'''
Miss Francesca Baxter;17.0;2.1;'''Earum qui; Perspiciatis mollitia ; Hic amet'''
A;81.0;9.1;'''Optio iusto dolorem odit molestiae neque; Similique perferendis ; Maiores occaecati possimus'''
Brian Harrison;37.0;77.1;'''(Voluptatum voluptas possimus molestias excepturi impedit) ; Sequi laborum and Neque quidem molestias'''
Elliot Martin;64.0;11.1;'''Ad laudantium ad impedit; At ; Veniam quibusdam'''
Mr Stewart Allen;42.0;40.1;'''Note: Facere unde; then Nihil placeat explicabo veritatis aliquam'''
Jane Webster;95.0;19.1;'''Eius; Autem perferendis reiciendis illum dolorum ; Enim'''
Kate Jones;92.0;19.1;'''Debitis perferendis commodi error; Provident nisi vero Non deleniti nemo aliquam dolorem'''
Daniel Robertson;26.0;12.1;'''Laudantium laudantium ad; Culpa aut facere Aliquam id dolorem praesentium'''
Grace Coates;38.0;66.1;'''Sequi cupiditate consectetur; Quos eius laboriosam Doloribus nam'''
Dr Angela Holmes;94.0;15.1;'''Adipisci; Enim commodi facilis fuga consectetur Assumenda quo vitae'''
Dr Steven Taylor;26.0;58.1;'''Note: Quasi; then Sapiente fugiat sit nulla odit repellendus'''
Karen Haynes;33.0;31.1;'''Odio ut temporibus nulla nesciunt; Eius ; Molestiae fuga'''
Lindsey Carter;86.0;12.1;'''Note: Perferendis dolorem; then Ipsam doloremque'''
Mr Martin Dodd;86.0;45.1;'''Sint sequi adipisci ad ipsam; Quo harum temporibus error Enim'''
Laura Marshall;99.0;51.1;'''Aliquid; Aspernatur ipsam incidunt fugiat ; Dolores saepe'''
Alan Lawrence;84.0;50.1;'''Minus provident maiores cum consequatur odit: Laborum; Error repudiandae'''
Ms Heather Dixon;76.0;93.1;'''Note: Sunt tenetur; then Nemo magnam exercitationem'''
Christopher Harris;70.0;73.1;'''Eum quaerat ratione; Libero Molestiae minus eius amet excepturi'''
Mr Denis Sharp;5.0;8.1;'''Asperiores quidem quidem; Similique blanditiis Repellat nemo corporis'''
Dr Teresa Singh;32.0;50.1;'''Note: Ab sit harum; then Sit mollitia'''
Miss Natasha Whittaker;67.0;;'''Note: Sed ullam; then Libero repellendus reiciendis maxime quod repellat'''
