username,total_count,age,description
adrian_neill_3297,6.0,86.1,'''Architecto esse, Iste eaque Vel excepturi inventore'''
mr_barlow_0754,79.0,7.1,'''Maxime sunt, Perferendis dignissimos A'''
dr_holmes_4208,23.0,42.1,'''Voluptas eius cumque nemo: Molestias non, Quod'''
fiona_wright_7741,23.0,34.1,'''Quas dolorum eligendi nisi perspiciatis iure, Laudantium ratione facere Labore nihil quam'''
gregory_butcher_7417,33.0,13.1,'''Laboriosam: Consequuntur et corporis, Recusandae'''
toby_stevens_2529,62.0,63.1,'''Note: Atque rerum amet quos, then Aliquam ratione maiores ex animi'''
pamela_fitzgerald_4753,84.0,33.1,'''(A) , Atque and Qui sequi ipsum'''
peter_begum_7803,8.0,90.1,'''Eaque nisi itaque unde nostrum, Nemo tempore aliquam maiores Iure'''
amber_sanders_1185,29.0,31.1,'''Expedita ab; Explicabo rem reprehenderit , Esse sunt quaerat'''
marion_byrne_6203,81.0,50.1,'''(Vel) , Quod odio corporis cum and Sit ipsam amet magnam quisquam'''
mark_murphy_3496,59.0,87.1,'''Note: Placeat, then Minus incidunt quibusdam qui'''
natalie_russell_0033,45.0,2.1,'''Aliquam adipisci, Minima cumque Nesciunt'''
eric_george_8183,37.0,58.1,'''(Provident facilis fuga odio) , Minus eveniet ab and Ut natus facere'''
alexander_matthews_8668,35.0,25.1,'''(Enim) , Placeat aut ducimus and Laboriosam'''
jill_brown_0375,67.0,28.1,'''Note: Impedit beatae, then Sed sequi nulla officiis alias maxime'''
helen_hill_9607,73.0,99.1,'''Eos aspernatur doloribus: Sapiente ullam, Libero quasi'''
dean_jones_7748,41.0,78.1,'''Sapiente eius; Dolores eveniet officia voluptatibus ad , Nesciunt'''
miss_barnes_3172,45.0,,'''Non nemo; Dolorum neque , Suscipit cum in quam ducimus tempora'''
lewis_murphy_8998,47.0,100.1,'''(Aut) , Dolor veniam and Distinctio ipsum reprehenderit perferendis voluptates'''
paige_jennings_2272,70.0,55.1,'''Laudantium hic earum earum, Sit quibusdam blanditiis modi necessitatibus corrupti Totam officia repudiandae ex'''
leon_williams_3381,93.0,77.1,'''(Error pariatur sint quaerat amet) , Sit and Atque in velit accusantium suscipit'''
owen_flynn_5714,94.0,1.1,'''Reiciendis magni, Doloremque ratione quo nemo id Magnam voluptatem voluptatum provident'''
amber_smith_7252,66.0,19.1,'''(Eius voluptas) , Id hic and Cumque culpa aut'''
jamie_wood_6317,15.0,16.1,'''Aperiam adipisci aliquid, Harum illum mollitia a dicta quam Deserunt dolor consequuntur ipsum aut'''
mrs_berry_0937,89.0,41.1,'''Reiciendis blanditiis; Mollitia sint nam similique , Alias incidunt natus'''
michelle_hill_1004,73.0,92.1,'''Note: Neque, then Placeat voluptates aliquid quasi'''
mr_campbell_7443,13.0,18.1,'''Dolor odio, Unde Molestias ipsa est repellendus'''
jemma_rowley_0574,75.0,80.1,'''Tempora doloribus, Corporis Provident ad'''
hugh_lambert_8477,58.0,35.1,'''Provident inventore provident minima, Excepturi a et maxime Voluptatum culpa delectus'''
thomas_gallagher_7585,23.0,43.1,'''Note: Voluptas, then Ab distinctio commodi eius quasi'''
albert_morgan_4867,44.0,2.1,'''Placeat; Quisquam aliquid consequuntur , Ab'''
bradley_kirby_5512,75.0,80.1,'''Note: Voluptas laboriosam, then Illum quasi similique unde id'''
bernard_gardner_6861,90.0,8.1,'''Provident: Fugit officia mollitia voluptatem, Dolorum'''
dr_moss_4818,32.0,91.1,'''Note: Hic quos veritatis, then Dolore expedita'''
albert_knight_7319,47.0,25.1,'''Ab soluta quasi voluptatibus: Nobis aut autem, At ullam quod quae quisquam'''
robin_dale_2062,90.0,27.1,'''(Adipisci harum cupiditate ab asperiores) , A repudiandae dolor consequatur culpa and Doloremque et'''
amber_swift_0471,79.0,12.1,'''Note: Architecto reiciendis perspiciatis quas, then Commodi fugit ab'''
adam_carter_7388,61.0,74.1,'''Dignissimos accusantium corrupti, Nostrum Excepturi nobis voluptate voluptas aliquam'''
dr_brown_3991,1.0,16.1,'''Dicta velit cum ullam fugit; Alias alias , Hic dolor magnam voluptas'''
dawn_cook_7712,99.0,84.1,'''Autem ipsa possimus, Nihil Itaque nostrum omnis'''
jasmine_bell_8272,99.0,10.1,'''(Cum aliquam) , Temporibus rerum and Vitae voluptatum officia molestias exercitationem quaerat'''
garry_jones_9193,79.0,30.1,'''Note: Blanditiis pariatur ullam nisi, then Non ducimus quisquam odio cum'''
kenneth_ross_5334,100.0,19.1,'''Suscipit exercitationem necessitatibus, Aut deserunt provident ratione Sapiente exercitationem'''
norman_hughes_5535,49.0,87.1,'''Doloremque, Necessitatibus necessitatibus cupiditate Neque velit saepe atque dolor'''
bradley_goodwin_7304,68.0,24.1,'''Note: Aliquid non accusamus consequuntur, then Reprehenderit'''
grace_mason_8001,,57.1,'''(Reiciendis magnam) , Occaecati totam and Officiis'''
diana_moss_5208,44.0,85.1,'''Note: Minima hic quo, then Quia dicta amet'''
kenneth_davies_3548,86.0,63.1,'''Note: Mollitia, then Est cumque eius'''
barbara_saunders_0471,27.0,10.1,'''Possimus similique, Earum Cupiditate ex voluptatem'''
mrs_taylor_3246,63.0,29.1,'''Note: Quidem ducimus, then Odit accusamus'''
