name	username	age	score	rating	summary	message
Kayleigh Pope	kayleigh_pope_6796	12.0	7.1	6.2	'''Dolor debitis beatae: Fugit dicta molestias	 Hic'''	'''Incidunt fuga architecto illum magnam eveniet: Laborum vero	 Facilis dolor non dolore suscipit'''
Joan Rowe	joan_rowe_1697	52.0	97.1	91.2	'''Magni porro dolorem similique; Fugiat debitis 	 Qui eos dolore commodi consequuntur laudantium'''	'''Numquam inventore consectetur laboriosam: Fugiat odit distinctio	 Sunt cum doloremque'''
Tracy Lowe	tracy_lowe_8323	91.0	51.1	73.2	'''Note: Vero at itaque id	 then Inventore nulla excepturi repellat voluptatibus'''	'''Dicta enim	 Aliquid dicta accusantium Dicta nisi necessitatibus'''
o	francis_wyatt_8222	69.0	61.1	59.2	'''Laborum maiores laboriosam dolores: Eligendi neque corporis saepe	 Neque iste laborum ab hic'''	'''(Iusto dolores) 	 Tempore deleniti ipsum and Repellat voluptate non'''
Leon Watts	leon_watts_7732	72.0	58.1	52.2	'''Quae; Sit exercitationem sapiente maiores corrupti 	 Minus odio'''	'''At nemo: Cupiditate saepe	 Quidem sit'''
Ross Thomas	ross_thomas_4206	52.0	98.1	58.2	'''Note: Cupiditate temporibus beatae	 then Quis nesciunt officiis'''	'''Assumenda exercitationem facilis molestias: Repellat dolore maxime	 Quod labore'''
Mohammed Read	mohammed_read_4188	19.0	55.1	46.2	'''Perferendis modi quod non; Excepturi reiciendis inventore 	 Numquam'''	'''Note: Perferendis eaque	 then Reiciendis'''
Shaun George	shaun_george_3943	55.0		3.2	'''Praesentium deserunt dolore alias; Aspernatur repudiandae dolor ut 	 Corrupti incidunt dignissimos'''	'''Expedita a velit quibusdam ratione; Dolores illo 	 Ipsum cumque laudantium'''
Bernard Bell	bernard_bell_0066		19.1	96.2	'''Optio consequatur optio animi	 Adipisci Officiis'''	'''Laborum sit quaerat earum: Illum minima alias	 Ipsam pariatur'''
Nicole Lawrence	nicole_lawrence_0414	94.0	6.1	92.2	'''Quod fugiat aspernatur quo	 In sequi Aperiam voluptates'''	'''Note: Ipsa eos quae cupiditate	 then Sequi at repudiandae quidem mollitia'''
Alexander Mills	alexander_mills_0398	77.0	13.1	34.2	'''Rem: Esse facere	 Commodi et tempore'''	'''Tempora odit temporibus iure	 Similique delectus voluptate Occaecati omnis accusamus assumenda sapiente'''
Joe Hall	joe_hall_2122	98.0	62.1	99.2	'''Note: Culpa quasi	 then Accusantium iste sunt iste consectetur'''	'''Reiciendis; Ut 	 Distinctio non soluta'''
Ms Lucy Price	ms_price_8188	94.0	7.1	45.2	'''(Adipisci quos optio) 	 Veniam cum quos and Perspiciatis aperiam'''	'''Saepe ipsam	 Commodi molestias Asperiores dolorem veniam corrupti commodi'''
Teresa Lowe	teresa_lowe_6698	77.0	71.1	49.2	'''Itaque: Voluptates ad	 Ut iusto voluptatem'''	'''Dolores; Inventore 	 Architecto sequi sunt'''
Julia Hayes	julia_hayes_1099	11.0	89.1	47.2	'''(Voluptatem placeat itaque suscipit voluptatem) 	 Saepe aperiam illum architecto and Repellat ipsum id'''	'''Alias in: Corrupti dolorem	 Eos laudantium'''
Mr Connor Shepherd	mr_shepherd_2374	58.0	95.1	25.2	'''Dicta: Maiores est omnis quo minima ex	 Praesentium repellendus necessitatibus quo unde'''	'''Harum quod adipisci maiores: Sit	 Optio quis dolorem porro placeat asperiores'''
Dr Jeffrey Cole	dr_cole_7252	100.0	31.1	99.2	'''Dolore temporibus maiores earum	 Harum iste Fuga culpa exercitationem magni voluptates omnis'''	'''Perspiciatis rem dignissimos ratione	 Assumenda Consectetur velit odio perferendis'''
Melissa Page	melissa_page_8651	83.0	17.1	86.2	'''Eos dignissimos laboriosam: Laboriosam quidem non	 Expedita'''	'''Quas fugiat a deserunt est; Perferendis animi 	 Fuga'''
Bethany Gregory	bethany_gregory_8159	25.0	43.1	99.2	'''Note: Vero quidem	 then Fuga voluptatibus eos nesciunt adipisci'''	'''Quisquam placeat quaerat	 Molestias consectetur sed illum dolore ex Suscipit delectus autem assumenda'''
Mrs Kathleen Foster	mrs_foster_4282	58.0	13.1	38.2	'''Est illum ipsa; Sit suscipit provident ad 	 Atque numquam'''	'''Fugit molestias blanditiis quisquam veritatis placeat: Rerum placeat temporibus facere	 Doloremque fugiat vel ducimus'''
Miss Amelia Smith	miss_smith_0424	14.0	2.1	87.2	'''Eligendi nemo: Exercitationem praesentium iusto dolorem accusantium	 Deserunt cupiditate perspiciatis nemo fugiat'''	'''Saepe aperiam esse	 Quaerat Dolorem cum veritatis officiis perspiciatis'''
Dr Hugh Arnold	dr_arnold_4566	87.0	40.1		'''Illum fugit error: Dolor dolor tenetur	 Ea ipsum totam molestias dolorem quaerat'''	'''Porro reiciendis alias: Voluptatibus quae	 Vitae neque hic vero'''
Conor Newton	conor_newton_5450	58.0	93.1	35.2	'''Note: Aperiam eos explicabo adipisci labore	 then Incidunt ex'''	'''Dicta provident blanditiis dicta; Ducimus qui optio numquam 	 Molestias ab'''
