name	salary	price	remark	comment
Henry Rogers	31.0	98.1	'''(Tempore quibusdam quo sint) 	 Facere consectetur id accusamus labore and Porro assumenda hic'''	'''Asperiores nisi cumque: Repudiandae cupiditate itaque	 Laudantium hic'''
Jason Thornton	86.0	80.1	'''Et consectetur: Laborum	 Vitae'''	'''(Est incidunt laboriosam) 	 Saepe perspiciatis suscipit at quam ipsa and Impedit neque'''
Sara Bond	54.0	17.1	'''Facilis quod aperiam veritatis minus; Illum totam 	 Accusamus rerum'''	'''Accusamus dolor dolore	 Asperiores temporibus Iure fugit'''
Dr Stewart Davis	1.0	32.1	'''Voluptatem officiis corporis pariatur expedita commodi: Non autem deleniti	 Dolor corporis fugiat'''	'''Commodi commodi dolorem deserunt sit	 Architecto temporibus Dolor incidunt quas'''
Christopher Francis	44.0	24.1	'''Note: Voluptatum maxime	 then Quaerat placeat'''	'''Earum delectus doloremque totam autem: Quaerat ad et	 Amet quae alias eius at'''
Jean Hall	41.0	14.1	'''Repellendus in: Mollitia labore dolorem	 Veniam distinctio id aliquam voluptatibus repellat'''	'''Ea assumenda nostrum nihil itaque; Incidunt occaecati 	 Sint cum'''
Mr Sam Flynn	90.0	74.1	'''Ipsam eius ducimus maiores voluptatum: Consequuntur quasi quas	 Beatae animi'''	'''Note: Minima aliquid	 then Unde nobis'''
Amy Kent-Watson	57.0	64.1	'''Sapiente alias totam; Aliquid debitis maxime vitae similique animi 	 Ipsam pariatur'''	'''Voluptates: Debitis doloremque quo	 Aperiam exercitationem in'''
Martin Jones-Hicks	93.0	80.1	'''Maiores maiores omnis; Ipsa facilis 	 Veritatis cumque'''	'''(Sunt quaerat debitis) 	 Voluptatem maiores nostrum minus quidem saepe and Consectetur labore aut molestiae'''
Julie Walker-Ellis	19.0	24.1	'''Note: Quo sunt delectus maxime	 then Explicabo odio earum'''	'''Qui dicta	 Eos Similique delectus repellendus aspernatur'''
Mrs Sophie Tomlinson	35.0	15.1	'''(Labore nostrum) 	 Doloribus magnam omnis and Pariatur harum'''	'''Quidem laborum numquam animi; Quia tenetur vero sapiente dolor 	 Possimus sequi'''
Matthew Mitchell		2.1	'''(Tenetur esse) 	 Perspiciatis molestias and Quasi iure error'''	'''Id neque; Quasi qui 	 Reiciendis'''
Connor Mills	72.0	48.1	'''(Voluptatum quod assumenda sapiente) 	 Odio quia dicta and Eveniet asperiores in'''	'''(A corporis) 	 In voluptate and Itaque eos nesciunt nihil quas'''
Brett Johnson	57.0	48.1	'''Inventore pariatur: Nam quisquam consequuntur eaque	 Deserunt tempore adipisci quisquam'''	'''Note: Officiis quo	 then Autem modi'''
 	73.0	32.1	'''Totam sit; Fugit fugiat cumque odit ducimus 	 Voluptas facere eum'''	'''(Reiciendis velit hic occaecati iste eos) 	 Porro quas and Error alias quae'''
Miss Carolyn Hutchinson	1.0	64.1	'''Note: Delectus architecto	 then Deserunt dolor quos recusandae'''	'''Molestias nulla	 Corrupti corporis ratione minus natus Minima esse explicabo'''
Shane Murray	30.0	71.1	'''Note: Facere quisquam	 then Fuga consequuntur ducimus eligendi'''	'''Ducimus officiis saepe velit nemo	 Provident praesentium Tenetur quidem doloremque cumque error unde'''
Jonathan Patel	62.0	30.1	'''Ea eos	 Dignissimos Itaque doloremque'''	'''Corporis dolores; Quis 	 Nemo harum sequi reprehenderit sunt'''
Dr Bradley Powell	87.0	68.1	'''Note: Voluptates	 then Quaerat ad quasi'''	'''Culpa id consequuntur amet praesentium aliquid: Enim praesentium eveniet quibusdam temporibus ratione	 Ipsum eveniet'''
Antony Welch	47.0	5.1	'''(Numquam minus accusamus) 	 Voluptatibus nisi natus ut and Porro tempore voluptatem'''	'''(Asperiores fugit) 	 Molestias and Omnis ipsa cum ex suscipit voluptates'''
Chloe Cunningham	50.0	28.1	'''Consequuntur nihil; Accusantium inventore possimus soluta 	 Debitis perferendis doloribus'''	'''Est ullam nostrum tempore: Aliquam amet aliquam atque illum quisquam	 Quaerat'''
Karl Abbott	21.0	75.1	'''Delectus ullam	 Fugiat quis quae sed Doloremque commodi nemo'''	'''Repudiandae quis similique distinctio aliquid	 Asperiores deserunt nisi provident alias Commodi'''
Brenda Barnes	37.0	5.1	'''Ex dolore	 Quasi vero nobis asperiores consectetur Accusantium impedit'''	'''Note: Veritatis neque earum	 then Quam eaque'''
Ricky Marshall-Kaur	65.0	37.1	'''Note: Sunt voluptas	 then Excepturi ad ipsam neque cupiditate distinctio aperiam'''	'''Ipsum	 Corrupti aliquam Doloribus vitae qui alias'''
Rachael Pearce	38.0	68.1	'''Placeat numquam architecto consequuntur illo quaerat	 Consequatur et id Rerum'''	'''Note: At	 then Reiciendis ratione'''
Ross Walton	70.0	64.1	'''Nam consequuntur; Reiciendis eos explicabo asperiores 	 Quos'''	'''Et saepe magni: Sequi doloribus ullam	 Ad'''
Geraldine Roberts	21.0	54.1	'''Iste aliquid ex; Unde dignissimos 	 Harum eveniet'''	'''(Explicabo) 	 Soluta and Praesentium'''
Hayley Jennings	3.0	55.1	'''Neque velit adipisci	 Aliquid necessitatibus necessitatibus facilis omnis Cumque'''	'''Architecto sunt	 Facilis Aliquam ipsa vero'''
Joyce Henderson	15.0	71.1	'''Note: Alias	 then Eveniet a fugit'''	'''Vel	 Quidem incidunt a est Repellendus beatae ex ipsam fuga'''
Bernard Dobson	10.0		'''Error velit corporis	 Eos laboriosam sed Quia porro assumenda'''	'''(Corporis odio commodi) 	 Culpa fugiat a and Repellendus asperiores'''
