name,age,rating,price,note
Mr Kevin Lamb,31.0,18.1,5.2,'''Adipisci: Vero doloribus ratione, Sequi'''
Dr Bethany Taylor,57.0,80.1,57.2,'''Doloribus corrupti nostrum; Facilis consectetur , Distinctio id'''
Dr Clifford Morley,78.0,58.1,22.2,'''(Id laboriosam) , Laborum at in ratione and Pariatur'''
Mr Maurice Harding,64.0,51.1,15.2,'''Recusandae sunt: Hic laborum error quidem, Eveniet illo excepturi'''
Ms Jenna Matthews,15.0,54.1,9.2,'''(Soluta ad deleniti) , Doloremque cupiditate reiciendis and Deserunt dolores deleniti delectus tempora laudantium'''
Mrs Rachel Roberts,58.0,12.1,44.2,'''(Recusandae similique) , Velit adipisci vero and Eum reiciendis nesciunt'''
Dr Julia Conway,85.0,94.1,92.2,'''Deserunt culpa dignissimos, Amet Consectetur iusto'''
Brian Simpson,84.0,,50.2,'''Note: Laboriosam, then Nulla minus aliquid totam'''
Hazel Walsh,,32.1,82.2,'''Sequi at; Illum atque repudiandae , Doloremque veniam distinctio laudantium'''
Guy Thomas,79.0,60.1,13.2,'''Nesciunt facere; Ullam quam , Animi quibusdam nesciunt'''
Joyce Khan,79.0,100.1,73.2,'''Note: Accusantium necessitatibus, then Exercitationem nostrum voluptas voluptatum iure'''
Diane Smith,99.0,57.1,94.2,'''Maxime corrupti nulla; Iste tempore , Veritatis quaerat tempore doloremque explicabo'''
 ,35.0,12.1,25.2,'''Fugit, Ea a voluptatem deleniti asperiores Dignissimos cum'''
Bruce Holmes,64.0,49.1,43.2,'''Distinctio ipsam ipsam eaque odio reprehenderit: Voluptas asperiores quaerat, Recusandae dolorum architecto'''
Gareth Evans-Brooks,58.0,73.1,8.2,'''Asperiores delectus: Mollitia aliquid doloremque, Similique'''
Ms Dorothy Newton,46.0,54.1,17.2,'''Beatae odio necessitatibus, Corrupti neque Quasi quos commodi saepe'''
Mr Andrew Clarke,47.0,16.1,,'''Atque ullam odio dignissimos sunt, Iusto occaecati deleniti nisi Dolore'''
Ms Naomi Chan,45.0,6.1,28.2,'''Minima mollitia minima minima doloremque: Veritatis consequatur maiores excepturi, Similique facilis repellendus cupiditate ipsa'''
Mr Cameron Miah,12.0,88.1,44.2,'''Voluptates natus illo officiis consequuntur, Et Omnis'''
Natasha Webb,54.0,21.1,50.2,'''(Accusantium nostrum) , Quod dignissimos and Nobis accusamus optio'''
Chloe Palmer-Smith,59.0,85.1,32.2,'''Tenetur maxime voluptates eos mollitia dicta; Itaque eligendi vel suscipit , Harum rem'''
Keith Collins,14.0,38.1,4.2,'''Maiores reprehenderit praesentium a; Sapiente repellendus ut , Sed ullam totam impedit quo'''
Ricky Jordan,80.0,93.1,70.2,'''Note: Doloremque possimus molestias eos nesciunt, then At perferendis'''
Fiona May,58.0,21.1,32.2,'''Consequuntur vero asperiores; Optio mollitia laboriosam , Iure'''
Dr Jordan Ahmed,87.0,22.1,57.2,'''Quasi: Veniam facere, Laboriosam'''
Marion Hart,68.0,87.1,58.2,'''Repellendus inventore rem dolor quam: Amet illum harum, Molestias veritatis magni autem aperiam molestiae'''
Sian King,21.0,63.1,61.2,'''(Nobis tempore quis mollitia) , Sequi corrupti similique and Ex sapiente'''
Brandon Jones-Johnson,73.0,64.1,71.2,'''Note: Magni tempora, then Incidunt modi repellendus'''
Carl King,18.0,33.1,93.2,'''Eligendi neque; Optio , Repellendus'''
Marilyn Robertson,58.0,35.1,7.2,'''Necessitatibus, Vero voluptatum maiores Vero suscipit'''
Mrs Caroline Boyle,63.0,39.1,85.2,'''Voluptatum accusamus voluptas eum, Voluptatem quae aspernatur amet Doloremque'''
Dr Hayley Baker,27.0,74.1,72.2,'''Velit facilis illum, In incidunt incidunt Corrupti sit'''
Lydia Patel-Smith,69.0,57.1,84.2,'''Odio doloremque, Magni earum Veniam assumenda numquam'''
Russell Evans,41.0,51.1,62.2,'''Note: Corrupti necessitatibus in omnis aliquid, then Perspiciatis cupiditate'''
Stephen Harvey,18.0,23.1,76.2,'''Pariatur fugiat, Amet velit laboriosam voluptatem Quis dolorum ab'''
Stephanie Smith-Rice,1.0,24.1,41.2,'''(Velit sit atque) , Aliquam fuga and Esse sequi corporis sed blanditiis'''
Bruce Jones,1.0,93.1,85.2,'''(Neque) , Doloremque sed and Nesciunt delectus'''
