name;rating;age;remark;comment
Frederick Simpson;68.0;39.1;'''Facere; Nesciunt sit ; Ipsum vero''';'''Dicta impedit dolorem: Ab a; Ratione vero'''
Joe Donnelly;49.0;32.1;'''(Quaerat consequuntur totam animi) ; Modi ad and Eos numquam temporibus laudantium eius nobis''';'''(Eius temporibus tempora) ; Ut at vel recusandae and Reiciendis'''
Roger Adams;20.0;96.1;'''Ducimus labore voluptate animi: Provident aliquid quis sunt; Amet eos''';'''Maxime veritatis sed; Ipsum fugit ipsum ; Cum tempora'''
A;7.0;6.1;'''Quidem fuga alias quas; Illum inventore ; Laborum sed hic''';'''Ducimus quos itaque neque; Expedita recusandae At praesentium vitae consectetur'''
Andrew Smith;21.0;42.1;'''Note: Iusto ullam enim repellendus sint; then Numquam alias omnis''';'''Ad corporis cumque; Ab placeat nobis Dicta deleniti nobis perferendis'''
Kyle Murray;26.0;7.1;'''(Vero laboriosam repudiandae) ; At sed animi and Nobis cum aspernatur iusto''';'''(Molestias) ; Quidem impedit corporis occaecati dicta pariatur and Magni earum fugit officia'''
Hayley Sutton;93.0;89.1;'''Note: Voluptates incidunt; then Similique numquam''';'''(Earum labore nesciunt non) ; A repudiandae possimus unde beatae suscipit and Aspernatur'''
Diane Thomas;63.0;49.1;'''Quia magni illo vitae nam iure; Velit libero quasi sed doloremque minus ; Dolorum''';'''Repellat distinctio: Officia non vel; Quae'''
Conor Hughes;77.0;65.1;'''Dolorem doloremque harum sit: Eligendi saepe culpa facere aperiam sunt; Exercitationem''';'''Sunt; Molestiae animi dignissimos Doloribus ut'''
Julie Evans;25.0;14.1;'''Amet; Sed sequi sapiente corrupti maxime inventore ; Architecto quaerat eligendi''';'''Doloremque pariatur dolorum ex; Dolores velit nulla non asperiores ; Sapiente porro assumenda'''
Trevor Lambert;12.0;46.1;'''Quasi omnis quis; Laudantium dolor ; Omnis quam modi quibusdam''';'''Note: Quas id; then Libero id'''
Jake Simpson-Baxter;51.0;31.1;'''Ullam: Amet saepe inventore molestias; Vel atque sit ullam''';'''Note: Facilis reprehenderit totam; then Reiciendis libero maxime similique'''
Ms Joan Kennedy;60.0;98.1;'''Modi odio distinctio: Quis ipsum ea dicta facilis; Voluptatibus expedita ratione animi''';'''Consectetur; Culpa ; Perferendis'''
Catherine Iqbal;20.0;19.1;'''Note: Sequi atque amet ad; then A''';'''(Eveniet dolorem) ; Tenetur atque and Tenetur occaecati tempora'''
Clifford Smith;87.0;65.1;'''Note: Dolorem quaerat deleniti placeat architecto; then Unde tenetur aperiam earum''';'''(Quaerat harum amet laborum) ; Ducimus temporibus cupiditate natus and Vel laboriosam unde'''
Ms Linda Lloyd;49.0;72.1;'''Facilis placeat necessitatibus distinctio: Vero occaecati; Modi''';'''Maxime; Facilis magnam Ad laborum expedita totam'''
Marcus Dunn;58.0;56.1;'''Sunt non; Tenetur consectetur ; Eos praesentium aliquam''';'''Rem vero; Perferendis dolorem voluptatibus ; Labore voluptatum mollitia'''
Tracey Young;11.0;79.1;'''Note: Inventore quos voluptate; then Odio vero''';'''(Quisquam modi) ; Mollitia architecto and Delectus laudantium architecto'''
Paul Hughes;16.0;96.1;'''Note: Deleniti illo; then Tenetur necessitatibus doloremque''';'''Voluptas beatae deserunt; Exercitationem blanditiis similique Molestias'''
Bryan Williams;51.0;10.1;'''(Eos optio aut ea) ; Repellat sunt voluptatibus and Quasi libero''';'''Tempora eveniet vel perferendis tenetur facilis: Eaque quae doloribus reiciendis officia a; A quibusdam'''
Gregory Gibson-Campbell;82.0;84.1;'''Molestias distinctio: Labore libero; Recusandae sunt''';'''(Sequi pariatur) ; Non maiores officia illum and Nemo aliquid earum'''
Anne Day;48.0;;'''(Labore repellat delectus nihil deleniti) ; Ipsa consectetur and Dicta doloremque''';'''Ipsam vero suscipit alias; Tempore facilis laborum quia ; Iste id voluptatem molestiae provident'''
Sarah Bates;20.0;82.1;'''Asperiores explicabo; Doloribus laboriosam qui ; At dolorum dolorem odit officia''';'''Natus reiciendis; Architecto Explicabo'''
Eleanor Sullivan;55.0;4.1;'''Laboriosam dolore commodi: Illum; Ipsam expedita reprehenderit''';'''Note: Perferendis mollitia; then Minus'''
Ms Lauren Field;91.0;88.1;'''Ut mollitia; Iste enim officiis ; Aut hic suscipit saepe itaque''';'''Asperiores beatae: Quae repellendus velit atque; Dicta laborum esse rem placeat ut'''
Mrs Brenda Murray;53.0;99.1;'''Note: Reprehenderit delectus ducimus; then Labore excepturi facilis voluptatem''';'''(Ipsa magni unde dolorem eligendi velit) ; Necessitatibus and Velit consequuntur porro'''
Max Brown-Wallis;86.0;76.1;'''Laudantium ipsum iste: Quasi; Quas non officia sint laboriosam velit''';'''(Voluptates harum neque) ; Voluptate repellat vero soluta and Tempora ab sapiente pariatur qui'''
Dr Max Wilson;98.0;85.1;'''Quia recusandae; Dicta ipsum iure accusamus nemo dolores Necessitatibus non''';'''Blanditiis cum: Consequuntur explicabo omnis unde dicta; Laboriosam sint sit veniam'''
Frederick Martin;59.0;19.1;'''Qui; Excepturi voluptatum aut cupiditate ; Voluptates''';'''Note: Vel iusto maxime magni asperiores; then Pariatur adipisci'''
Joseph Norman;7.0;16.1;'''Note: Enim; then Veritatis''';'''Quisquam et commodi voluptatibus atque; Aliquid Atque animi'''
Ms Kerry Saunders;67.0;74.1;'''Laborum dicta id ab doloribus facilis: Minus laborum earum laborum totam; Placeat autem ea velit aperiam''';'''Officiis ex nobis exercitationem; Quod eligendi quas labore esse ; Officiis'''
Conor Carr;62.0;26.1;'''Impedit; Earum quod ex laboriosam Voluptate aperiam''';'''Itaque laborum et; Tempora sunt ; Rem voluptate eveniet'''
Miss Stephanie Manning;;49.1;'''Possimus facilis laboriosam quas doloribus; Sequi eveniet officiis Ipsum magnam occaecati''';'''(Et maiores quasi et) ; Accusamus eos nesciunt eligendi eum voluptas and Vitae amet praesentium'''
Alexandra Mellor;19.0;51.1;'''Amet dignissimos; Mollitia dolor ; Quasi voluptates aperiam''';'''Temporibus corporis; Non magnam velit veniam inventore ; Aperiam voluptatum'''
Gail Anderson;31.0;52.1;'''Note: Est sunt architecto perferendis omnis; then Officiis vel''';'''(Sequi tempore) ; Odit eos and Nemo fuga ut autem aut non'''
Dr Lynda Morris;24.0;31.1;'''Ut officiis laborum; Libero Consectetur laborum''';'''(Ad animi) ; Aspernatur commodi provident and Fugiat totam'''
Hazel Oliver;91.0;99.1;'''Doloremque; Voluptate atque aperiam quod ; Est odio cum laborum''';'''Eius deleniti tempore; Ipsam harum adipisci Reprehenderit fuga fugit ipsam'''
Abbie Smith;89.0;11.1;'''(Ipsa neque) ; Sint cumque velit velit and Hic tempora soluta magnam recusandae''';'''Tempora nam quod rerum: Delectus earum quia; Rem atque ipsum nemo quas'''
Ms Kim Anderson;67.0;82.1;'''(Excepturi sint omnis) ; Magni eveniet and Sunt eum adipisci modi numquam vitae''';'''Accusamus neque sunt quo; Reiciendis tempore Ut aut'''
Bradley Perkins;57.0;89.1;'''Cumque; Amet perferendis Sunt harum et''';'''Error voluptatibus praesentium; In impedit recusandae ; Voluptatem ex enim facilis facilis'''
Nicholas Hamilton;93.0;65.1;'''(Accusantium iste) ; Nesciunt voluptates excepturi nam sapiente and Vel''';'''Sit voluptates; Rerum accusamus sequi ; Animi aut rem'''
Margaret Hammond;68.0;58.1;'''Facilis optio temporibus exercitationem commodi optio: Exercitationem itaque; Nesciunt''';'''Note: Dolorum eveniet maxime ea atque; then Dolore fuga quaerat'''
Russell Hancock;63.0;48.1;'''Voluptatem; Exercitationem assumenda dolor ipsum ipsam magni Fugit dignissimos ratione''';'''Voluptas neque; Iure consectetur itaque praesentium explicabo beatae ; Ducimus nesciunt veniam dolorum expedita fugit'''
Francesca Miller-Jones;77.0;28.1;'''Note: Ipsum quo mollitia; then Consequuntur hic''';'''In nisi repellat quia fugiat; Nulla error Libero exercitationem'''
Brian Holland;16.0;63.1;'''Note: Reprehenderit; then Saepe dolorem asperiores''';'''Note: Dignissimos; then Asperiores consectetur distinctio veritatis'''
Henry Henderson;40.0;36.1;'''Velit in maiores; Eum dolorum nostrum temporibus provident ; Quidem voluptate architecto''';'''Note: Repellat adipisci molestias odit laudantium; then Veniam ratione reiciendis quibusdam'''
Reece Benson;92.0;23.1;'''Laudantium ipsum explicabo itaque; Quasi sunt Praesentium ratione''';'''Possimus libero velit; Eius ab assumenda beatae Nulla error'''
Dawn Dean;18.0;93.1;'''Note: Quis consectetur; then Corporis mollitia''';'''Nulla repudiandae aliquid ducimus; Alias cumque accusamus Repellat'''
Kerry Lowe-Turner;98.0;85.1;'''(Laudantium ducimus) ; At doloribus and Porro optio''';'''Quam sit: Nulla sint dolorum; Provident praesentium'''
