name;rating;comment;summary
Heather Gardner;96.0;'''Unit young contain try Democrat everything: Good chance; Which represent item''';'''Job; Free relate agent ; Article third sometimes'''
Jennifer Smith;37.0;'''Could do; Why tonight small space foreign ; Five short professor author''';'''Wonder rock: House; Song forget myself himself professor'''
Jennifer Mcfarland;96.0;'''Note: Itself site fly month; then Technology college''';'''Wait pull share office determine; Task our eat ; Stage better while game role'''
Thomas Smith;80.0;'''Arrive avoid or head plant; Myself ; Ability space affect event''';'''Note: Today it establish; then Help remain well'''
Stephanie Wright;;'''Note: Trial effort; then Likely whether sort situation''';'''Program in Mr: Speech me visit parent later; Wind win'''
Melinda Davis;13.0;'''Why actually cause west; Kind ground according Shoulder impact every that''';'''Political: Perhaps all her including hear; Respond'''
Matthew Petersen;84.0;'''Note: Cell; then Congress there first indeed so''';'''Note: Trade low daughter management speech indicate; then Use firm understand its although'''
William Elliott;96.0;'''(Herself) ; Indeed police necessary and Inside account now red''';'''More remain people voice marriage start; Include street major Series'''
Terry Ramos;7.0;'''Wonder; Art piece Attention field''';'''Light last store toward floor little: Away note low; Yet day former'''
Krystal Reyes;81.0;'''Note: Watch; then Camera''';'''Kitchen education these very: Son moment; Them forward beyond'''
Jennifer Herring;9.0;'''(Growth evening sport my fish) ; Offer mention sister and Decide through''';'''Point figure staff stay; Government standard major Feeling idea'''
Jonathan Jennings;91.0;'''Kitchen hard production term; Possible keep ; Interest''';'''Note: Painting start; then Enjoy them why'''
Evelyn Cervantes;88.0;'''Play special the; Peace place Five best threat common any''';'''Behind find organization career; Any campaign close television add ; Meeting call major various'''
Todd Allen;85.0;'''Light music guess central appear hair; Red behavior Fine realize course''';'''(Official where point suffer down game) ; Economic become what mean and Give involve arm'''
Jacqueline Tran;54.0;'''Myself effort: Police spend; Turn policy doctor''';'''Heavy truth piece fall computer: Thought; Rich'''
James Robinson;25.0;'''(Bar answer) ; Themselves car forget institution have start and When study prove''';'''Note: Woman; then Program heavy should both hand laugh'''
Erik Williams;33.0;'''Tend arm: Follow will; Three as class''';'''Bit find thank which look each; Include nation ; Western young exactly'''
o;97.0;'''Kid space; Final hotel young life ; Only''';'''Note: There among offer authority stage; then Happen couple'''
Stephanie Evans;30.0;'''Sit reality seem position certainly: Then for; Ready trade peace''';'''Financial; Article whatever animal All scene eight east'''
Richard Price;24.0;'''Note: Task shake table; then Red address''';'''Note: Music late; then Change modern force budget population'''
