username;name;salary;age;rating;message
jay_simpson_2330;Jay Simpson;21.0;57.1;26.2;'''(Commodi reprehenderit) ; Voluptatibus minima and Neque voluptatibus'''
mr_williams_5879;Mr Clive Williams;61.0;19.1;76.2;'''Sapiente esse; Dolores delectus corrupti quia ; Fugiat sint eius delectus distinctio'''
jessica_thompson_8982;Jessica Thompson;39.0;12.1;83.2;'''Esse aut nam eveniet: Sapiente; Assumenda deleniti enim laborum'''
michelle_howe_5740;Michelle Howe;69.0;24.1;5.2;'''(Rerum et aliquam cum) ; Illum cum facere ducimus quo and Explicabo perspiciatis natus'''
iain_webster_5423;Iain Webster;25.0;22.1;32.2;'''Ullam sit debitis: Numquam; Illo alias rerum aut'''
miss_hewitt_2263;Miss Natasha Hewitt;50.0;100.1;63.2;'''Voluptatem saepe libero: Iusto in at fugiat eos minus; Reiciendis unde dolore'''
mr_clark_0680;Mr Joel Clark;49.0;18.1;98.2;'''Note: Ad illum nesciunt; then Qui exercitationem necessitatibus repudiandae'''
mr_king_8548;Mr Gordon King;64.0;80.1;65.2;'''Note: Ab error; then Veniam deserunt numquam ad'''
maureen_smith_1829;Maureen Smith;100.0;71.1;;'''Modi deleniti cupiditate iusto: Ducimus sit; Ratione mollitia similique'''
albert_curtis_7476;Albert Curtis;91.0;25.1;56.2;'''Note: Culpa fugit dolore; then Eum quidem adipisci fugiat'''
frances_swift_6356;Frances Dixon-Swift;60.0;89.1;36.2;'''Velit vel officia tempora; Dolore hic mollitia alias ; Possimus ipsum quibusdam nisi nostrum'''
kimberley_singh_9716;Kimberley Singh;;97.1;12.2;'''Ex: Eaque expedita magni; Beatae tenetur totam omnis facilis eum'''
jade_bibi_1741;Jade Butcher-Bibi;4.0;90.1;20.2;'''Enim eveniet modi placeat: Hic itaque; Sint error deleniti magnam'''
rebecca_jones_0556;e;57.0;16.1;52.2;'''Note: Impedit; then Non aspernatur cupiditate ullam'''
mrs_barton_6468;Mrs Rachael Barton;41.0;42.1;9.2;'''(Maiores consequatur) ; Debitis nisi eaque expedita and Eos dicta praesentium'''
laura_thompson_1475;Laura Thompson;21.0;83.1;34.2;'''Ducimus neque tenetur; Accusantium pariatur labore quibusdam ; Magnam perferendis ipsum'''
miss_roberts_9754;Miss Leanne Roberts;33.0;;21.2;'''(Nesciunt itaque laborum enim reprehenderit adipisci) ; Ex nihil tenetur repellendus and Doloribus natus natus veritatis mollitia'''
mr_taylor_0181;Mr Dean Taylor;92.0;56.1;97.2;'''Deleniti tenetur illo autem: Enim; Placeat quaerat optio'''
mr_nolan_9375;Mr Scott Nolan;86.0;25.1;32.2;'''Ratione aspernatur temporibus nulla ratione; Exercitationem laborum error culpa corrupti Nihil deserunt numquam'''
allan_banks_6510;Allan Banks;76.0;29.1;56.2;'''Veritatis qui minus saepe: Sit eius quo voluptate sit incidunt; Tenetur suscipit praesentium'''
lawrence_smith_5286;Lawrence Cartwright-Smith;91.0;44.1;94.2;'''Illo necessitatibus saepe; Ducimus ad ; Odit consequuntur'''
lynne_davies_7500;Lynne Davies;1.0;21.1;35.2;'''Ex ab similique; Adipisci ; Necessitatibus cupiditate'''
danielle_roberts_1049;Danielle Roberts;61.0;37.1;47.2;'''Fugit placeat; Aut dolores quae quod ; Minima inventore'''
mrs_thomas_8967;Mrs Francesca Thomas;18.0;81.1;15.2;'''(Est ipsa earum qui reiciendis) ; In minus doloribus occaecati and Excepturi cum'''
dr_jackson_6535;Dr Mark Jackson;5.0;2.1;74.2;'''Quos molestiae: Molestias accusantium voluptates; Molestiae voluptas'''
mr_douglas_8101;Mr Jeremy Douglas;9.0;63.1;79.2;'''Odit architecto eos neque architecto eveniet; Dolores incidunt qui totam Consequatur sit'''
victor_oliver_7138;Victor Oliver;86.0;78.1;21.2;'''Note: Velit soluta; then Quia fugiat'''
dr_wallace_8558;Dr Ronald Wallace;25.0;33.1;69.2;'''Note: Occaecati nulla; then Nesciunt ullam tenetur quam est'''
stuart_thomson_0135;Stuart Thomson;58.0;24.1;19.2;'''(Quaerat error dolore quam ipsum) ; Harum iste labore and Itaque voluptate'''
jacob_smith_7503;Jacob Smith;29.0;4.1;26.2;'''Laborum animi; Repellendus eius omnis omnis odit ; Rem'''
dr_henderson_2972;Dr Clifford Henderson;65.0;9.1;75.2;'''Nostrum hic: Similique aliquam at; Sed'''
