username;name;total_count;review
dr_matthews_8614;Dr Marcus Matthews;28.0;'''Note: Est porro; then Rerum totam sit dolorum labore officiis'''
brett_gregory_5387;Brett Pritchard-Gregory;2.0;'''Vero pariatur hic fuga quod: Molestiae; Consequuntur rerum eaque'''
dylan_read_7177;Dylan Read;91.0;'''(Ipsum atque aspernatur) ; Quia ullam adipisci and Laboriosam illum ipsam at'''
dr_bentley_3749;Dr Wayne Bentley;52.0;'''Veritatis: Veritatis; Aut dolor perferendis'''
samantha_taylor_5156;Samantha Taylor;36.0;'''(Neque voluptatibus voluptatem) ; Sapiente commodi temporibus and Sed'''
ms_wright_8515;Ms Sara Wright;64.0;'''Debitis velit dolores illum atque incidunt; Nam unde labore Enim nihil'''
joe_miller_2755;Joe Davies-Miller;51.0;'''Accusantium aliquam; Iure ab Aliquid magnam'''
ann_hewitt_8374;Ann Hodgson-Hewitt;5.0;'''Odit quae quos quas non; Est consequatur et ; Quidem ex in ducimus aliquid'''
kayleigh_phillips_2069;e;94.0;'''(Nobis exercitationem) ; Possimus tempore placeat vel and Doloribus'''
carl_patel_4473;Carl Patel;39.0;'''Molestias ea maxime vitae corporis; Rerum voluptate quaerat tempora vel cupiditate Necessitatibus veritatis'''
bruce_green_1952;Bruce Green;89.0;'''Unde consectetur unde; Corporis molestiae tenetur minima Velit'''
howard_gallagher_6808;Howard Gallagher;31.0;'''Natus; Voluptatum autem amet ; Adipisci esse'''
mr_jones_6390;Mr Brett Jones;66.0;'''Facere; Debitis a fugit Fugit quas'''
marcus_matthews_6483;Marcus Williams-Matthews;21.0;'''Laudantium nostrum; Corporis delectus minima saepe distinctio fugit Nulla expedita assumenda'''
sarah_mills_0025;Sarah Mills;59.0;'''Corrupti dolore ea; At delectus ; A veritatis minima officiis'''
daniel_nicholson_6174;Daniel Gray-Nicholson;95.0;'''Occaecati soluta pariatur; Libero unde Magnam odio recusandae unde unde'''
lindsey_harrison_9790;Lindsey Harrison;31.0;'''Blanditiis unde eos: Fuga dolorem; Voluptatum tenetur nemo'''
ms_davis_4146;Ms Olivia Davis;53.0;'''Note: Accusamus doloremque occaecati; then Nesciunt consectetur doloribus'''
eric_lamb_7024;Eric Nash-Lamb;76.0;'''Distinctio quidem sunt similique corporis: Perspiciatis; Natus ducimus soluta'''
nicola_adams_9390;Nicola Adams;38.0;'''Consectetur exercitationem quasi: Delectus ipsa voluptatibus; Fugiat cum quod rem'''
jason_martin_3743;Jason Gray-Martin;55.0;'''Nam impedit doloribus sed assumenda; Iste ; Molestiae'''
melanie_taylor_9355;Melanie Taylor;68.0;'''Note: Eum unde a; then Non neque quasi repudiandae'''
shirley_donnell_1333;'Shirley O''Donnell';26.0;'''Maxime dolorum aspernatur odio: Iusto adipisci porro; Incidunt similique'''
francis_douglas_3519;Francis Douglas;10.0;'''(Quod minus) ; Itaque repudiandae quidem and Enim expedita est'''
sarah_butler_7479;Sarah Butler;90.0;'''Quod distinctio ex; Praesentium praesentium consequatur ; Est exercitationem provident'''
dr_foster_5072;Dr Jasmine Foster;94.0;'''(Voluptate hic) ; Blanditiis ratione illum and Totam repellendus necessitatibus error cupiditate'''
dr_gregory_9643;Dr Mathew Gregory;65.0;'''Alias debitis; Error voluptas ducimus ; Quam ratione'''
edward_white_8259;Edward White;94.0;'''(Animi quia voluptas error) ; Iure veniam error labore and Rerum illum possimus'''
bradley_hunt_9569;Bradley Smart-Hunt;64.0;'''Officia; Nulla hic aliquam eveniet dignissimos Velit eum laboriosam repellat'''
diane_smith_0520;Diane Smith;58.0;'''Illum; Maiores soluta autem porro Debitis vitae'''
stacey_mckenzie_6917;Stacey McKenzie;;'''Magnam repellendus: Adipisci nemo est fuga; Nemo corporis asperiores'''
molly_fox_2307;Molly Fox;100.0;'''Aliquid distinctio; Nesciunt nemo ; Ratione'''
christine_harding_2214;Christine Harding;25.0;'''(Dolorum) ; Minus ipsa ad unde amet and Rem architecto'''
nicola_harrison_7880;Nicola Ellis-Harrison;38.0;'''Est placeat perspiciatis; Voluptates ullam officiis incidunt nostrum Amet aliquam eveniet quibusdam vero'''
jasmine_jackson_4116;Jasmine Bennett-Jackson;35.0;'''Necessitatibus asperiores soluta ab atque: Animi; Dolorum necessitatibus'''
miss_barnes_7869;Miss Mandy Barnes;35.0;'''Molestiae nobis: Fugiat aspernatur nam; Illum natus ullam sequi accusamus porro'''
katy_ford_7969;Katy Ford;94.0;'''Ex nobis; Exercitationem eum at ; Suscipit itaque'''
colin_holden_2399;Colin Holden;16.0;'''Ab iure est; Voluptate id ; Debitis commodi quos cum'''
olivia_watkins_0895;Olivia Watkins;69.0;'''Note: Placeat omnis repellat sint unde; then Ipsum repudiandae at explicabo quis et ipsa'''
lynne_bishop_8819;Lynne Wilson-Bishop;91.0;'''Dolore voluptas; Eveniet occaecati necessitatibus voluptate Rem atque unde'''
leanne_rowe_7645;Leanne Hill-Rowe;55.0;'''Note: Magnam incidunt dolorum; then Rerum ratione quam nostrum'''
harry_alexander_4618;Harry Weston-Alexander;55.0;'''(Aspernatur modi blanditiis) ; Doloremque aspernatur blanditiis vel dicta similique and Numquam recusandae eos beatae'''
ms_garner_6546;Ms Claire Garner;18.0;'''Delectus; Dolorem laborum repellendus ; Fugit sapiente dolorem iure enim'''
