name	username	price	review	comment
Sam Pickering-Grant	sam_grant_6468	38.0	"""Quod vero alias; Modi voluptas inventore 	 Corrupti fugit dolor beatae"""	"""Voluptatem reiciendis esse perferendis odio; Cumque eveniet 	 Assumenda dolor nihil alias debitis a"""
x	mr_campbell_5389	29.0	"""(Possimus omnis cumque nam) 	 Eos nemo and Perferendis voluptatum blanditiis"""	"""Blanditiis; Unde laborum alias ad voluptate atque 	 Tenetur reiciendis"""
Jacqueline Cameron-Parker	jacqueline_parker_0364	82.0	"""Quisquam	 Molestias nostrum occaecati aspernatur nobis Dignissimos"""	"""(Sit consequuntur voluptate autem dolorum) 	 Porro eos velit quod and Temporibus ullam doloribus"""
Mr Kyle Chapman	mr_chapman_5519	61.0	"""Aut voluptate: Officiis consectetur sequi	 Excepturi animi esse"""	"""Esse nesciunt odit porro	 Accusamus nobis At dolores sed"""
Alex Nash-Jackson	alex_jackson_9791	57.0	"""Architecto non minus architecto fugiat: Dolor accusamus	 Explicabo soluta hic nihil aperiam vero perferendis"""	"""(Accusamus) 	 A ipsam voluptate voluptatibus and Soluta maiores quia eos dolore"""
Christian Bennett	christian_bennett_3097	67.0	"""(Omnis asperiores perspiciatis deserunt corrupti rem) 	 Distinctio doloribus beatae and Error ab"""	"""Sunt: Exercitationem voluptate necessitatibus ipsam consectetur	 Nam"""
Jeffrey Pritchard	jeffrey_pritchard_3325	22.0	"""Dignissimos nobis eligendi veritatis officiis delectus: Aliquam illo maxime quis corrupti	 Sequi"""	"""Note: Consequuntur	 then Recusandae corporis debitis"""
Donna Preston-Edwards	donna_edwards_4459	9.0	"""Dolorem in commodi: Possimus rem iste doloremque	 Laboriosam quod aspernatur pariatur reprehenderit"""	"""(Minima saepe dicta) 	 Tenetur and Voluptate nobis sapiente expedita"""
Mrs Dorothy Baker	mrs_baker_8669	78.0	"""(Reprehenderit) 	 Deserunt veniam consequatur and Quos voluptatum minima sequi"""	"""Explicabo amet; Neque placeat 	 Dicta ea aperiam perferendis distinctio"""
Denis Rees	denis_rees_1202	62.0	"""Note: Quia eligendi	 then Ipsum nam facilis a error"""	"""(Ab reprehenderit dolore) 	 Molestiae quaerat ad and Mollitia quo tempore provident"""
Mr Antony Martin	mr_martin_5712	55.0	"""Doloribus error: Voluptatem ratione reiciendis neque	 Laboriosam consequatur illum quae"""	"""Pariatur: Odit	 Reiciendis minus nulla"""
Barbara Fowler	barbara_fowler_1584	3.0	"""(Consequuntur voluptatem) 	 Corporis praesentium and Nesciunt dolorem"""	"""Reprehenderit eum: Numquam magni illum dolores similique	 Sapiente commodi soluta voluptatem"""
Antony Burton	antony_burton_9107	19.0	"""Note: Amet voluptatem	 then Architecto necessitatibus temporibus"""	"""Quos consequuntur	 Voluptatum tempora laudantium Totam possimus amet"""
Cameron Robinson-Brown	cameron_brown_6576	100.0	"""Molestiae exercitationem fugiat	 Numquam corporis magni animi Magnam dicta veniam sapiente sint"""	"""(Nam ad molestias accusantium nostrum) 	 Dolore error molestias sint and Dolores soluta enim"""
Martin Newton-Taylor	martin_taylor_0174	71.0	"""Accusantium eligendi: Doloribus dolore	 Error nostrum quisquam"""	"""Note: Hic alias quia	 then Sapiente fugiat totam"""
Phillip Duffy-Parry	phillip_parry_3758	47.0	"""(Dolorem quis commodi) 	 Voluptatibus and Aliquid enim natus"""	"""Note: Accusamus repudiandae aliquam ratione	 then Illo non"""
Gerald Morris	gerald_morris_6270	2.0	"""Suscipit: Optio nihil	 Accusamus velit repellat"""	"""Note: Esse	 then Voluptatibus officiis"""
Mr Adam Armstrong	mr_armstrong_2961	88.0	"""Maiores inventore voluptate	 Ullam Rerum natus quos"""	"""Illo officiis libero quaerat: Repellat nihil	 Doloremque velit quia"""
Hugh Matthews	hugh_matthews_8111	99.0	"""Quae voluptatum laborum: Officiis asperiores quia	 Voluptatum perspiciatis"""	"""Praesentium distinctio consectetur; Architecto harum nobis 	 Quis voluptas"""
Helen Hudson-Gill	helen_gill_0320		"""Voluptatibus ullam non nesciunt	 Saepe Repellendus molestias debitis optio labore enim"""	"""Note: Inventore sit illum deserunt	 then Molestiae vel quis"""
