name,age,salary,total_count,description
Gerald Dennis,32.0,93.1,98.2,'''Fugiat dolore at, Fugiat ipsam laboriosam Exercitationem magni'''
Kenneth Peacock,5.0,69.1,77.2,'''Note: Laborum sequi ducimus, then In repellat quisquam harum numquam nam'''
Kathleen Bentley,79.0,75.1,17.2,'''Minima repellat ad nam; Non odio a perspiciatis tempore neque , Illum quod eius'''
Tracy Walker,99.0,46.1,81.2,'''Note: Saepe officia eius dicta, then Aliquid tempora animi'''
Mr Glen Black,16.0,65.1,49.2,'''(Tenetur illum maxime quam doloremque) , Ducimus dicta and Modi expedita'''
Ricky Hall,1.0,41.1,9.2,'''Minus porro: Voluptatem minus magni nostrum ducimus, Nostrum ullam dignissimos'''
Rachel Hutchinson,88.0,92.1,65.2,'''A, Accusantium placeat laudantium necessitatibus enim Error quis vero perspiciatis omnis sint'''
Aaron Evans,39.0,81.1,32.2,'''(Officia nemo enim) , Aspernatur excepturi and Quibusdam'''
Abbie Cooper,67.0,95.1,33.2,'''Repellendus; Consectetur voluptatibus temporibus numquam , Maiores voluptatum laborum'''
Miss Lynne Field,94.0,88.1,8.2,'''Numquam eius corrupti ut incidunt dolorum: Commodi, Quibusdam perferendis'''
Gemma Gill,67.0,65.1,47.2,'''Enim; Rerum vero voluptate blanditiis , Ad laboriosam facilis quis'''
Eric Burke-Williamson,85.0,45.1,75.2,'''Impedit sint quas dolorem: Debitis eius officiis odit, Veritatis numquam voluptas'''
Marc Taylor,69.0,84.1,5.2,'''Note: Quisquam ab, then Et dolor consequuntur molestias voluptatibus'''
Ms Jenna Parkes,90.0,61.1,2.2,'''Fugit doloremque molestias, Debitis velit voluptate in Neque delectus eius id'''
Lynne Stanley,34.0,28.1,80.2,'''Dignissimos non dicta adipisci, Mollitia maxime est voluptas ut Ipsam quisquam necessitatibus'''
Darren Rose-Patel,19.0,31.1,40.2,'''Accusantium in; Vitae ipsam nam laboriosam , Repellendus facere soluta'''
Elaine Glover,,26.1,87.2,'''Nulla sit ut cupiditate optio facilis distinctio; Est accusamus , Repellat eveniet alias'''
Melanie Taylor,82.0,63.1,60.2,'''Dolor; Consequuntur hic beatae , Debitis deleniti'''
e,55.0,16.1,57.2,'''(Repudiandae similique magnam) , Dicta non iste and Veritatis omnis doloremque'''
Darren Hanson,67.0,59.1,10.2,'''Ducimus, Nemo nam Iure consectetur'''
Dr Bernard Hunt,59.0,28.1,44.2,'''Voluptatem fugiat; Eaque , Cum vel vitae'''
Ryan Walsh-Williamson,57.0,73.1,50.2,'''Necessitatibus ratione architecto: Sequi ea impedit sit, Assumenda nulla facere quae'''
Gareth Turner,15.0,16.1,99.2,'''Facere quam, Placeat doloremque deserunt molestiae consectetur temporibus Illum officiis voluptates cumque'''
Ms Samantha Mistry,15.0,59.1,67.2,'''(Quod distinctio) , Aspernatur velit and Ipsam accusantium'''
Dr Gerald Hussain,83.0,21.1,68.2,'''Note: Molestias, then Sit tempora ducimus'''
Joshua Coles,11.0,51.1,85.2,'''Quidem accusantium quo tempora id; Officiis nostrum totam itaque , Laboriosam occaecati'''
Billy Wong-Evans,93.0,48.1,52.2,'''Note: Facere dolor maiores, then Nemo'''
Mrs Jessica Dunn,66.0,92.1,92.2,'''Note: Perferendis, then Impedit'''
Craig Warner,85.0,72.1,75.2,'''Note: Tempore facere vel, then Cum ducimus'''
Louis White,33.0,3.1,68.2,'''(Reiciendis error) , Laboriosam recusandae sunt tempora and Assumenda alias corporis corporis'''
Jennifer Green,21.0,72.1,74.2,'''Quia suscipit sed id totam, Eius Deleniti iure'''
Marion Clarke,50.0,94.1,75.2,'''Note: Suscipit minima quas iste, then Alias quidem'''
Mr Scott Rose,1.0,86.1,96.2,'''Quis doloremque inventore, Delectus consequuntur eligendi nam minus hic Voluptates deleniti corrupti eius delectus occaecati'''
Mr Trevor Mills,54.0,85.1,10.2,'''Similique voluptas corporis aliquam omnis dolor praesentium; Commodi id , Repellat'''
Jonathan Payne,83.0,87.1,37.2,'''(Voluptatem error quas fuga) , Vel iure assumenda and Eum explicabo debitis'''
Jasmine Mills-Cunningham,39.0,92.1,,'''Beatae dolorem id; Unde at autem , Quisquam'''
Mr Elliott Abbott,71.0,24.1,79.2,'''(Debitis rem consequuntur) , Rem totam eaque and Accusantium quam'''
Donald Bruce-Evans,53.0,61.1,35.2,'''Voluptates eligendi eaque: Deserunt, Voluptatem recusandae dolore'''
David Middleton,10.0,75.1,24.2,'''Modi omnis placeat; Architecto eum facilis , Consequatur quasi architecto consequatur sequi'''
Philip Dawson-Cooper,87.0,,77.2,'''Note: Ipsam consequatur quasi odio, then Aliquid autem accusamus'''
Diana Rogers,19.0,94.1,67.2,'''Repellat dolorem nam; Ducimus modi dolorum commodi mollitia , Placeat'''
Dr Harriet Smith,98.0,58.1,85.2,'''Consectetur corrupti cumque provident; Sunt doloribus quod inventore minima cupiditate , Quam'''
Glen Cox,19.0,13.1,10.2,'''Temporibus asperiores: Consequuntur delectus, Veritatis nisi natus nemo'''
Lesley Allen,1.0,91.1,71.2,'''Ut natus illo sit ea: Amet eligendi, Possimus consectetur aliquid nulla'''
